0	go to my baptism of my niece tab	teamspace_navigate	teams	go to my <teamspace_tab> baptism of my niece </teamspace_tab> tab
0	go to my send items to kevin tab	teamspace_navigate	teams	go to my <teamspace_tab> send items to kevin </teamspace_tab> tab
0	go to my james' birthday tab	teamspace_navigate	teams	go to my <teamspace_tab> james' birthday </teamspace_tab> tab
0	go to my observation drive tab	teamspace_navigate	teams	go to my <teamspace_tab> observation drive </teamspace_tab> tab
0	go to my shoe size tab	teamspace_navigate	teams	go to my <teamspace_tab> shoe size </teamspace_tab> tab
0	go to my eat ice cream tab	teamspace_navigate	teams	go to my <teamspace_tab> eat ice cream </teamspace_tab> tab
0	go to my mary ' s bash meeting tab	teamspace_navigate	teams	go to my <teamspace_tab> mary ' s bash meeting </teamspace_tab> tab
0	go to my appointment for bbq tab	teamspace_navigate	teams	go to my <teamspace_tab> appointment for bbq </teamspace_tab> tab
0	go to my laura picks up kids tab	teamspace_navigate	teams	go to my <teamspace_tab> laura picks up kids </teamspace_tab> tab
0	go to my t tab	teamspace_navigate	teams	go to my <teamspace_tab> t </teamspace_tab> tab
0	go to my appointment with brad tab	teamspace_navigate	teams	go to my <teamspace_tab> appointment with brad </teamspace_tab> tab
0	go to my swear to god tab	teamspace_navigate	teams	go to my <teamspace_tab> swear to god </teamspace_tab> tab
0	go to my quit my neisd job tab	teamspace_navigate	teams	go to my <teamspace_tab> quit my neisd job </teamspace_tab> tab
0	go to my state farm marshall meeting minutes tab	teamspace_navigate	teams	go to my <teamspace_tab> state farm marshall meeting minutes </teamspace_tab> tab
0	go to my food stamps tab	teamspace_navigate	teams	go to my <teamspace_tab> food stamps </teamspace_tab> tab
0	go to my christmas party invitation list tab	teamspace_navigate	teams	go to my <teamspace_tab> christmas party invitation list </teamspace_tab> tab
0	go to my lemote laboratory tab	teamspace_navigate	teams	go to my <teamspace_tab> lemote laboratory </teamspace_tab> tab
0	go to my wake up lin tab	teamspace_navigate	teams	go to my <teamspace_tab> wake up lin </teamspace_tab> tab
0	go to my discuss how rubbish auto layout is tab	teamspace_navigate	teams	go to my <teamspace_tab> discuss how rubbish auto layout is </teamspace_tab> tab
0	go to my date jason tab	teamspace_navigate	teams	go to my <teamspace_tab> date jason </teamspace_tab> tab
0	go to my drawing meetings tab	teamspace_navigate	teams	go to my <teamspace_tab> drawing meetings </teamspace_tab> tab
0	go to my lancaster tab	teamspace_navigate	teams	go to my <teamspace_tab> lancaster </teamspace_tab> tab
0	go to my barrens report manuscript tab	teamspace_navigate	teams	go to my <teamspace_tab> barrens report manuscript </teamspace_tab> tab
0	go to my air gathering meeting tab	teamspace_navigate	teams	go to my <teamspace_tab> air gathering meeting </teamspace_tab> tab
0	go to my review the books tab	teamspace_navigate	teams	go to my <teamspace_tab> review the books </teamspace_tab> tab
0	go to my appointment for baby tab	teamspace_navigate	teams	go to my <teamspace_tab> appointment for baby </teamspace_tab> tab
0	go to my search for dresses in barn tab	teamspace_navigate	teams	go to my <teamspace_tab> search for dresses in barn </teamspace_tab> tab
0	go to my were marty tab	teamspace_navigate	teams	go to my <teamspace_tab> were marty </teamspace_tab> tab
0	go to my reimbursement tab	teamspace_navigate	teams	go to my <teamspace_tab> reimbursement </teamspace_tab> tab
0	go to my verses the rest of the world tab	teamspace_navigate	teams	go to my <teamspace_tab> verses the rest of the world </teamspace_tab> tab
0	go to my some really long text so that takes up a lot of space on disk in heat tab	teamspace_navigate	teams	go to my <teamspace_tab> some really long text so that takes up a lot of space on disk in heat </teamspace_tab> tab
0	go to my condo board tab	teamspace_navigate	teams	go to my <teamspace_tab> condo board </teamspace_tab> tab
0	go to my checklist for today tab	teamspace_navigate	teams	go to my <teamspace_tab> checklist for today </teamspace_tab> tab
0	go to my one hundred and seven tab	teamspace_navigate	teams	go to my <teamspace_tab> one hundred and seven </teamspace_tab> tab
0	go to my work party tab	teamspace_navigate	teams	go to my <teamspace_tab> work party </teamspace_tab> tab
0	go to my bridge closure tab	teamspace_navigate	teams	go to my <teamspace_tab> bridge closure </teamspace_tab> tab
0	go to my meeting with vernon tab	teamspace_navigate	teams	go to my <teamspace_tab> meeting with vernon </teamspace_tab> tab
0	go to my take meredith out tab	teamspace_navigate	teams	go to my <teamspace_tab> take meredith out </teamspace_tab> tab
0	go to my no my birthday tab	teamspace_navigate	teams	go to my <teamspace_tab> no my birthday </teamspace_tab> tab
0	go to my call robbie tab	teamspace_navigate	teams	go to my <teamspace_tab> call robbie </teamspace_tab> tab
0	go to my cpa p pick up tab	teamspace_navigate	teams	go to my <teamspace_tab> cpa p pick up </teamspace_tab> tab
0	go to my pick up laundry tab	teamspace_navigate	teams	go to my <teamspace_tab> pick up laundry </teamspace_tab> tab
0	go to my watch traffic tab	teamspace_navigate	teams	go to my <teamspace_tab> watch traffic </teamspace_tab> tab
0	go to my bring macarenas tab	teamspace_navigate	teams	go to my <teamspace_tab> bring macarenas </teamspace_tab> tab
0	go to my excercize tab	teamspace_navigate	teams	go to my <teamspace_tab> excercize </teamspace_tab> tab
0	go to my horse tab	teamspace_navigate	teams	go to my <teamspace_tab> horse </teamspace_tab> tab
0	go to my pediatric appointment for henry tab	teamspace_navigate	teams	go to my <teamspace_tab> pediatric appointment for henry </teamspace_tab> tab
0	go to my doctor mccurdy dental tab	teamspace_navigate	teams	go to my <teamspace_tab> doctor mccurdy dental </teamspace_tab> tab
0	go to my appointment with brianna tab	teamspace_navigate	teams	go to my <teamspace_tab> appointment with brianna </teamspace_tab> tab
0	go to my joe and pam upstairs tab	teamspace_navigate	teams	go to my <teamspace_tab> joe and pam upstairs </teamspace_tab> tab
0	go to my morning meeting at work tab	teamspace_navigate	teams	go to my <teamspace_tab> morning meeting at work </teamspace_tab> tab
0	go to my oral appointment tab	teamspace_navigate	teams	go to my <teamspace_tab> oral appointment </teamspace_tab> tab
0	go to my mom ' s birthday tab	teamspace_navigate	teams	go to my <teamspace_tab> mom ' s birthday </teamspace_tab> tab
0	go to my payroll tab	teamspace_navigate	teams	go to my <teamspace_tab> payroll </teamspace_tab> tab
0	go to my test dot text tab	teamspace_navigate	teams	go to my <teamspace_tab> test dot text </teamspace_tab> tab
0	go to my bristol tab	teamspace_navigate	teams	go to my <teamspace_tab> bristol </teamspace_tab> tab
0	go to my belmont oasis tab	teamspace_navigate	teams	go to my <teamspace_tab> belmont oasis </teamspace_tab> tab
0	go to my husband is having surgery tab	teamspace_navigate	teams	go to my <teamspace_tab> husband is having surgery </teamspace_tab> tab
0	go to my meet scott tab	teamspace_navigate	teams	go to my <teamspace_tab> meet scott </teamspace_tab> tab
0	go to my mango tab	teamspace_navigate	teams	go to my <teamspace_tab> mango </teamspace_tab> tab
0	go to my rideshare tab	teamspace_navigate	teams	go to my <teamspace_tab> rideshare </teamspace_tab> tab
0	go to my it ' s on test tab	teamspace_navigate	teams	go to my <teamspace_tab> it ' s on test </teamspace_tab> tab
0	go to my algebra lessons tab	teamspace_navigate	teams	go to my <teamspace_tab> algebra lessons </teamspace_tab> tab
0	go to my boiling tab	teamspace_navigate	teams	go to my <teamspace_tab> boiling </teamspace_tab> tab
0	go to my having an exam tab	teamspace_navigate	teams	go to my <teamspace_tab> having an exam </teamspace_tab> tab
0	go to my appointment for coke install tab	teamspace_navigate	teams	go to my <teamspace_tab> appointment for coke install </teamspace_tab> tab
0	go to my voice lessons for kim tab	teamspace_navigate	teams	go to my <teamspace_tab> voice lessons for kim </teamspace_tab> tab
0	go to my colorado tab	teamspace_navigate	teams	go to my <teamspace_tab> colorado </teamspace_tab> tab
0	go to my pap smear tab	teamspace_navigate	teams	go to my <teamspace_tab> pap smear </teamspace_tab> tab
0	go to my antoinette ' s birthday tab	teamspace_navigate	teams	go to my <teamspace_tab> antoinette ' s birthday </teamspace_tab> tab
0	go to my go to part time job tab	teamspace_navigate	teams	go to my <teamspace_tab> go to part time job </teamspace_tab> tab
0	go to my mini repair service tab	teamspace_navigate	teams	go to my <teamspace_tab> mini repair service </teamspace_tab> tab
0	go to my clothing tab	teamspace_navigate	teams	go to my <teamspace_tab> clothing </teamspace_tab> tab
0	go to my bicycle race tab	teamspace_navigate	teams	go to my <teamspace_tab> bicycle race </teamspace_tab> tab
0	go to my change the tire tab	teamspace_navigate	teams	go to my <teamspace_tab> change the tire </teamspace_tab> tab
0	go to my call sammy tab	teamspace_navigate	teams	go to my <teamspace_tab> call sammy </teamspace_tab> tab
0	go to my maths exam tab	teamspace_navigate	teams	go to my <teamspace_tab> maths exam </teamspace_tab> tab
0	go to my hamster tab	teamspace_navigate	teams	go to my <teamspace_tab> hamster </teamspace_tab> tab
0	go to my at location sound tab	teamspace_navigate	teams	go to my <teamspace_tab> at location sound </teamspace_tab> tab
0	go to my hobby tab	teamspace_navigate	teams	go to my <teamspace_tab> hobby </teamspace_tab> tab
0	go to my executive meeting tab	teamspace_navigate	teams	go to my <teamspace_tab> executive meeting </teamspace_tab> tab
0	go to my walmart tab	teamspace_navigate	teams	go to my <teamspace_tab> walmart </teamspace_tab> tab
0	go to my teleconference 3035555555 tab	teamspace_navigate	teams	go to my <teamspace_tab> teleconference 3035555555 </teamspace_tab> tab
0	go to my call in the afternoon tab	teamspace_navigate	teams	go to my <teamspace_tab> call in the afternoon </teamspace_tab> tab
0	go to my cycle tab	teamspace_navigate	teams	go to my <teamspace_tab> cycle </teamspace_tab> tab
0	go to my driving school tab	teamspace_navigate	teams	go to my <teamspace_tab> driving school </teamspace_tab> tab
0	go to my jewish holidays tab	teamspace_navigate	teams	go to my <teamspace_tab> jewish holidays </teamspace_tab> tab
0	go to my meeting mom tab	teamspace_navigate	teams	go to my <teamspace_tab> meeting mom </teamspace_tab> tab
0	go to my study geography tab	teamspace_navigate	teams	go to my <teamspace_tab> study geography </teamspace_tab> tab
0	go to my xmas list tab	teamspace_navigate	teams	go to my <teamspace_tab> xmas list </teamspace_tab> tab
0	go to my half term for schools tab	teamspace_navigate	teams	go to my <teamspace_tab> half term for schools </teamspace_tab> tab
0	go to my start of fish husbandry lab tab	teamspace_navigate	teams	go to my <teamspace_tab> start of fish husbandry lab </teamspace_tab> tab
0	go to my trip to east coast tab	teamspace_navigate	teams	go to my <teamspace_tab> trip to east coast </teamspace_tab> tab
0	go to my groceries to buy tab	teamspace_navigate	teams	go to my <teamspace_tab> groceries to buy </teamspace_tab> tab
0	go to my vignette tab	teamspace_navigate	teams	go to my <teamspace_tab> vignette </teamspace_tab> tab
0	go to my birthday anne tab	teamspace_navigate	teams	go to my <teamspace_tab> birthday anne </teamspace_tab> tab
0	go to my unit lunch tab	teamspace_navigate	teams	go to my <teamspace_tab> unit lunch </teamspace_tab> tab
0	go to my pick up summer ' s cake tab	teamspace_navigate	teams	go to my <teamspace_tab> pick up summer ' s cake </teamspace_tab> tab
0	go to my obstetrician appointment tab	teamspace_navigate	teams	go to my <teamspace_tab> obstetrician appointment </teamspace_tab> tab
0	go to my hike tab	teamspace_navigate	teams	go to my <teamspace_tab> hike </teamspace_tab> tab
0	go to my catering event tab	teamspace_navigate	teams	go to my <teamspace_tab> catering event </teamspace_tab> tab
0	go to my centre parks with emily tab	teamspace_navigate	teams	go to my <teamspace_tab> centre parks with emily </teamspace_tab> tab
0	go to my start making dinner tab	teamspace_navigate	teams	go to my <teamspace_tab> start making dinner </teamspace_tab> tab
0	go to my projects tab	teamspace_navigate	teams	go to my <teamspace_tab> projects </teamspace_tab> tab
0	go to my holly springs high school registration meeting tab	teamspace_navigate	teams	go to my <teamspace_tab> holly springs high school registration meeting </teamspace_tab> tab
0	go to my nineteen thirty tab	teamspace_navigate	teams	go to my <teamspace_tab> nineteen thirty </teamspace_tab> tab
0	go to my idol deb gig parish pump tab	teamspace_navigate	teams	go to my <teamspace_tab> idol deb gig parish pump </teamspace_tab> tab
0	go to my doctor office tab	teamspace_navigate	teams	go to my <teamspace_tab> doctor office </teamspace_tab> tab
0	go to my valentine dinner tab	teamspace_navigate	teams	go to my <teamspace_tab> valentine dinner </teamspace_tab> tab
0	go to my lunches tab	teamspace_navigate	teams	go to my <teamspace_tab> lunches </teamspace_tab> tab
0	go to my camry maintenance tab	teamspace_navigate	teams	go to my <teamspace_tab> camry maintenance </teamspace_tab> tab
0	go to my alice in wonderland tab	teamspace_navigate	teams	go to my <teamspace_tab> alice in wonderland </teamspace_tab> tab
0	go to my vacation clothing tab	teamspace_navigate	teams	go to my <teamspace_tab> vacation clothing </teamspace_tab> tab
0	go to my things to get at the store tab	teamspace_navigate	teams	go to my <teamspace_tab> things to get at the store </teamspace_tab> tab
0	go to my swim tab	teamspace_navigate	teams	go to my <teamspace_tab> swim </teamspace_tab> tab
0	go to my see movie tab	teamspace_navigate	teams	go to my <teamspace_tab> see movie </teamspace_tab> tab
0	go to my drop katie tab	teamspace_navigate	teams	go to my <teamspace_tab> drop katie </teamspace_tab> tab
0	go to my dr sharma appt tab	teamspace_navigate	teams	go to my <teamspace_tab> dr sharma appt </teamspace_tab> tab
0	go to my appointment with my girlfriends tab	teamspace_navigate	teams	go to my <teamspace_tab> appointment with my girlfriends </teamspace_tab> tab
0	go to my presentatio 2 tab	teamspace_navigate	teams	go to my <teamspace_tab> presentatio 2 </teamspace_tab> tab
0	go to my polly and alice tab	teamspace_navigate	teams	go to my <teamspace_tab> polly and alice </teamspace_tab> tab
0	go to my party at mom's tab	teamspace_navigate	teams	go to my <teamspace_tab> party at mom's </teamspace_tab> tab
0	go to my send in the contract tab	teamspace_navigate	teams	go to my <teamspace_tab> send in the contract </teamspace_tab> tab
0	go to my finish timesheet tab	teamspace_navigate	teams	go to my <teamspace_tab> finish timesheet </teamspace_tab> tab
0	go to my appointment at malvern theatres tab	teamspace_navigate	teams	go to my <teamspace_tab> appointment at malvern theatres </teamspace_tab> tab
0	go to my doctor frankel tab	teamspace_navigate	teams	go to my <teamspace_tab> doctor frankel </teamspace_tab> tab
0	go to my elizabeth exam tab	teamspace_navigate	teams	go to my <teamspace_tab> elizabeth exam </teamspace_tab> tab
0	go to my call scott with the moving company tab	teamspace_navigate	teams	go to my <teamspace_tab> call scott with the moving company </teamspace_tab> tab
0	go to my group appointment tab	teamspace_navigate	teams	go to my <teamspace_tab> group appointment </teamspace_tab> tab
0	go to my pan date stop tab	teamspace_navigate	teams	go to my <teamspace_tab> pan date stop </teamspace_tab> tab
0	go to my meet steve tab	teamspace_navigate	teams	go to my <teamspace_tab> meet steve </teamspace_tab> tab
0	go to my arg meeting tab	teamspace_navigate	teams	go to my <teamspace_tab> arg meeting </teamspace_tab> tab
0	go to my eye testing tab	teamspace_navigate	teams	go to my <teamspace_tab> eye testing </teamspace_tab> tab
0	go to my put the oven on tab	teamspace_navigate	teams	go to my <teamspace_tab> put the oven on </teamspace_tab> tab
0	go to my searching 20 tab	teamspace_navigate	teams	go to my <teamspace_tab> searching 20 </teamspace_tab> tab
0	go to my shoot a video of a basketball game for larry easley tab	teamspace_navigate	teams	go to my <teamspace_tab> shoot a video of a basketball game for larry easley </teamspace_tab> tab
0	go to my lilly ' s birthday tab	teamspace_navigate	teams	go to my <teamspace_tab> lilly ' s birthday </teamspace_tab> tab
0	go to my kohl's tab	teamspace_navigate	teams	go to my <teamspace_tab> kohl's </teamspace_tab> tab
0	go to my cancel service for trugreen tab	teamspace_navigate	teams	go to my <teamspace_tab> cancel service for trugreen </teamspace_tab> tab
0	go to my national aids council system configuration tab	teamspace_navigate	teams	go to my <teamspace_tab> national aids council system configuration </teamspace_tab> tab
0	go to my second hand market tab	teamspace_navigate	teams	go to my <teamspace_tab> second hand market </teamspace_tab> tab
0	go to my max in casual and gold coin donation tab	teamspace_navigate	teams	go to my <teamspace_tab> max in casual and gold coin donation </teamspace_tab> tab
0	go to my meeting with emc tab	teamspace_navigate	teams	go to my <teamspace_tab> meeting with emc </teamspace_tab> tab
0	go to my ask to vacuum the house tab	teamspace_navigate	teams	go to my <teamspace_tab> ask to vacuum the house </teamspace_tab> tab
0	go to my aromatherapy recipes tab	teamspace_navigate	teams	go to my <teamspace_tab> aromatherapy recipes </teamspace_tab> tab
0	go to my i or tyler tab	teamspace_navigate	teams	go to my <teamspace_tab> i or tyler </teamspace_tab> tab
0	go to my wordpad tab	teamspace_navigate	teams	go to my <teamspace_tab> wordpad </teamspace_tab> tab
0	go to my business 2 tab	teamspace_navigate	teams	go to my <teamspace_tab> business 2 </teamspace_tab> tab
0	go to my hotbar tab	teamspace_navigate	teams	go to my <teamspace_tab> hotbar </teamspace_tab> tab
0	go to my send two thousand rupis to my friend tab	teamspace_navigate	teams	go to my <teamspace_tab> send two thousand rupis to my friend </teamspace_tab> tab
0	go to my arrow tab	teamspace_navigate	teams	go to my <teamspace_tab> arrow </teamspace_tab> tab
0	go to my wegmans shopping tab	teamspace_navigate	teams	go to my <teamspace_tab> wegmans shopping </teamspace_tab> tab
0	go to my study hall tab	teamspace_navigate	teams	go to my <teamspace_tab> study hall </teamspace_tab> tab
0	go to my auto appointment for my buick tab	teamspace_navigate	teams	go to my <teamspace_tab> auto appointment for my buick </teamspace_tab> tab
0	go to my going to america tab	teamspace_navigate	teams	go to my <teamspace_tab> going to america </teamspace_tab> tab
0	go to my cooking tab	teamspace_navigate	teams	go to my <teamspace_tab> cooking </teamspace_tab> tab
0	go to my shut down e dot exe tab	teamspace_navigate	teams	go to my <teamspace_tab> shut down e dot exe </teamspace_tab> tab
0	go to my lunch break tab	teamspace_navigate	teams	go to my <teamspace_tab> lunch break </teamspace_tab> tab
0	go to my barber tab	teamspace_navigate	teams	go to my <teamspace_tab> barber </teamspace_tab> tab
0	go to my valentine's shopping tab	teamspace_navigate	teams	go to my <teamspace_tab> valentine's shopping </teamspace_tab> tab
0	go to my party at chucky cheese ' s tab	teamspace_navigate	teams	go to my <teamspace_tab> party at chucky cheese ' s </teamspace_tab> tab
0	go to my movie date night tab	teamspace_navigate	teams	go to my <teamspace_tab> movie date night </teamspace_tab> tab
0	go to my oh meeting tab	teamspace_navigate	teams	go to my <teamspace_tab> oh meeting </teamspace_tab> tab
0	go to my eye test tab	teamspace_navigate	teams	go to my <teamspace_tab> eye test </teamspace_tab> tab
0	go to my gerber collision tab	teamspace_navigate	teams	go to my <teamspace_tab> gerber collision </teamspace_tab> tab
0	go to my lunch at mum and dads tab	teamspace_navigate	teams	go to my <teamspace_tab> lunch at mum and dads </teamspace_tab> tab
0	go to my bar clean up tab	teamspace_navigate	teams	go to my <teamspace_tab> bar clean up </teamspace_tab> tab
0	go to my s . h . a . u . n . a . w . four tab	teamspace_navigate	teams	go to my <teamspace_tab> s . h . a . u . n . a . w . four </teamspace_tab> tab
0	go to my full moon tab	teamspace_navigate	teams	go to my <teamspace_tab> full moon </teamspace_tab> tab
0	go to my talk to my professor tab	teamspace_navigate	teams	go to my <teamspace_tab> talk to my professor </teamspace_tab> tab
0	go to my kelly tab	teamspace_navigate	teams	go to my <teamspace_tab> kelly </teamspace_tab> tab
0	go to my ohec convention tab	teamspace_navigate	teams	go to my <teamspace_tab> ohec convention </teamspace_tab> tab
0	go to my seafair torchlight run tab	teamspace_navigate	teams	go to my <teamspace_tab> seafair torchlight run </teamspace_tab> tab
0	go to my beat the bridge tab	teamspace_navigate	teams	go to my <teamspace_tab> beat the bridge </teamspace_tab> tab
0	go to my anson ' s swimming party tab	teamspace_navigate	teams	go to my <teamspace_tab> anson ' s swimming party </teamspace_tab> tab
0	go to my excel tab	teamspace_navigate	teams	go to my <teamspace_tab> excel </teamspace_tab> tab
0	go to my trip to yosemite national park on adventureworks tab	teamspace_navigate	teams	go to my <teamspace_tab> trip to yosemite national park on adventureworks </teamspace_tab> tab
0	go to my call work about changing to direct deposit tab	teamspace_navigate	teams	go to my <teamspace_tab> call work about changing to direct deposit </teamspace_tab> tab
0	go to my ryans hair appointment tab	teamspace_navigate	teams	go to my <teamspace_tab> ryans hair appointment </teamspace_tab> tab
0	go to my greg tab	teamspace_navigate	teams	go to my <teamspace_tab> greg </teamspace_tab> tab
0	go to my meet lease tab	teamspace_navigate	teams	go to my <teamspace_tab> meet lease </teamspace_tab> tab
0	go to my mohammed ginini tab	teamspace_navigate	teams	go to my <teamspace_tab> mohammed ginini </teamspace_tab> tab
0	go to my testing out tab	teamspace_navigate	teams	go to my <teamspace_tab> testing out </teamspace_tab> tab
0	go to my see my mother tab	teamspace_navigate	teams	go to my <teamspace_tab> see my mother </teamspace_tab> tab
0	go to my check change my calendar tab	teamspace_navigate	teams	go to my <teamspace_tab> check change my calendar </teamspace_tab> tab
0	go to my work on fixing the shortcut project tab	teamspace_navigate	teams	go to my <teamspace_tab> work on fixing the shortcut project </teamspace_tab> tab
0	go to my going to the beach tab	teamspace_navigate	teams	go to my <teamspace_tab> going to the beach </teamspace_tab> tab
0	go to my studio time tab	teamspace_navigate	teams	go to my <teamspace_tab> studio time </teamspace_tab> tab
0	go to my web conference tab	teamspace_navigate	teams	go to my <teamspace_tab> web conference </teamspace_tab> tab
0	go to my john kate beakley sink tab	teamspace_navigate	teams	go to my <teamspace_tab> john kate beakley sink </teamspace_tab> tab
0	go to my gregs party tab	teamspace_navigate	teams	go to my <teamspace_tab> gregs party </teamspace_tab> tab
0	go to my doctor perez tab	teamspace_navigate	teams	go to my <teamspace_tab> doctor perez </teamspace_tab> tab
0	go to my raider tab	teamspace_navigate	teams	go to my <teamspace_tab> raider </teamspace_tab> tab
0	go to my colorado springs to las vegas tab	teamspace_navigate	teams	go to my <teamspace_tab> colorado springs to las vegas </teamspace_tab> tab
0	go to my geico tab	teamspace_navigate	teams	go to my <teamspace_tab> geico </teamspace_tab> tab
0	go to my matt dr appointment tab	teamspace_navigate	teams	go to my <teamspace_tab> matt dr appointment </teamspace_tab> tab
0	go to my jules appointment tab	teamspace_navigate	teams	go to my <teamspace_tab> jules appointment </teamspace_tab> tab
0	go to my meeting amber and susan tab	teamspace_navigate	teams	go to my <teamspace_tab> meeting amber and susan </teamspace_tab> tab
0	go to my meet mother tab	teamspace_navigate	teams	go to my <teamspace_tab> meet mother </teamspace_tab> tab
0	go to my jerry for me election night party tab	teamspace_navigate	teams	go to my <teamspace_tab> jerry for me election night party </teamspace_tab> tab
0	go to my kelly ' s birthday tab	teamspace_navigate	teams	go to my <teamspace_tab> kelly ' s birthday </teamspace_tab> tab
0	go to my mom for dinner tab	teamspace_navigate	teams	go to my <teamspace_tab> mom for dinner </teamspace_tab> tab
0	go to my ifeomas basketball tab	teamspace_navigate	teams	go to my <teamspace_tab> ifeomas basketball </teamspace_tab> tab
0	go to my drinks needed for party tab	teamspace_navigate	teams	go to my <teamspace_tab> drinks needed for party </teamspace_tab> tab
0	go to my party for ester tab	teamspace_navigate	teams	go to my <teamspace_tab> party for ester </teamspace_tab> tab
0	go to my babysitting appointment tab	teamspace_navigate	teams	go to my <teamspace_tab> babysitting appointment </teamspace_tab> tab
0	go to my wrestlemania tab	teamspace_navigate	teams	go to my <teamspace_tab> wrestlemania </teamspace_tab> tab
0	go to my miscellaneous tab	teamspace_navigate	teams	go to my <teamspace_tab> miscellaneous </teamspace_tab> tab
0	go to my meet anoush for hci tab	teamspace_navigate	teams	go to my <teamspace_tab> meet anoush for hci </teamspace_tab> tab
0	go to my am tab	teamspace_navigate	teams	go to my <teamspace_tab> am </teamspace_tab> tab
0	go to my kai ' s twelve month check up tab	teamspace_navigate	teams	go to my <teamspace_tab> kai ' s twelve month check up </teamspace_tab> tab
