0	open the some really long text so that takes up a lot of space on disk in heat tab in the meet the simpsons channel	teamspace_navigate	teams	open the <teamspace_tab> some really long text so that takes up a lot of space on disk in heat </teamspace_tab> tab in the <teamspace_channel> meet the simpsons </teamspace_channel> channel
0	open the condo board tab in the meeting at regis channel	teamspace_navigate	teams	open the <teamspace_tab> condo board </teamspace_tab> tab in the <teamspace_channel> meeting at regis </teamspace_channel> channel
0	open the checklist for today tab in the yvonne morrissey channel	teamspace_navigate	teams	open the <teamspace_tab> checklist for today </teamspace_tab> tab in the <teamspace_channel> yvonne morrissey </teamspace_channel> channel
0	open the one hundred and seven tab in the blueterm gmail channel	teamspace_navigate	teams	open the <teamspace_tab> one hundred and seven </teamspace_tab> tab in the <teamspace_channel> blueterm gmail </teamspace_channel> channel
0	open the work party tab in the meeting with judy and patty channel	teamspace_navigate	teams	open the <teamspace_tab> work party </teamspace_tab> tab in the <teamspace_channel> meeting with judy and patty </teamspace_channel> channel
0	open the bridge closure tab in the eat out channel	teamspace_navigate	teams	open the <teamspace_tab> bridge closure </teamspace_tab> tab in the <teamspace_channel> eat out </teamspace_channel> channel
0	open the meeting with vernon tab in the today's inventory channel	teamspace_navigate	teams	open the <teamspace_tab> meeting with vernon </teamspace_tab> tab in the <teamspace_channel> today's inventory </teamspace_channel> channel
0	open the take meredith out tab in the elsa ' s birthday channel	teamspace_navigate	teams	open the <teamspace_tab> take meredith out </teamspace_tab> tab in the <teamspace_channel> elsa ' s birthday </teamspace_channel> channel
0	open the no my birthday tab in the kingston artists soap box derby channel	teamspace_navigate	teams	open the <teamspace_tab> no my birthday </teamspace_tab> tab in the <teamspace_channel> kingston artists soap box derby </teamspace_channel> channel
0	open the call robbie tab in the emission test channel	teamspace_navigate	teams	open the <teamspace_tab> call robbie </teamspace_tab> tab in the <teamspace_channel> emission test </teamspace_channel> channel
0	open the cpa p pick up tab in the dog walking channel	teamspace_navigate	teams	open the <teamspace_tab> cpa p pick up </teamspace_tab> tab in the <teamspace_channel> dog walking </teamspace_channel> channel
0	open the pick up laundry tab in the german class channel	teamspace_navigate	teams	open the <teamspace_tab> pick up laundry </teamspace_tab> tab in the <teamspace_channel> german class </teamspace_channel> channel
0	open the watch traffic tab in the pog channel	teamspace_navigate	teams	open the <teamspace_tab> watch traffic </teamspace_tab> tab in the <teamspace_channel> pog </teamspace_channel> channel
0	open the bring macarenas tab in the yelp dinner channel	teamspace_navigate	teams	open the <teamspace_tab> bring macarenas </teamspace_tab> tab in the <teamspace_channel> yelp dinner </teamspace_channel> channel
0	open the excercize tab in the mommy channel	teamspace_navigate	teams	open the <teamspace_tab> excercize </teamspace_tab> tab in the <teamspace_channel> mommy </teamspace_channel> channel
0	open the horse tab in the homework finished channel	teamspace_navigate	teams	open the <teamspace_tab> horse </teamspace_tab> tab in the <teamspace_channel> homework finished </teamspace_channel> channel
0	open the pediatric appointment for henry tab in the med times channel	teamspace_navigate	teams	open the <teamspace_tab> pediatric appointment for henry </teamspace_tab> tab in the <teamspace_channel> med times </teamspace_channel> channel
0	open the doctor mccurdy dental tab in the dead channel	teamspace_navigate	teams	open the <teamspace_tab> doctor mccurdy dental </teamspace_tab> tab in the <teamspace_channel> dead </teamspace_channel> channel
0	open the appointment with brianna tab in the na meeting channel	teamspace_navigate	teams	open the <teamspace_tab> appointment with brianna </teamspace_tab> tab in the <teamspace_channel> na meeting </teamspace_channel> channel
0	open the joe and pam upstairs tab in the going to the library channel	teamspace_navigate	teams	open the <teamspace_tab> joe and pam upstairs </teamspace_tab> tab in the <teamspace_channel> going to the library </teamspace_channel> channel
0	open the morning meeting at work tab in the laptop parts channel	teamspace_navigate	teams	open the <teamspace_tab> morning meeting at work </teamspace_tab> tab in the <teamspace_channel> laptop parts </teamspace_channel> channel
0	open the oral appointment tab in the quick channel	teamspace_navigate	teams	open the <teamspace_tab> oral appointment </teamspace_tab> tab in the <teamspace_channel> quick </teamspace_channel> channel
0	open the mom ' s birthday tab in the joseph walker meet channel	teamspace_navigate	teams	open the <teamspace_tab> mom ' s birthday </teamspace_tab> tab in the <teamspace_channel> joseph walker meet </teamspace_channel> channel
0	open the payroll tab in the ipad channel	teamspace_navigate	teams	open the <teamspace_tab> payroll </teamspace_tab> tab in the <teamspace_channel> ipad </teamspace_channel> channel
0	open the test dot text tab in the forest channel	teamspace_navigate	teams	open the <teamspace_tab> test dot text </teamspace_tab> tab in the <teamspace_channel> forest </teamspace_channel> channel
0	open the bristol tab in the trip to seattle channel	teamspace_navigate	teams	open the <teamspace_tab> bristol </teamspace_tab> tab in the <teamspace_channel> trip to seattle </teamspace_channel> channel
0	open the belmont oasis tab in the pay student loan channel	teamspace_navigate	teams	open the <teamspace_tab> belmont oasis </teamspace_tab> tab in the <teamspace_channel> pay student loan </teamspace_channel> channel
0	open the husband is having surgery tab in the take the bike channel	teamspace_navigate	teams	open the <teamspace_tab> husband is having surgery </teamspace_tab> tab in the <teamspace_channel> take the bike </teamspace_channel> channel
0	open the meet scott tab in the i'm eating channel	teamspace_navigate	teams	open the <teamspace_tab> meet scott </teamspace_tab> tab in the <teamspace_channel> i'm eating </teamspace_channel> channel
0	open the mango tab in the train journey channel	teamspace_navigate	teams	open the <teamspace_tab> mango </teamspace_tab> tab in the <teamspace_channel> train journey </teamspace_channel> channel
0	open the rideshare tab in the delhi solihull channel	teamspace_navigate	teams	open the <teamspace_tab> rideshare </teamspace_tab> tab in the <teamspace_channel> delhi solihull </teamspace_channel> channel
0	open the it ' s on test tab in the darth training channel	teamspace_navigate	teams	open the <teamspace_tab> it ' s on test </teamspace_tab> tab in the <teamspace_channel> darth training </teamspace_channel> channel
0	open the algebra lessons tab in the take my car to the shop channel	teamspace_navigate	teams	open the <teamspace_tab> algebra lessons </teamspace_tab> tab in the <teamspace_channel> take my car to the shop </teamspace_channel> channel
0	open the boiling tab in the study for political science exam channel	teamspace_navigate	teams	open the <teamspace_tab> boiling </teamspace_tab> tab in the <teamspace_channel> study for political science exam </teamspace_channel> channel
0	open the having an exam tab in the big bear vacation channel	teamspace_navigate	teams	open the <teamspace_tab> having an exam </teamspace_tab> tab in the <teamspace_channel> big bear vacation </teamspace_channel> channel
0	open the appointment for coke install tab in the supplies for cooking channel	teamspace_navigate	teams	open the <teamspace_tab> appointment for coke install </teamspace_tab> tab in the <teamspace_channel> supplies for cooking </teamspace_channel> channel
0	open the voice lessons for kim tab in the design meeting channel	teamspace_navigate	teams	open the <teamspace_tab> voice lessons for kim </teamspace_tab> tab in the <teamspace_channel> design meeting </teamspace_channel> channel
0	open the colorado tab in the chores today channel	teamspace_navigate	teams	open the <teamspace_tab> colorado </teamspace_tab> tab in the <teamspace_channel> chores today </teamspace_channel> channel
0	open the pap smear tab in the jeff's birthday channel	teamspace_navigate	teams	open the <teamspace_tab> pap smear </teamspace_tab> tab in the <teamspace_channel> jeff's birthday </teamspace_channel> channel
0	open the antoinette ' s birthday tab in the cricket training channel	teamspace_navigate	teams	open the <teamspace_tab> antoinette ' s birthday </teamspace_tab> tab in the <teamspace_channel> cricket training </teamspace_channel> channel
0	open the go to part time job tab in the getting my grades channel	teamspace_navigate	teams	open the <teamspace_tab> go to part time job </teamspace_tab> tab in the <teamspace_channel> getting my grades </teamspace_channel> channel
0	open the mini repair service tab in the biometrics channel	teamspace_navigate	teams	open the <teamspace_tab> mini repair service </teamspace_tab> tab in the <teamspace_channel> biometrics </teamspace_channel> channel
0	open the clothing tab in the medical science field trip channel	teamspace_navigate	teams	open the <teamspace_tab> clothing </teamspace_tab> tab in the <teamspace_channel> medical science field trip </teamspace_channel> channel
0	open the bicycle race tab in the madden settings channel	teamspace_navigate	teams	open the <teamspace_tab> bicycle race </teamspace_tab> tab in the <teamspace_channel> madden settings </teamspace_channel> channel
0	open the change the tire tab in the cmp 2 thousand 4 channel	teamspace_navigate	teams	open the <teamspace_tab> change the tire </teamspace_tab> tab in the <teamspace_channel> cmp 2 thousand 4 </teamspace_channel> channel
0	open the call sammy tab in the you go channel	teamspace_navigate	teams	open the <teamspace_tab> call sammy </teamspace_tab> tab in the <teamspace_channel> you go </teamspace_channel> channel
0	open the maths exam tab in the christmas gifts channel	teamspace_navigate	teams	open the <teamspace_tab> maths exam </teamspace_tab> tab in the <teamspace_channel> christmas gifts </teamspace_channel> channel
0	open the hamster tab in the my birthdays channel	teamspace_navigate	teams	open the <teamspace_tab> hamster </teamspace_tab> tab in the <teamspace_channel> my birthdays </teamspace_channel> channel
0	open the at location sound tab in the pancakes channel	teamspace_navigate	teams	open the <teamspace_tab> at location sound </teamspace_tab> tab in the <teamspace_channel> pancakes </teamspace_channel> channel
0	open the hobby tab in the meet nicole for breakfast channel	teamspace_navigate	teams	open the <teamspace_tab> hobby </teamspace_tab> tab in the <teamspace_channel> meet nicole for breakfast </teamspace_channel> channel
0	open the executive meeting tab in the install microsoft updates and reboot track-it server channel	teamspace_navigate	teams	open the <teamspace_tab> executive meeting </teamspace_tab> tab in the <teamspace_channel> install microsoft updates and reboot track-it server </teamspace_channel> channel
0	open the walmart tab in the go to the salon channel	teamspace_navigate	teams	open the <teamspace_tab> walmart </teamspace_tab> tab in the <teamspace_channel> go to the salon </teamspace_channel> channel
0	open the teleconference 3035555555 tab in the go to the mall channel	teamspace_navigate	teams	open the <teamspace_tab> teleconference 3035555555 </teamspace_tab> tab in the <teamspace_channel> go to the mall </teamspace_channel> channel
0	open the call in the afternoon tab in the meeting with joshia panthony channel	teamspace_navigate	teams	open the <teamspace_tab> call in the afternoon </teamspace_tab> tab in the <teamspace_channel> meeting with joshia panthony </teamspace_channel> channel
0	open the cycle tab in the patrick ' s play channel	teamspace_navigate	teams	open the <teamspace_tab> cycle </teamspace_tab> tab in the <teamspace_channel> patrick ' s play </teamspace_channel> channel
0	open the driving school tab in the things to pick up at the grocery store channel	teamspace_navigate	teams	open the <teamspace_tab> driving school </teamspace_tab> tab in the <teamspace_channel> things to pick up at the grocery store </teamspace_channel> channel
0	open the jewish holidays tab in the facilities meeting channel	teamspace_navigate	teams	open the <teamspace_tab> jewish holidays </teamspace_tab> tab in the <teamspace_channel> facilities meeting </teamspace_channel> channel
0	open the meeting mom tab in the swimming pool channel	teamspace_navigate	teams	open the <teamspace_tab> meeting mom </teamspace_tab> tab in the <teamspace_channel> swimming pool </teamspace_channel> channel
0	open the study geography tab in the meeting with fernando channel	teamspace_navigate	teams	open the <teamspace_tab> study geography </teamspace_tab> tab in the <teamspace_channel> meeting with fernando </teamspace_channel> channel
0	open the xmas list tab in the early day channel	teamspace_navigate	teams	open the <teamspace_tab> xmas list </teamspace_tab> tab in the <teamspace_channel> early day </teamspace_channel> channel
0	open the half term for schools tab in the discuss her salary channel	teamspace_navigate	teams	open the <teamspace_tab> half term for schools </teamspace_tab> tab in the <teamspace_channel> discuss her salary </teamspace_channel> channel
0	open the start of fish husbandry lab tab in the dating night channel	teamspace_navigate	teams	open the <teamspace_tab> start of fish husbandry lab </teamspace_tab> tab in the <teamspace_channel> dating night </teamspace_channel> channel
0	open the trip to east coast tab in the callum ' s birthday channel	teamspace_navigate	teams	open the <teamspace_tab> trip to east coast </teamspace_tab> tab in the <teamspace_channel> callum ' s birthday </teamspace_channel> channel
0	open the groceries to buy tab in the son ' s baseball game channel	teamspace_navigate	teams	open the <teamspace_tab> groceries to buy </teamspace_tab> tab in the <teamspace_channel> son ' s baseball game </teamspace_channel> channel
0	open the vignette tab in the possible job interview channel	teamspace_navigate	teams	open the <teamspace_tab> vignette </teamspace_tab> tab in the <teamspace_channel> possible job interview </teamspace_channel> channel
0	open the birthday anne tab in the i need term exam channel	teamspace_navigate	teams	open the <teamspace_tab> birthday anne </teamspace_tab> tab in the <teamspace_channel> i need term exam </teamspace_channel> channel
0	open the unit lunch tab in the love you very dirty channel	teamspace_navigate	teams	open the <teamspace_tab> unit lunch </teamspace_tab> tab in the <teamspace_channel> love you very dirty </teamspace_channel> channel
0	open the pick up summer ' s cake tab in the bday dinner for nephew channel	teamspace_navigate	teams	open the <teamspace_tab> pick up summer ' s cake </teamspace_tab> tab in the <teamspace_channel> bday dinner for nephew </teamspace_channel> channel
0	open the obstetrician appointment tab in the control channel	teamspace_navigate	teams	open the <teamspace_tab> obstetrician appointment </teamspace_tab> tab in the <teamspace_channel> control </teamspace_channel> channel
0	open the hike tab in the paul's and magda's wedding channel	teamspace_navigate	teams	open the <teamspace_tab> hike </teamspace_tab> tab in the <teamspace_channel> paul's and magda's wedding </teamspace_channel> channel
0	open the catering event tab in the wake - up channel	teamspace_navigate	teams	open the <teamspace_tab> catering event </teamspace_tab> tab in the <teamspace_channel> wake - up </teamspace_channel> channel
0	open the centre parks with emily tab in the change address online channel	teamspace_navigate	teams	open the <teamspace_tab> centre parks with emily </teamspace_tab> tab in the <teamspace_channel> change address online </teamspace_channel> channel
0	open the start making dinner tab in the meeting with the prospective clients channel	teamspace_navigate	teams	open the <teamspace_tab> start making dinner </teamspace_tab> tab in the <teamspace_channel> meeting with the prospective clients </teamspace_channel> channel
0	open the projects tab in the tanner ' s conference channel	teamspace_navigate	teams	open the <teamspace_tab> projects </teamspace_tab> tab in the <teamspace_channel> tanner ' s conference </teamspace_channel> channel
0	open the holly springs high school registration meeting tab in the meet with paul channel	teamspace_navigate	teams	open the <teamspace_tab> holly springs high school registration meeting </teamspace_tab> tab in the <teamspace_channel> meet with paul </teamspace_channel> channel
0	open the nineteen thirty tab in the sofia ' s dentist appointment channel	teamspace_navigate	teams	open the <teamspace_tab> nineteen thirty </teamspace_tab> tab in the <teamspace_channel> sofia ' s dentist appointment </teamspace_channel> channel
0	open the idol deb gig parish pump tab in the cancel prime membership channel	teamspace_navigate	teams	open the <teamspace_tab> idol deb gig parish pump </teamspace_tab> tab in the <teamspace_channel> cancel prime membership </teamspace_channel> channel
0	open the doctor office tab in the summary channel	teamspace_navigate	teams	open the <teamspace_tab> doctor office </teamspace_tab> tab in the <teamspace_channel> summary </teamspace_channel> channel
0	open the valentine dinner tab in the go home you are drunk channel	teamspace_navigate	teams	open the <teamspace_tab> valentine dinner </teamspace_tab> tab in the <teamspace_channel> go home you are drunk </teamspace_channel> channel
0	open the lunches tab in the craig charles at the heron homes channel	teamspace_navigate	teams	open the <teamspace_tab> lunches </teamspace_tab> tab in the <teamspace_channel> craig charles at the heron homes </teamspace_channel> channel
0	open the camry maintenance tab in the call jeff from blumen garden channel	teamspace_navigate	teams	open the <teamspace_tab> camry maintenance </teamspace_tab> tab in the <teamspace_channel> call jeff from blumen garden </teamspace_channel> channel
0	open the alice in wonderland tab in the opening of new bank channel	teamspace_navigate	teams	open the <teamspace_tab> alice in wonderland </teamspace_tab> tab in the <teamspace_channel> opening of new bank </teamspace_channel> channel
0	open the vacation clothing tab in the race show channel	teamspace_navigate	teams	open the <teamspace_tab> vacation clothing </teamspace_tab> tab in the <teamspace_channel> race show </teamspace_channel> channel
0	open the things to get at the store tab in the g channel	teamspace_navigate	teams	open the <teamspace_tab> things to get at the store </teamspace_tab> tab in the <teamspace_channel> g </teamspace_channel> channel
0	open the swim tab in the smartphone channel	teamspace_navigate	teams	open the <teamspace_tab> swim </teamspace_tab> tab in the <teamspace_channel> smartphone </teamspace_channel> channel
0	open the see movie tab in the lifting plan channel	teamspace_navigate	teams	open the <teamspace_tab> see movie </teamspace_tab> tab in the <teamspace_channel> lifting plan </teamspace_channel> channel
0	open the drop katie tab in the five fifty seven pm channel	teamspace_navigate	teams	open the <teamspace_tab> drop katie </teamspace_tab> tab in the <teamspace_channel> five fifty seven pm </teamspace_channel> channel
0	open the dr sharma appt tab in the razz wedding channel	teamspace_navigate	teams	open the <teamspace_tab> dr sharma appt </teamspace_tab> tab in the <teamspace_channel> razz wedding </teamspace_channel> channel
0	open the appointment with my girlfriends tab in the get cash just in case appointment channel	teamspace_navigate	teams	open the <teamspace_tab> appointment with my girlfriends </teamspace_tab> tab in the <teamspace_channel> get cash just in case appointment </teamspace_channel> channel
0	open the presentatio 2 tab in the birth night channel	teamspace_navigate	teams	open the <teamspace_tab> presentatio 2 </teamspace_tab> tab in the <teamspace_channel> birth night </teamspace_channel> channel
0	open the polly and alice tab in the daughter ' s dental appointment channel	teamspace_navigate	teams	open the <teamspace_tab> polly and alice </teamspace_tab> tab in the <teamspace_channel> daughter ' s dental appointment </teamspace_channel> channel
0	open the party at mom's tab in the preparation for the shirian call channel	teamspace_navigate	teams	open the <teamspace_tab> party at mom's </teamspace_tab> tab in the <teamspace_channel> preparation for the shirian call </teamspace_channel> channel
0	open the send in the contract tab in the do gel nails at professional images channel	teamspace_navigate	teams	open the <teamspace_tab> send in the contract </teamspace_tab> tab in the <teamspace_channel> do gel nails at professional images </teamspace_channel> channel
0	open the finish timesheet tab in the meeting with k . v . e . o channel	teamspace_navigate	teams	open the <teamspace_tab> finish timesheet </teamspace_tab> tab in the <teamspace_channel> meeting with k . v . e . o </teamspace_channel> channel
0	open the appointment at malvern theatres tab in the tech crew clear up channel	teamspace_navigate	teams	open the <teamspace_tab> appointment at malvern theatres </teamspace_tab> tab in the <teamspace_channel> tech crew clear up </teamspace_channel> channel
0	open the doctor frankel tab in the shall i wish matt channel	teamspace_navigate	teams	open the <teamspace_tab> doctor frankel </teamspace_tab> tab in the <teamspace_channel> shall i wish matt </teamspace_channel> channel
0	open the elizabeth exam tab in the black sea channel	teamspace_navigate	teams	open the <teamspace_tab> elizabeth exam </teamspace_tab> tab in the <teamspace_channel> black sea </teamspace_channel> channel
0	open the call scott with the moving company tab in the mom ' s doctor visit channel	teamspace_navigate	teams	open the <teamspace_tab> call scott with the moving company </teamspace_tab> tab in the <teamspace_channel> mom ' s doctor visit </teamspace_channel> channel
0	open the group appointment tab in the programming channel	teamspace_navigate	teams	open the <teamspace_tab> group appointment </teamspace_tab> tab in the <teamspace_channel> programming </teamspace_channel> channel
0	open the pan date stop tab in the dad ' s cat channel	teamspace_navigate	teams	open the <teamspace_tab> pan date stop </teamspace_tab> tab in the <teamspace_channel> dad ' s cat </teamspace_channel> channel
0	open the meet steve tab in the call me my mother channel	teamspace_navigate	teams	open the <teamspace_tab> meet steve </teamspace_tab> tab in the <teamspace_channel> call me my mother </teamspace_channel> channel
0	open the arg meeting tab in the bbc panorama russia channel	teamspace_navigate	teams	open the <teamspace_tab> arg meeting </teamspace_tab> tab in the <teamspace_channel> bbc panorama russia </teamspace_channel> channel
0	open the eye testing tab in the delay for football channel	teamspace_navigate	teams	open the <teamspace_tab> eye testing </teamspace_tab> tab in the <teamspace_channel> delay for football </teamspace_channel> channel
0	open the put the oven on tab in the meet galaxy my friend channel	teamspace_navigate	teams	open the <teamspace_tab> put the oven on </teamspace_tab> tab in the <teamspace_channel> meet galaxy my friend </teamspace_channel> channel
0	open the searching 20 tab in the ba beta channel	teamspace_navigate	teams	open the <teamspace_tab> searching 20 </teamspace_tab> tab in the <teamspace_channel> ba beta </teamspace_channel> channel
0	open the shoot a video of a basketball game for larry easley tab in the guess what channel	teamspace_navigate	teams	open the <teamspace_tab> shoot a video of a basketball game for larry easley </teamspace_tab> tab in the <teamspace_channel> guess what </teamspace_channel> channel
0	open the lilly ' s birthday tab in the christmas cards channel	teamspace_navigate	teams	open the <teamspace_tab> lilly ' s birthday </teamspace_tab> tab in the <teamspace_channel> christmas cards </teamspace_channel> channel
0	open the kohl's tab in the grocery items for 99 supermarket channel	teamspace_navigate	teams	open the <teamspace_tab> kohl's </teamspace_tab> tab in the <teamspace_channel> grocery items for 99 supermarket </teamspace_channel> channel
0	open the cancel service for trugreen tab in the dinner ingredients channel	teamspace_navigate	teams	open the <teamspace_tab> cancel service for trugreen </teamspace_tab> tab in the <teamspace_channel> dinner ingredients </teamspace_channel> channel
0	open the national aids council system configuration tab in the groceries for party channel	teamspace_navigate	teams	open the <teamspace_tab> national aids council system configuration </teamspace_tab> tab in the <teamspace_channel> groceries for party </teamspace_channel> channel
0	open the second hand market tab in the son ' s birthday channel	teamspace_navigate	teams	open the <teamspace_tab> second hand market </teamspace_tab> tab in the <teamspace_channel> son ' s birthday </teamspace_channel> channel
0	open the max in casual and gold coin donation tab in the measure house channel	teamspace_navigate	teams	open the <teamspace_tab> max in casual and gold coin donation </teamspace_tab> tab in the <teamspace_channel> measure house </teamspace_channel> channel
0	open the meeting with emc tab in the titan channel	teamspace_navigate	teams	open the <teamspace_tab> meeting with emc </teamspace_tab> tab in the <teamspace_channel> titan </teamspace_channel> channel
