0	open bbc panorama russia channel	teamspace_navigate	teams	open <teamspace_channel> bbc panorama russia </teamspace_channel> channel
0	open delay for football channel	teamspace_navigate	teams	open <teamspace_channel> delay for football </teamspace_channel> channel
0	open meet galaxy my friend channel	teamspace_navigate	teams	open <teamspace_channel> meet galaxy my friend </teamspace_channel> channel
0	open ba beta channel	teamspace_navigate	teams	open <teamspace_channel> ba beta </teamspace_channel> channel
0	open guess what channel	teamspace_navigate	teams	open <teamspace_channel> guess what </teamspace_channel> channel
0	open christmas cards channel	teamspace_navigate	teams	open <teamspace_channel> christmas cards </teamspace_channel> channel
0	open grocery items for 99 supermarket channel	teamspace_navigate	teams	open <teamspace_channel> grocery items for 99 supermarket </teamspace_channel> channel
0	open dinner ingredients channel	teamspace_navigate	teams	open <teamspace_channel> dinner ingredients </teamspace_channel> channel
0	open groceries for party channel	teamspace_navigate	teams	open <teamspace_channel> groceries for party </teamspace_channel> channel
0	open son ' s birthday channel	teamspace_navigate	teams	open <teamspace_channel> son ' s birthday </teamspace_channel> channel
0	open measure house channel	teamspace_navigate	teams	open <teamspace_channel> measure house </teamspace_channel> channel
0	open titan channel	teamspace_navigate	teams	open <teamspace_channel> titan </teamspace_channel> channel
0	open test . xls channel	teamspace_navigate	teams	open <teamspace_channel> test . xls </teamspace_channel> channel
0	open connects plan channel	teamspace_navigate	teams	open <teamspace_channel> connects plan </teamspace_channel> channel
0	open snipbaptist.jpg channel	teamspace_navigate	teams	open <teamspace_channel> snipbaptist.jpg </teamspace_channel> channel
0	open massages channel	teamspace_navigate	teams	open <teamspace_channel> massages </teamspace_channel> channel
0	open data 1 channel	teamspace_navigate	teams	open <teamspace_channel> data 1 </teamspace_channel> channel
0	open going with kendrick to the party channel	teamspace_navigate	teams	open <teamspace_channel> going with kendrick to the party </teamspace_channel> channel
0	open herman smith rehearsal channel	teamspace_navigate	teams	open <teamspace_channel> herman smith rehearsal </teamspace_channel> channel
0	open help jamie channel	teamspace_navigate	teams	open <teamspace_channel> help jamie </teamspace_channel> channel
0	open upcoming baseball game channel	teamspace_navigate	teams	open <teamspace_channel> upcoming baseball game </teamspace_channel> channel
0	open extra class channel	teamspace_navigate	teams	open <teamspace_channel> extra class </teamspace_channel> channel
0	open pet scan for mom channel	teamspace_navigate	teams	open <teamspace_channel> pet scan for mom </teamspace_channel> channel
0	open mail gas bill channel	teamspace_navigate	teams	open <teamspace_channel> mail gas bill </teamspace_channel> channel
0	open listening channel	teamspace_navigate	teams	open <teamspace_channel> listening </teamspace_channel> channel
0	open movie company shift channel	teamspace_navigate	teams	open <teamspace_channel> movie company shift </teamspace_channel> channel
0	open swimming lessons for hannah channel	teamspace_navigate	teams	open <teamspace_channel> swimming lessons for hannah </teamspace_channel> channel
0	open ten oh nine channel	teamspace_navigate	teams	open <teamspace_channel> ten oh nine </teamspace_channel> channel
0	open pc world carmarthen s channel	teamspace_navigate	teams	open <teamspace_channel> pc world carmarthen s </teamspace_channel> channel
0	open food i will serve at the party channel	teamspace_navigate	teams	open <teamspace_channel> food i will serve at the party </teamspace_channel> channel
0	open intel webcast channel	teamspace_navigate	teams	open <teamspace_channel> intel webcast </teamspace_channel> channel
0	open phone the doctor's channel	teamspace_navigate	teams	open <teamspace_channel> phone the doctor's </teamspace_channel> channel
0	open super bowl sunday channel	teamspace_navigate	teams	open <teamspace_channel> super bowl sunday </teamspace_channel> channel
0	open daily call channel	teamspace_navigate	teams	open <teamspace_channel> daily call </teamspace_channel> channel
0	open ic day friday channel	teamspace_navigate	teams	open <teamspace_channel> ic day friday </teamspace_channel> channel
0	open spank a monkey channel	teamspace_navigate	teams	open <teamspace_channel> spank a monkey </teamspace_channel> channel
0	open tim ' s dr dejong appt channel	teamspace_navigate	teams	open <teamspace_channel> tim ' s dr dejong appt </teamspace_channel> channel
0	open leave for for work channel	teamspace_navigate	teams	open <teamspace_channel> leave for for work </teamspace_channel> channel
0	open animals channel	teamspace_navigate	teams	open <teamspace_channel> animals </teamspace_channel> channel
0	open have a coffee channel	teamspace_navigate	teams	open <teamspace_channel> have a coffee </teamspace_channel> channel
0	open call becky at cubic hotel channel	teamspace_navigate	teams	open <teamspace_channel> call becky at cubic hotel </teamspace_channel> channel
0	open dentist appointment zander channel	teamspace_navigate	teams	open <teamspace_channel> dentist appointment zander </teamspace_channel> channel
0	open ewa channel	teamspace_navigate	teams	open <teamspace_channel> ewa </teamspace_channel> channel
0	open no preschool channel	teamspace_navigate	teams	open <teamspace_channel> no preschool </teamspace_channel> channel
0	open science test channel	teamspace_navigate	teams	open <teamspace_channel> science test </teamspace_channel> channel
0	open vacation trip planning channel	teamspace_navigate	teams	open <teamspace_channel> vacation trip planning </teamspace_channel> channel
0	open directions to the party channel	teamspace_navigate	teams	open <teamspace_channel> directions to the party </teamspace_channel> channel
0	open mum and dad holiday to whitby channel	teamspace_navigate	teams	open <teamspace_channel> mum and dad holiday to whitby </teamspace_channel> channel
0	open homemade biscuits recipe channel	teamspace_navigate	teams	open <teamspace_channel> homemade biscuits recipe </teamspace_channel> channel
0	open i repair work channel	teamspace_navigate	teams	open <teamspace_channel> i repair work </teamspace_channel> channel
0	open chat about the design of the new product channel	teamspace_navigate	teams	open <teamspace_channel> chat about the design of the new product </teamspace_channel> channel
0	open volume on you channel	teamspace_navigate	teams	open <teamspace_channel> volume on you </teamspace_channel> channel
0	open cortana joke channel	teamspace_navigate	teams	open <teamspace_channel> cortana joke </teamspace_channel> channel
0	open i need to work channel	teamspace_navigate	teams	open <teamspace_channel> i need to work </teamspace_channel> channel
0	open va thomas channel	teamspace_navigate	teams	open <teamspace_channel> va thomas </teamspace_channel> channel
0	open test shopping channel	teamspace_navigate	teams	open <teamspace_channel> test shopping </teamspace_channel> channel
0	open marketing netmeeting channel	teamspace_navigate	teams	open <teamspace_channel> marketing netmeeting </teamspace_channel> channel
0	open wrestling meet channel	teamspace_navigate	teams	open <teamspace_channel> wrestling meet </teamspace_channel> channel
0	open work on unit plan channel	teamspace_navigate	teams	open <teamspace_channel> work on unit plan </teamspace_channel> channel
0	open job application channel	teamspace_navigate	teams	open <teamspace_channel> job application </teamspace_channel> channel
0	open kids have to go to swimming lessons channel	teamspace_navigate	teams	open <teamspace_channel> kids have to go to swimming lessons </teamspace_channel> channel
0	open receiving a blow job channel	teamspace_navigate	teams	open <teamspace_channel> receiving a blow job </teamspace_channel> channel
0	open ryan meeting channel	teamspace_navigate	teams	open <teamspace_channel> ryan meeting </teamspace_channel> channel
0	open check my unread messages channel	teamspace_navigate	teams	open <teamspace_channel> check my unread messages </teamspace_channel> channel
0	open deep conditioning channel	teamspace_navigate	teams	open <teamspace_channel> deep conditioning </teamspace_channel> channel
0	open clear out team channel	teamspace_navigate	teams	open <teamspace_channel> clear out team </teamspace_channel> channel
0	open nina meeting channel	teamspace_navigate	teams	open <teamspace_channel> nina meeting </teamspace_channel> channel
0	open mocktails for mustang networking event channel	teamspace_navigate	teams	open <teamspace_channel> mocktails for mustang networking event </teamspace_channel> channel
0	open see the doctor channel	teamspace_navigate	teams	open <teamspace_channel> see the doctor </teamspace_channel> channel
0	open beach.png channel	teamspace_navigate	teams	open <teamspace_channel> beach.png </teamspace_channel> channel
0	open talking lens production work channel	teamspace_navigate	teams	open <teamspace_channel> talking lens production work </teamspace_channel> channel
0	open punch robert channel	teamspace_navigate	teams	open <teamspace_channel> punch robert </teamspace_channel> channel
0	open go the dentist channel	teamspace_navigate	teams	open <teamspace_channel> go the dentist </teamspace_channel> channel
0	open count down channel	teamspace_navigate	teams	open <teamspace_channel> count down </teamspace_channel> channel
0	open select comfort channel	teamspace_navigate	teams	open <teamspace_channel> select comfort </teamspace_channel> channel
0	open microsoft surface channel	teamspace_navigate	teams	open <teamspace_channel> microsoft surface </teamspace_channel> channel
0	open student channel	teamspace_navigate	teams	open <teamspace_channel> student </teamspace_channel> channel
0	open send reply to courts channel	teamspace_navigate	teams	open <teamspace_channel> send reply to courts </teamspace_channel> channel
0	open workshop meeting channel	teamspace_navigate	teams	open <teamspace_channel> workshop meeting </teamspace_channel> channel
0	open doctor lee min channel	teamspace_navigate	teams	open <teamspace_channel> doctor lee min </teamspace_channel> channel
0	open house cleaning duties channel	teamspace_navigate	teams	open <teamspace_channel> house cleaning duties </teamspace_channel> channel
0	open merlin channel	teamspace_navigate	teams	open <teamspace_channel> merlin </teamspace_channel> channel
0	open skype with tanja channel	teamspace_navigate	teams	open <teamspace_channel> skype with tanja </teamspace_channel> channel
0	open co-operative bank appointment channel	teamspace_navigate	teams	open <teamspace_channel> co-operative bank appointment </teamspace_channel> channel
0	open flight at 7:30am channel	teamspace_navigate	teams	open <teamspace_channel> flight at 7:30am </teamspace_channel> channel
0	open karen channel	teamspace_navigate	teams	open <teamspace_channel> karen </teamspace_channel> channel
0	open light the night leukemia lymphoma society walk channel	teamspace_navigate	teams	open <teamspace_channel> light the night leukemia lymphoma society walk </teamspace_channel> channel
0	open calender results channel	teamspace_navigate	teams	open <teamspace_channel> calender results </teamspace_channel> channel
0	open play with the band channel	teamspace_navigate	teams	open <teamspace_channel> play with the band </teamspace_channel> channel
0	open oepn channel	teamspace_navigate	teams	open <teamspace_channel> oepn </teamspace_channel> channel
0	open meet the press channel	teamspace_navigate	teams	open <teamspace_channel> meet the press </teamspace_channel> channel
0	open meeting with rita channel	teamspace_navigate	teams	open <teamspace_channel> meeting with rita </teamspace_channel> channel
0	open hookers channel	teamspace_navigate	teams	open <teamspace_channel> hookers </teamspace_channel> channel
0	open this is just a test channel	teamspace_navigate	teams	open <teamspace_channel> this is just a test </teamspace_channel> channel
0	open jazzercise channel	teamspace_navigate	teams	open <teamspace_channel> jazzercise </teamspace_channel> channel
0	open ken channel	teamspace_navigate	teams	open <teamspace_channel> ken </teamspace_channel> channel
0	open yoga appt channel	teamspace_navigate	teams	open <teamspace_channel> yoga appt </teamspace_channel> channel
0	open call gramma see channel	teamspace_navigate	teams	open <teamspace_channel> call gramma see </teamspace_channel> channel
0	open go to verizon store channel	teamspace_navigate	teams	open <teamspace_channel> go to verizon store </teamspace_channel> channel
0	open last day of school channel	teamspace_navigate	teams	open <teamspace_channel> last day of school </teamspace_channel> channel
0	open blood donation channel	teamspace_navigate	teams	open <teamspace_channel> blood donation </teamspace_channel> channel
0	open xc channel	teamspace_navigate	teams	open <teamspace_channel> xc </teamspace_channel> channel
0	open flight to amsterdam channel	teamspace_navigate	teams	open <teamspace_channel> flight to amsterdam </teamspace_channel> channel
0	open bb event channel	teamspace_navigate	teams	open <teamspace_channel> bb event </teamspace_channel> channel
0	go to channel managerial meeting	teamspace_navigate	teams	go to channel <teamspace_channel> managerial meeting </teamspace_channel>
0	go to channel no subject	teamspace_navigate	teams	go to channel <teamspace_channel> no subject </teamspace_channel>
0	go to channel katelynn ' s appointment	teamspace_navigate	teams	go to channel <teamspace_channel> katelynn ' s appointment </teamspace_channel>
0	go to channel pick sharen	teamspace_navigate	teams	go to channel <teamspace_channel> pick sharen </teamspace_channel>
0	go to channel milwaukee air show	teamspace_navigate	teams	go to channel <teamspace_channel> milwaukee air show </teamspace_channel>
0	go to channel doctor frankel	teamspace_navigate	teams	go to channel <teamspace_channel> doctor frankel </teamspace_channel>
0	go to channel bob and meeting	teamspace_navigate	teams	go to channel <teamspace_channel> bob and meeting </teamspace_channel>
0	go to channel pub quiz	teamspace_navigate	teams	go to channel <teamspace_channel> pub quiz </teamspace_channel>
0	go to channel picnic planning	teamspace_navigate	teams	go to channel <teamspace_channel> picnic planning </teamspace_channel>
0	go to channel things to buy for holidays	teamspace_navigate	teams	go to channel <teamspace_channel> things to buy for holidays </teamspace_channel>
0	go to channel soundboard	teamspace_navigate	teams	go to channel <teamspace_channel> soundboard </teamspace_channel>
0	go to channel pick up hardware	teamspace_navigate	teams	go to channel <teamspace_channel> pick up hardware </teamspace_channel>
0	go to channel white	teamspace_navigate	teams	go to channel <teamspace_channel> white </teamspace_channel>
0	go to channel get off the 1st bus stop	teamspace_navigate	teams	go to channel <teamspace_channel> get off the 1st bus stop </teamspace_channel>
0	go to channel library books	teamspace_navigate	teams	go to channel <teamspace_channel> library books </teamspace_channel>
0	go to channel trip to mexico	teamspace_navigate	teams	go to channel <teamspace_channel> trip to mexico </teamspace_channel>
0	go to channel aquarium filter impeller	teamspace_navigate	teams	go to channel <teamspace_channel> aquarium filter impeller </teamspace_channel>
0	go to channel dental appoint	teamspace_navigate	teams	go to channel <teamspace_channel> dental appoint </teamspace_channel>
0	go to channel recording session	teamspace_navigate	teams	go to channel <teamspace_channel> recording session </teamspace_channel>
0	go to channel brother's birthday	teamspace_navigate	teams	go to channel <teamspace_channel> brother's birthday </teamspace_channel>
0	go to channel mudbug festival	teamspace_navigate	teams	go to channel <teamspace_channel> mudbug festival </teamspace_channel>
0	go to channel meeting with rob mcqueen	teamspace_navigate	teams	go to channel <teamspace_channel> meeting with rob mcqueen </teamspace_channel>
0	go to channel video plus	teamspace_navigate	teams	go to channel <teamspace_channel> video plus </teamspace_channel>
0	go to channel date night with sweethear	teamspace_navigate	teams	go to channel <teamspace_channel> date night with sweethear </teamspace_channel>
0	go to channel pathwise appointment	teamspace_navigate	teams	go to channel <teamspace_channel> pathwise appointment </teamspace_channel>
0	go to channel command dot exe	teamspace_navigate	teams	go to channel <teamspace_channel> command dot exe </teamspace_channel>
0	go to channel chinese new year	teamspace_navigate	teams	go to channel <teamspace_channel> chinese new year </teamspace_channel>
0	go to channel thomas ' game	teamspace_navigate	teams	go to channel <teamspace_channel> thomas ' game </teamspace_channel>
0	go to channel endo's copy	teamspace_navigate	teams	go to channel <teamspace_channel> endo's copy </teamspace_channel>
0	go to channel vegetables	teamspace_navigate	teams	go to channel <teamspace_channel> vegetables </teamspace_channel>
0	go to channel kanes dr appt	teamspace_navigate	teams	go to channel <teamspace_channel> kanes dr appt </teamspace_channel>
0	go to channel appointment for cirrus tune up	teamspace_navigate	teams	go to channel <teamspace_channel> appointment for cirrus tune up </teamspace_channel>
0	go to channel sushi	teamspace_navigate	teams	go to channel <teamspace_channel> sushi </teamspace_channel>
0	go to channel go to saint catherine of alexandria catholic church	teamspace_navigate	teams	go to channel <teamspace_channel> go to saint catherine of alexandria catholic church </teamspace_channel>
0	go to channel car wash	teamspace_navigate	teams	go to channel <teamspace_channel> car wash </teamspace_channel>
0	go to channel email solicitor	teamspace_navigate	teams	go to channel <teamspace_channel> email solicitor </teamspace_channel>
0	go to channel lunch box recipes	teamspace_navigate	teams	go to channel <teamspace_channel> lunch box recipes </teamspace_channel>
0	go to channel go cut down bamboo at timmy's	teamspace_navigate	teams	go to channel <teamspace_channel> go cut down bamboo at timmy's </teamspace_channel>
0	go to channel travelling	teamspace_navigate	teams	go to channel <teamspace_channel> travelling </teamspace_channel>
0	go to channel c. s. m. work	teamspace_navigate	teams	go to channel <teamspace_channel> c. s. m. work </teamspace_channel>
0	go to channel restore luke smith	teamspace_navigate	teams	go to channel <teamspace_channel> restore luke smith </teamspace_channel>
0	go to channel not indoor soccer game	teamspace_navigate	teams	go to channel <teamspace_channel> not indoor soccer game </teamspace_channel>
0	go to channel discuss technical excellence	teamspace_navigate	teams	go to channel <teamspace_channel> discuss technical excellence </teamspace_channel>
0	go to channel weather forecast	teamspace_navigate	teams	go to channel <teamspace_channel> weather forecast </teamspace_channel>
0	go to channel second	teamspace_navigate	teams	go to channel <teamspace_channel> second </teamspace_channel>
0	go to channel new teacher	teamspace_navigate	teams	go to channel <teamspace_channel> new teacher </teamspace_channel>
0	go to channel pam	teamspace_navigate	teams	go to channel <teamspace_channel> pam </teamspace_channel>
0	go to channel meeting with gemma	teamspace_navigate	teams	go to channel <teamspace_channel> meeting with gemma </teamspace_channel>
0	go to channel hellier at emsworth	teamspace_navigate	teams	go to channel <teamspace_channel> hellier at emsworth </teamspace_channel>
0	go to channel torah	teamspace_navigate	teams	go to channel <teamspace_channel> torah </teamspace_channel>
0	go to channel psy psychiatrist	teamspace_navigate	teams	go to channel <teamspace_channel> psy psychiatrist </teamspace_channel>
0	go to channel drinking	teamspace_navigate	teams	go to channel <teamspace_channel> drinking </teamspace_channel>
0	go to channel run	teamspace_navigate	teams	go to channel <teamspace_channel> run </teamspace_channel>
0	go to channel mall shopping	teamspace_navigate	teams	go to channel <teamspace_channel> mall shopping </teamspace_channel>
0	go to channel hey surface, boock	teamspace_navigate	teams	go to channel <teamspace_channel> hey surface, boock </teamspace_channel>
0	go to channel tanning appointments	teamspace_navigate	teams	go to channel <teamspace_channel> tanning appointments </teamspace_channel>
0	go to channel disney on ice	teamspace_navigate	teams	go to channel <teamspace_channel> disney on ice </teamspace_channel>
0	go to channel call jewell green	teamspace_navigate	teams	go to channel <teamspace_channel> call jewell green </teamspace_channel>
0	go to channel assess	teamspace_navigate	teams	go to channel <teamspace_channel> assess </teamspace_channel>
0	go to channel the shopping channel	teamspace_navigate	teams	go to channel <teamspace_channel> the shopping channel </teamspace_channel>
0	go to channel peer education	teamspace_navigate	teams	go to channel <teamspace_channel> peer education </teamspace_channel>
0	go to channel book spot	teamspace_navigate	teams	go to channel <teamspace_channel> book spot </teamspace_channel>
0	go to channel edgardo pizzolo cv	teamspace_navigate	teams	go to channel <teamspace_channel> edgardo pizzolo cv </teamspace_channel>
0	go to channel meeting with alan deer	teamspace_navigate	teams	go to channel <teamspace_channel> meeting with alan deer </teamspace_channel>
0	go to channel car club for collin	teamspace_navigate	teams	go to channel <teamspace_channel> car club for collin </teamspace_channel>
0	go to channel good day	teamspace_navigate	teams	go to channel <teamspace_channel> good day </teamspace_channel>
0	go to channel follow up appointment with his p . c . p .	teamspace_navigate	teams	go to channel <teamspace_channel> follow up appointment with his p . c . p . </teamspace_channel>
0	go to channel get tom tom	teamspace_navigate	teams	go to channel <teamspace_channel> get tom tom </teamspace_channel>
0	go to channel culinary course	teamspace_navigate	teams	go to channel <teamspace_channel> culinary course </teamspace_channel>
0	go to channel counselling	teamspace_navigate	teams	go to channel <teamspace_channel> counselling </teamspace_channel>
0	go to channel ben ' s wedding	teamspace_navigate	teams	go to channel <teamspace_channel> ben ' s wedding </teamspace_channel>
0	go to channel rip past	teamspace_navigate	teams	go to channel <teamspace_channel> rip past </teamspace_channel>
0	go to channel general elders meeting	teamspace_navigate	teams	go to channel <teamspace_channel> general elders meeting </teamspace_channel>
0	go to channel mall to get shoes	teamspace_navigate	teams	go to channel <teamspace_channel> mall to get shoes </teamspace_channel>
0	go to channel guidelines.doc	teamspace_navigate	teams	go to channel <teamspace_channel> guidelines.doc </teamspace_channel>
0	go to channel old school runescape boss	teamspace_navigate	teams	go to channel <teamspace_channel> old school runescape boss </teamspace_channel>
0	go to channel vacation to paris	teamspace_navigate	teams	go to channel <teamspace_channel> vacation to paris </teamspace_channel>
0	go to channel doctor john special lecture	teamspace_navigate	teams	go to channel <teamspace_channel> doctor john special lecture </teamspace_channel>
0	go to channel motorola launch	teamspace_navigate	teams	go to channel <teamspace_channel> motorola launch </teamspace_channel>
0	go to channel call mason	teamspace_navigate	teams	go to channel <teamspace_channel> call mason </teamspace_channel>
0	go to channel bowling nite with the crew	teamspace_navigate	teams	go to channel <teamspace_channel> bowling nite with the crew </teamspace_channel>
0	go to channel festivals	teamspace_navigate	teams	go to channel <teamspace_channel> festivals </teamspace_channel>
0	go to channel danilo's birthday	teamspace_navigate	teams	go to channel <teamspace_channel> danilo's birthday </teamspace_channel>
0	go to channel laser therapy	teamspace_navigate	teams	go to channel <teamspace_channel> laser therapy </teamspace_channel>
0	go to channel italian test	teamspace_navigate	teams	go to channel <teamspace_channel> italian test </teamspace_channel>
0	go to channel scott helping me with photos	teamspace_navigate	teams	go to channel <teamspace_channel> scott helping me with photos </teamspace_channel>
0	go to channel free fall shoot	teamspace_navigate	teams	go to channel <teamspace_channel> free fall shoot </teamspace_channel>
0	go to channel run in the park	teamspace_navigate	teams	go to channel <teamspace_channel> run in the park </teamspace_channel>
0	go to channel i hard drive from maplin	teamspace_navigate	teams	go to channel <teamspace_channel> i hard drive from maplin </teamspace_channel>
0	go to channel management group meeting	teamspace_navigate	teams	go to channel <teamspace_channel> management group meeting </teamspace_channel>
0	go to channel easy dash logo dot jpg	teamspace_navigate	teams	go to channel <teamspace_channel> easy dash logo dot jpg </teamspace_channel>
0	go to channel looking at houses	teamspace_navigate	teams	go to channel <teamspace_channel> looking at houses </teamspace_channel>
0	go to channel caleb ' s birthday party	teamspace_navigate	teams	go to channel <teamspace_channel> caleb ' s birthday party </teamspace_channel>
0	go to channel meeting with yorg	teamspace_navigate	teams	go to channel <teamspace_channel> meeting with yorg </teamspace_channel>
0	go to channel boiling	teamspace_navigate	teams	go to channel <teamspace_channel> boiling </teamspace_channel>
