0	send seafood slide to gilauri	file_share	files	send <file_keyword> seafood </file_keyword> <file_type> slide </file_type> to <to_contact_name> gilauri </to_contact_name>
0	send flight eighteen seventy one vstx to tachner	file_share	files	send <file_keyword> flight eighteen seventy one </file_keyword> <file_type> vstx </file_type> to <to_contact_name> tachner </to_contact_name>
0	send moms doctor slides to hureaux tachner	file_share	files	send <file_keyword> moms doctor </file_keyword> <file_type> slides </file_type> to <to_contact_name> hureaux tachner </to_contact_name>
0	send girls basketball Docs to godovkin	file_share	files	send <file_keyword> girls basketball </file_keyword> <file_type> Docs </file_type> to <to_contact_name> godovkin </to_contact_name>
0	send watch power point to canapville	file_share	files	send <file_keyword> watch </file_keyword> <file_type> power point </file_type> to <to_contact_name> canapville </to_contact_name>
0	send firefighters parade spreadsheets to sundine	file_share	files	send <file_keyword> firefighters parade </file_keyword> <file_type> spreadsheets </file_type> to <to_contact_name> sundine </to_contact_name>
0	send go to movie image to friedrichshagen	file_share	files	send <file_keyword> go to movie </file_keyword> <file_type> image </file_type> to <to_contact_name> friedrichshagen </to_contact_name>
0	send doctor krebs vcs to tachner	file_share	files	send <file_keyword> doctor krebs </file_keyword> <file_type> vcs </file_type> to <to_contact_name> tachner </to_contact_name>
0	send newton meeting note to seddik	file_share	files	send <file_keyword> newton meeting </file_keyword> <file_type> note </file_type> to <to_contact_name> seddik </to_contact_name>
0	send make cinnamon rolls OneNote to lohan dunjica	file_share	files	send <file_keyword> make cinnamon rolls </file_keyword> <file_type> OneNote </file_type> to <to_contact_name> lohan dunjica </to_contact_name>
0	send nokia lumia excel to peczi	file_share	files	send <file_keyword> nokia lumia </file_keyword> <file_type> excel </file_type> to <to_contact_name> peczi </to_contact_name>
0	send invite people Doc to walman gaumont	file_share	files	send <file_keyword> invite people </file_keyword> <file_type> Doc </file_type> to <to_contact_name> walman gaumont </to_contact_name>
0	send movies playing pdfs to duenbier	file_share	files	send <file_keyword> movies playing </file_keyword> <file_type> pdfs </file_type> to <to_contact_name> duenbier </to_contact_name>
0	send gina fry ' s birthday spreadsheets to sochackyj šmite	file_share	files	send <file_keyword> gina fry ' s birthday </file_keyword> <file_type> spreadsheets </file_type> to <to_contact_name> sochackyj šmite </to_contact_name>
0	send driving school notes to jonkajtys	file_share	files	send <file_keyword> driving school </file_keyword> <file_type> notes </file_type> to <to_contact_name> jonkajtys </to_contact_name>
0	send play house with draco malfoy and harry potter hermione ' s vdw to hinokarume	file_share	files	send <file_keyword> play house with draco malfoy and harry potter hermione ' s </file_keyword> <file_type> vdw </file_type> to <to_contact_name> hinokarume </to_contact_name>
0	send grocery cart presentations to seikanji	file_share	files	send <file_keyword> grocery cart </file_keyword> <file_type> presentations </file_type> to <to_contact_name> seikanji </to_contact_name>
0	send christmas dinner OneNote to sisung misat	file_share	files	send <file_keyword> christmas dinner </file_keyword> <file_type> OneNote </file_type> to <to_contact_name> sisung misat </to_contact_name>
0	send jackson's flag football game word to basacar staziker	file_share	files	send <file_keyword> jackson's flag football game </file_keyword> <file_type> word </file_type> to <to_contact_name> basacar staziker </to_contact_name>
0	send send parts to kevin OneNote to chartrin	file_share	files	send <file_keyword> send parts to kevin </file_keyword> <file_type> OneNote </file_type> to <to_contact_name> chartrin </to_contact_name>
0	send date with anthony onenotes to shirinski morohito	file_share	files	send <file_keyword> date with anthony </file_keyword> <file_type> onenotes </file_type> to <to_contact_name> shirinski morohito </to_contact_name>
0	send grocery cart onenote to dobrovol'skii sochackyj	file_share	files	send <file_keyword> grocery cart </file_keyword> <file_type> onenote </file_type> to <to_contact_name> dobrovol'skii sochackyj </to_contact_name>
0	send one plus one ics to tija edmee	file_share	files	send <file_keyword> one plus one </file_keyword> <file_type> ics </file_type> to <to_contact_name> tija edmee </to_contact_name>
0	send household xls to koklarova	file_share	files	send <file_keyword> household </file_keyword> <file_type> xls </file_type> to <to_contact_name> koklarova </to_contact_name>
0	send specialized steel bike vst to mitroshin laesch	file_share	files	send <file_keyword> specialized steel bike </file_keyword> <file_type> vst </file_type> to <to_contact_name> mitroshin laesch </to_contact_name>
0	send interview with conserve energy gif to tiezheng sticho	file_share	files	send <file_keyword> interview with conserve energy </file_keyword> <file_type> gif </file_type> to <to_contact_name> tiezheng sticho </to_contact_name>
0	send number one xlsx to sticho	file_share	files	send <file_keyword> number one </file_keyword> <file_type> xlsx </file_type> to <to_contact_name> sticho </to_contact_name>
0	send pick up meeting invite ppts to goguillot giovingo	file_share	files	send <file_keyword> pick up meeting invite </file_keyword> <file_type> ppts </file_type> to <to_contact_name> goguillot giovingo </to_contact_name>
0	send hey jessie spreadsheet to giusano	file_share	files	send <file_keyword> hey jessie </file_keyword> <file_type> spreadsheet </file_type> to <to_contact_name> giusano </to_contact_name>
0	send lunch appoitment jpg to schreiterova	file_share	files	send <file_keyword> lunch appoitment </file_keyword> <file_type> jpg </file_type> to <to_contact_name> schreiterova </to_contact_name>
0	send pick up prescription at walgreens vst to frusescu	file_share	files	send <file_keyword> pick up prescription at walgreens </file_keyword> <file_type> vst </file_type> to <to_contact_name> frusescu </to_contact_name>
0	send pick jordan up PDF to apsion	file_share	files	send <file_keyword> pick jordan up </file_keyword> <file_type> PDF </file_type> to <to_contact_name> apsion </to_contact_name>
0	send buy beer workbook to sommeran	file_share	files	send <file_keyword> buy beer </file_keyword> <file_type> workbook </file_type> to <to_contact_name> sommeran </to_contact_name>
0	send john dodridge docs to sochackyj	file_share	files	send <file_keyword> john dodridge </file_keyword> <file_type> docs </file_type> to <to_contact_name> sochackyj </to_contact_name>
0	send movies playing doc to koklarova	file_share	files	send <file_keyword> movies playing </file_keyword> <file_type> doc </file_type> to <to_contact_name> koklarova </to_contact_name>
0	send meeting about zoo doc to magaliff bizamcer	file_share	files	send <file_keyword> meeting about zoo </file_keyword> <file_type> doc </file_type> to <to_contact_name> magaliff bizamcer </to_contact_name>
0	send pay worksheet to petriconi	file_share	files	send <file_keyword> pay </file_keyword> <file_type> worksheet </file_type> to <to_contact_name> petriconi </to_contact_name>
0	send interview with conserve energy doc to pizzatto ylikoski	file_share	files	send <file_keyword> interview with conserve energy </file_keyword> <file_type> doc </file_type> to <to_contact_name> pizzatto ylikoski </to_contact_name>
0	send tech support meeting excel to magaliff gonpachiro	file_share	files	send <file_keyword> tech support meeting </file_keyword> <file_type> excel </file_type> to <to_contact_name> magaliff gonpachiro </to_contact_name>
0	send specialized steel bike jpg to gilauri	file_share	files	send <file_keyword> specialized steel bike </file_keyword> <file_type> jpg </file_type> to <to_contact_name> gilauri </to_contact_name>
0	send go to the gym at 5 decks to dunzelman	file_share	files	send <file_keyword> go to the gym at 5 </file_keyword> <file_type> decks </file_type> to <to_contact_name> dunzelman </to_contact_name>
0	send fifteen to ten decks to ramovic mancior	file_share	files	send <file_keyword> fifteen to ten </file_keyword> <file_type> decks </file_type> to <to_contact_name> ramovic mancior </to_contact_name>
0	send date with anthony workbook to galjevic hinokarume	file_share	files	send <file_keyword> date with anthony </file_keyword> <file_type> workbook </file_type> to <to_contact_name> galjevic hinokarume </to_contact_name>
0	send sex sounds vdw to märja	file_share	files	send <file_keyword> sex sounds </file_keyword> <file_type> vdw </file_type> to <to_contact_name> märja </to_contact_name>
0	send santa's ride docs to bourmance	file_share	files	send <file_keyword> santa's ride </file_keyword> <file_type> docs </file_type> to <to_contact_name> bourmance </to_contact_name>
0	send watch game docs to niso dunzelman	file_share	files	send <file_keyword> watch game </file_keyword> <file_type> docs </file_type> to <to_contact_name> niso dunzelman </to_contact_name>
0	send people invited to the wedding docx to bourmance busharov	file_share	files	send <file_keyword> people invited to the wedding </file_keyword> <file_type> docx </file_type> to <to_contact_name> bourmance busharov </to_contact_name>
0	send i'm working csv to lingiya	file_share	files	send <file_keyword> i'm working </file_keyword> <file_type> csv </file_type> to <to_contact_name> lingiya </to_contact_name>
0	send mercedes benz dealership mpt to skomra	file_share	files	send <file_keyword> mercedes benz dealership </file_keyword> <file_type> mpt </file_type> to <to_contact_name> skomra </to_contact_name>
0	send bosses note to grunden	file_share	files	send <file_keyword> bosses </file_keyword> <file_type> note </file_type> to <to_contact_name> grunden </to_contact_name>
0	send hawaii powerpoint to kapitanovic	file_share	files	send <file_keyword> hawaii </file_keyword> <file_type> powerpoint </file_type> to <to_contact_name> kapitanovic </to_contact_name>
0	send untitled csv to gilauri	file_share	files	send <file_keyword> untitled </file_keyword> <file_type> csv </file_type> to <to_contact_name> gilauri </to_contact_name>
0	send driving school presentations to frusescu	file_share	files	send <file_keyword> driving school </file_keyword> <file_type> presentations </file_type> to <to_contact_name> frusescu </to_contact_name>
0	send conference with teacher decks to jerosimija	file_share	files	send <file_keyword> conference with teacher </file_keyword> <file_type> decks </file_type> to <to_contact_name> jerosimija </to_contact_name>
0	send elders meeting note to rogala zhigpo	file_share	files	send <file_keyword> elders meeting </file_keyword> <file_type> note </file_type> to <to_contact_name> rogala zhigpo </to_contact_name>
0	send invites ics to sauve-majeure	file_share	files	send <file_keyword> invites </file_keyword> <file_type> ics </file_type> to <to_contact_name> sauve-majeure </to_contact_name>
0	send sally dosed pdf to iszakovits wagaman	file_share	files	send <file_keyword> sally dosed </file_keyword> <file_type> pdf </file_type> to <to_contact_name> iszakovits wagaman </to_contact_name>
0	send scentsy event vsdm to schallegger rimsberg	file_share	files	send <file_keyword> scentsy event </file_keyword> <file_type> vsdm </file_type> to <to_contact_name> schallegger rimsberg </to_contact_name>
0	send need milk presentation to schieldrop	file_share	files	send <file_keyword> need milk </file_keyword> <file_type> presentation </file_type> to <to_contact_name> schieldrop </to_contact_name>
0	send send parts to kevin vssm to fosnight seikanji	file_share	files	send <file_keyword> send parts to kevin </file_keyword> <file_type> vssm </file_type> to <to_contact_name> fosnight seikanji </to_contact_name>
0	send biking vssm to lohan	file_share	files	send <file_keyword> biking </file_keyword> <file_type> vssm </file_type> to <to_contact_name> lohan </to_contact_name>
0	send put the kids in the back notebook to tachner	file_share	files	send <file_keyword> put the kids in the back </file_keyword> <file_type> notebook </file_type> to <to_contact_name> tachner </to_contact_name>
0	send sex sounds vstx to pierazzo	file_share	files	send <file_keyword> sex sounds </file_keyword> <file_type> vstx </file_type> to <to_contact_name> pierazzo </to_contact_name>
0	send meet my father vdw to kiikkala	file_share	files	send <file_keyword> meet my father </file_keyword> <file_type> vdw </file_type> to <to_contact_name> kiikkala </to_contact_name>
0	send biking xlsx to ivete	file_share	files	send <file_keyword> biking </file_keyword> <file_type> xlsx </file_type> to <to_contact_name> ivete </to_contact_name>
0	send dance class ppts to nabihejazi hyvakka	file_share	files	send <file_keyword> dance class </file_keyword> <file_type> ppts </file_type> to <to_contact_name> nabihejazi hyvakka </to_contact_name>
0	send mr . ng appointment decks to morohito brelje	file_share	files	send <file_keyword> mr . ng appointment </file_keyword> <file_type> decks </file_type> to <to_contact_name> morohito brelje </to_contact_name>
0	send yes Docs to cankaya dunzelman	file_share	files	send <file_keyword> yes </file_keyword> <file_type> Docs </file_type> to <to_contact_name> cankaya dunzelman </to_contact_name>
0	send specialized steel bike vst to watfa giovingo	file_share	files	send <file_keyword> specialized steel bike </file_keyword> <file_type> vst </file_type> to <to_contact_name> watfa giovingo </to_contact_name>
0	send conner ' s leet ' s meeting vdw to miesl korres	file_share	files	send <file_keyword> conner ' s leet ' s meeting </file_keyword> <file_type> vdw </file_type> to <to_contact_name> miesl korres </to_contact_name>
0	send anna lugo go vst to felicides	file_share	files	send <file_keyword> anna lugo go </file_keyword> <file_type> vst </file_type> to <to_contact_name> felicides </to_contact_name>
