0	send watch Docs to kalnynsh jerosimija	file_share	files	send <file_keyword> watch </file_keyword> <file_type> Docs </file_type> to <to_contact_name> kalnynsh jerosimija </to_contact_name>
0	send quarter 4 driving lesson vdw to broekhuizen godovkin	file_share	files	send <file_keyword> quarter 4 driving lesson </file_keyword> <file_type> vdw </file_type> to <to_contact_name> broekhuizen godovkin </to_contact_name>
0	send bmw Docs to tudisco francois-romain	file_share	files	send <file_keyword> bmw </file_keyword> <file_type> Docs </file_type> to <to_contact_name> tudisco francois-romain </to_contact_name>
0	send go to movie docs to bagarus isaace	file_share	files	send <file_keyword> go to movie </file_keyword> <file_type> docs </file_type> to <to_contact_name> bagarus isaace </to_contact_name>
0	send physical doctor ' s appointment notebooks to subotic ramovic	file_share	files	send <file_keyword> physical doctor ' s appointment </file_keyword> <file_type> notebooks </file_type> to <to_contact_name> subotic ramovic </to_contact_name>
0	send city inspection gif to brelje becklund	file_share	files	send <file_keyword> city inspection </file_keyword> <file_type> gif </file_type> to <to_contact_name> brelje becklund </to_contact_name>
0	send free desktop ppt to seikanji	file_share	files	send <file_keyword> free desktop </file_keyword> <file_type> ppt </file_type> to <to_contact_name> seikanji </to_contact_name>
0	send evernote ink workbook to vagarsh giovingo	file_share	files	send <file_keyword> evernote ink </file_keyword> <file_type> workbook </file_type> to <to_contact_name> vagarsh giovingo </to_contact_name>
0	send number one spreadsheets to sallan	file_share	files	send <file_keyword> number one </file_keyword> <file_type> spreadsheets </file_type> to <to_contact_name> sallan </to_contact_name>
0	send endo's copy docx to tagenius steusing	file_share	files	send <file_keyword> endo's copy </file_keyword> <file_type> docx </file_type> to <to_contact_name> tagenius steusing </to_contact_name>
0	send baby feeding schedule pdf to rogala	file_share	files	send <file_keyword> baby feeding schedule </file_keyword> <file_type> pdf </file_type> to <to_contact_name> rogala </to_contact_name>
0	send paintball vsd to sommeran sunobe	file_share	files	send <file_keyword> paintball </file_keyword> <file_type> vsd </file_type> to <to_contact_name> sommeran sunobe </to_contact_name>
0	send hygienist appointment docx to poliziano hinokarume	file_share	files	send <file_keyword> hygienist appointment </file_keyword> <file_type> docx </file_type> to <to_contact_name> poliziano hinokarume </to_contact_name>
0	send visit zoo with kids class onenote to pierazzo skomra	file_share	files	send <file_keyword> visit zoo with kids class </file_keyword> <file_type> onenote </file_type> to <to_contact_name> pierazzo skomra </to_contact_name>
0	send check smart notebooks to kawabe kaustav	file_share	files	send <file_keyword> check smart </file_keyword> <file_type> notebooks </file_type> to <to_contact_name> kawabe kaustav </to_contact_name>
0	send interview with conserve energy docx to böhmer goguillot	file_share	files	send <file_keyword> interview with conserve energy </file_keyword> <file_type> docx </file_type> to <to_contact_name> böhmer goguillot </to_contact_name>
0	send mp tree docx to fujin mackisack	file_share	files	send <file_keyword> mp tree </file_keyword> <file_type> docx </file_type> to <to_contact_name> fujin mackisack </to_contact_name>
0	send phoebe ' s party notes to prageeta	file_share	files	send <file_keyword> phoebe ' s party </file_keyword> <file_type> notes </file_type> to <to_contact_name> prageeta </to_contact_name>
0	send crossy road vsdx to basacar skomra	file_share	files	send <file_keyword> crossy road </file_keyword> <file_type> vsdx </file_type> to <to_contact_name> basacar skomra </to_contact_name>
0	send desktop vssm to chrysteai ushirogaya	file_share	files	send <file_keyword> desktop </file_keyword> <file_type> vssm </file_type> to <to_contact_name> chrysteai ushirogaya </to_contact_name>
0	send plus fitness xls to gemahling chôko	file_share	files	send <file_keyword> plus fitness </file_keyword> <file_type> xls </file_type> to <to_contact_name> gemahling chôko </to_contact_name>
0	send library book slides to francois-romain lecorbusier	file_share	files	send <file_keyword> library book </file_keyword> <file_type> slides </file_type> to <to_contact_name> francois-romain lecorbusier </to_contact_name>
0	send sleepy early vdw to nabihejazi peschler	file_share	files	send <file_keyword> sleepy early </file_keyword> <file_type> vdw </file_type> to <to_contact_name> nabihejazi peschler </to_contact_name>
0	send send parts to kevin pdf to ushirogaya sarshik	file_share	files	send <file_keyword> send parts to kevin </file_keyword> <file_type> pdf </file_type> to <to_contact_name> ushirogaya sarshik </to_contact_name>
0	send crossy road slides to crutchev	file_share	files	send <file_keyword> crossy road </file_keyword> <file_type> slides </file_type> to <to_contact_name> crutchev </to_contact_name>
0	send one plus one slide to friedrichshagen balingiyn	file_share	files	send <file_keyword> one plus one </file_keyword> <file_type> slide </file_type> to <to_contact_name> friedrichshagen balingiyn </to_contact_name>
0	send pick jordan up vsdm to felicides	file_share	files	send <file_keyword> pick jordan up </file_keyword> <file_type> vsdm </file_type> to <to_contact_name> felicides </to_contact_name>
0	send free desktop vssm to subotic	file_share	files	send <file_keyword> free desktop </file_keyword> <file_type> vssm </file_type> to <to_contact_name> subotic </to_contact_name>
0	send barbecue at michael's place spreadsheets to jerosimija seddik	file_share	files	send <file_keyword> barbecue at michael's place </file_keyword> <file_type> spreadsheets </file_type> to <to_contact_name> jerosimija seddik </to_contact_name>
0	send biking spec to merv miesl	file_share	files	send <file_keyword> biking </file_keyword> <file_type> spec </file_type> to <to_contact_name> merv miesl </to_contact_name>
0	send computer science exam workbook to stonum	file_share	files	send <file_keyword> computer science exam </file_keyword> <file_type> workbook </file_type> to <to_contact_name> stonum </to_contact_name>
0	send invites notebook to mancior	file_share	files	send <file_keyword> invites </file_keyword> <file_type> notebook </file_type> to <to_contact_name> mancior </to_contact_name>
0	send mummy ' s birthday pdfs to batousek inverclyde	file_share	files	send <file_keyword> mummy ' s birthday </file_keyword> <file_type> pdfs </file_type> to <to_contact_name> batousek inverclyde </to_contact_name>
0	send pay onenote to almoguera tagenius	file_share	files	send <file_keyword> pay </file_keyword> <file_type> onenote </file_type> to <to_contact_name> almoguera tagenius </to_contact_name>
0	send science fair ideas xlsx to jender walman	file_share	files	send <file_keyword> science fair ideas </file_keyword> <file_type> xlsx </file_type> to <to_contact_name> jender walman </to_contact_name>
0	send payton thirty note to gonyeau knutzen	file_share	files	send <file_keyword> payton thirty </file_keyword> <file_type> note </file_type> to <to_contact_name> gonyeau knutzen </to_contact_name>
0	send contact advisor spec to brogniart	file_share	files	send <file_keyword> contact advisor </file_keyword> <file_type> spec </file_type> to <to_contact_name> brogniart </to_contact_name>
0	send hawaii docs to gilauri bacun	file_share	files	send <file_keyword> hawaii </file_keyword> <file_type> docs </file_type> to <to_contact_name> gilauri bacun </to_contact_name>
0	send one plus one vss to knutzen	file_share	files	send <file_keyword> one plus one </file_keyword> <file_type> vss </file_type> to <to_contact_name> knutzen </to_contact_name>
0	send boy scouts xls to almoguera basacar	file_share	files	send <file_keyword> boy scouts </file_keyword> <file_type> xls </file_type> to <to_contact_name> almoguera basacar </to_contact_name>
0	send ballet practice csv to konnik jordovic	file_share	files	send <file_keyword> ballet practice </file_keyword> <file_type> csv </file_type> to <to_contact_name> konnik jordovic </to_contact_name>
0	send kroger shop vst to tiezheng	file_share	files	send <file_keyword> kroger shop </file_keyword> <file_type> vst </file_type> to <to_contact_name> tiezheng </to_contact_name>
0	send talon morris' birthday ics to sundine	file_share	files	send <file_keyword> talon morris' birthday </file_keyword> <file_type> ics </file_type> to <to_contact_name> sundine </to_contact_name>
0	send nick junior christening worksheet to prageeta	file_share	files	send <file_keyword> nick junior christening </file_keyword> <file_type> worksheet </file_type> to <to_contact_name> prageeta </to_contact_name>
0	send dance class pdf to stonum	file_share	files	send <file_keyword> dance class </file_keyword> <file_type> pdf </file_type> to <to_contact_name> stonum </to_contact_name>
0	send return all phones calls notebook to ribolsi	file_share	files	send <file_keyword> return all phones calls </file_keyword> <file_type> notebook </file_type> to <to_contact_name> ribolsi </to_contact_name>
0	send terraria dot exe ppt to communier	file_share	files	send <file_keyword> terraria dot exe </file_keyword> <file_type> ppt </file_type> to <to_contact_name> communier </to_contact_name>
0	send spring cleaning excels to takayesu	file_share	files	send <file_keyword> spring cleaning </file_keyword> <file_type> excels </file_type> to <to_contact_name> takayesu </to_contact_name>
0	send household PDF to mbane	file_share	files	send <file_keyword> household </file_keyword> <file_type> PDF </file_type> to <to_contact_name> mbane </to_contact_name>
0	send jake ' s in town doc to becklund schreiterova	file_share	files	send <file_keyword> jake ' s in town </file_keyword> <file_type> doc </file_type> to <to_contact_name> becklund schreiterova </to_contact_name>
0	send spring cleaning Docs to lingiya kapitanovic	file_share	files	send <file_keyword> spring cleaning </file_keyword> <file_type> Docs </file_type> to <to_contact_name> lingiya kapitanovic </to_contact_name>
0	send jackson's flag football game jpg to taccon	file_share	files	send <file_keyword> jackson's flag football game </file_keyword> <file_type> jpg </file_type> to <to_contact_name> taccon </to_contact_name>
0	send nick junior christening word to mackirdy	file_share	files	send <file_keyword> nick junior christening </file_keyword> <file_type> word </file_type> to <to_contact_name> mackirdy </to_contact_name>
0	send pick jordan up onenote to patraulea	file_share	files	send <file_keyword> pick jordan up </file_keyword> <file_type> onenote </file_type> to <to_contact_name> patraulea </to_contact_name>
0	send mot service vstm to skomra aguiati	file_share	files	send <file_keyword> mot service </file_keyword> <file_type> vstm </file_type> to <to_contact_name> skomra aguiati </to_contact_name>
0	send terraria dot exe Docs to gurda	file_share	files	send <file_keyword> terraria dot exe </file_keyword> <file_type> Docs </file_type> to <to_contact_name> gurda </to_contact_name>
0	send lake house PDF to motzenbacker siyami	file_share	files	send <file_keyword> lake house </file_keyword> <file_type> PDF </file_type> to <to_contact_name> motzenbacker siyami </to_contact_name>
0	send brentalfloss mpp to gaitzsch	file_share	files	send <file_keyword> brentalfloss </file_keyword> <file_type> mpp </file_type> to <to_contact_name> gaitzsch </to_contact_name>
0	send let's see how are you? powerpoints to canapville	file_share	files	send <file_keyword> let's see how are you? </file_keyword> <file_type> powerpoints </file_type> to <to_contact_name> canapville </to_contact_name>
0	send mercedes benz dealership onenote to sisung	file_share	files	send <file_keyword> mercedes benz dealership </file_keyword> <file_type> onenote </file_type> to <to_contact_name> sisung </to_contact_name>
0	send pick up prescription at walgreens doc to zhigpo taccon	file_share	files	send <file_keyword> pick up prescription at walgreens </file_keyword> <file_type> doc </file_type> to <to_contact_name> zhigpo taccon </to_contact_name>
0	send leah ' s birthday image to gaumont	file_share	files	send <file_keyword> leah ' s birthday </file_keyword> <file_type> image </file_type> to <to_contact_name> gaumont </to_contact_name>
0	send endo's copy vssx to batesole	file_share	files	send <file_keyword> endo's copy </file_keyword> <file_type> vssx </file_type> to <to_contact_name> batesole </to_contact_name>
0	send test 2 vstm to lecorbusier	file_share	files	send <file_keyword> test 2 </file_keyword> <file_type> vstm </file_type> to <to_contact_name> lecorbusier </to_contact_name>
0	send talon morris' birthday word to batousek	file_share	files	send <file_keyword> talon morris' birthday </file_keyword> <file_type> word </file_type> to <to_contact_name> batousek </to_contact_name>
0	send make cinnamon rolls xlsx to steusing batesole	file_share	files	send <file_keyword> make cinnamon rolls </file_keyword> <file_type> xlsx </file_type> to <to_contact_name> steusing batesole </to_contact_name>
0	send call federico excel to tagenius bacun	file_share	files	send <file_keyword> call federico </file_keyword> <file_type> excel </file_type> to <to_contact_name> tagenius bacun </to_contact_name>
0	send call federico docx to balingiyn	file_share	files	send <file_keyword> call federico </file_keyword> <file_type> docx </file_type> to <to_contact_name> balingiyn </to_contact_name>
0	send michael ' s wedding spec to shirinski	file_share	files	send <file_keyword> michael ' s wedding </file_keyword> <file_type> spec </file_type> to <to_contact_name> shirinski </to_contact_name>
0	send memorial weekend png to kiikkala veresevic	file_share	files	send <file_keyword> memorial weekend </file_keyword> <file_type> png </file_type> to <to_contact_name> kiikkala veresevic </to_contact_name>
0	send bmw presentation to canapville rogala	file_share	files	send <file_keyword> bmw </file_keyword> <file_type> presentation </file_type> to <to_contact_name> canapville rogala </to_contact_name>
0	send moms doctor excels to paragioudakis goulinet	file_share	files	send <file_keyword> moms doctor </file_keyword> <file_type> excels </file_type> to <to_contact_name> paragioudakis goulinet </to_contact_name>
0	send doctor mom image to ciluzzi	file_share	files	send <file_keyword> doctor mom </file_keyword> <file_type> image </file_type> to <to_contact_name> ciluzzi </to_contact_name>
0	send meet my father workbook to schieldrop sisung	file_share	files	send <file_keyword> meet my father </file_keyword> <file_type> workbook </file_type> to <to_contact_name> schieldrop sisung </to_contact_name>
0	send mm rehearsal vsdx to watfa	file_share	files	send <file_keyword> mm rehearsal </file_keyword> <file_type> vsdx </file_type> to <to_contact_name> watfa </to_contact_name>
0	send invite people docs to galjevic	file_share	files	send <file_keyword> invite people </file_keyword> <file_type> docs </file_type> to <to_contact_name> galjevic </to_contact_name>
0	send christmas service note to lenkeith ramovic	file_share	files	send <file_keyword> christmas service </file_keyword> <file_type> note </file_type> to <to_contact_name> lenkeith ramovic </to_contact_name>
0	send buy beer vstx to launimo dobrovol'skii	file_share	files	send <file_keyword> buy beer </file_keyword> <file_type> vstx </file_type> to <to_contact_name> launimo dobrovol'skii </to_contact_name>
0	send appointment for the dentist ppt to goulinet	file_share	files	send <file_keyword> appointment for the dentist </file_keyword> <file_type> ppt </file_type> to <to_contact_name> goulinet </to_contact_name>
0	send jess ' s baby shower vst to janneaud	file_share	files	send <file_keyword> jess ' s baby shower </file_keyword> <file_type> vst </file_type> to <to_contact_name> janneaud </to_contact_name>
0	send potomac nationals game onenotes to shirinski batesole	file_share	files	send <file_keyword> potomac nationals game </file_keyword> <file_type> onenotes </file_type> to <to_contact_name> shirinski batesole </to_contact_name>
0	send mindshare csv to fuscaldi	file_share	files	send <file_keyword> mindshare </file_keyword> <file_type> csv </file_type> to <to_contact_name> fuscaldi </to_contact_name>
0	send make cinnamon rolls docs to stubaune	file_share	files	send <file_keyword> make cinnamon rolls </file_keyword> <file_type> docs </file_type> to <to_contact_name> stubaune </to_contact_name>
0	send barbecue at michael's place vsdm to kothenschulte magaliff	file_share	files	send <file_keyword> barbecue at michael's place </file_keyword> <file_type> vsdm </file_type> to <to_contact_name> kothenschulte magaliff </to_contact_name>
0	send go to the hospital deck to siyami yotsumatsu	file_share	files	send <file_keyword> go to the hospital </file_keyword> <file_type> deck </file_type> to <to_contact_name> siyami yotsumatsu </to_contact_name>
0	send biking tsv to siyami goguillot	file_share	files	send <file_keyword> biking </file_keyword> <file_type> tsv </file_type> to <to_contact_name> siyami goguillot </to_contact_name>
0	send have dinner spreadsheets to fosnight	file_share	files	send <file_keyword> have dinner </file_keyword> <file_type> spreadsheets </file_type> to <to_contact_name> fosnight </to_contact_name>
0	send bring electronics to dumps notebooks to layaly amiar	file_share	files	send <file_keyword> bring electronics to dumps </file_keyword> <file_type> notebooks </file_type> to <to_contact_name> layaly amiar </to_contact_name>
0	send mummy ' s birthday spreadsheet to fusasato stonum	file_share	files	send <file_keyword> mummy ' s birthday </file_keyword> <file_type> spreadsheet </file_type> to <to_contact_name> fusasato stonum </to_contact_name>
0	send made phone call to dad vstx to misat motykova	file_share	files	send <file_keyword> made phone call to dad </file_keyword> <file_type> vstx </file_type> to <to_contact_name> misat motykova </to_contact_name>
0	send bring electronics to dumps vsdm to veresevic hinokarume	file_share	files	send <file_keyword> bring electronics to dumps </file_keyword> <file_type> vsdm </file_type> to <to_contact_name> veresevic hinokarume </to_contact_name>
0	send michael ' s wedding presentations to bizamcer lenkeith	file_share	files	send <file_keyword> michael ' s wedding </file_keyword> <file_type> presentations </file_type> to <to_contact_name> bizamcer lenkeith </to_contact_name>
0	send m a super cross csv to veresevic tachner	file_share	files	send <file_keyword> m a super cross </file_keyword> <file_type> csv </file_type> to <to_contact_name> veresevic tachner </to_contact_name>
0	send talon morris' birthday ppts to tiezheng	file_share	files	send <file_keyword> talon morris' birthday </file_keyword> <file_type> ppts </file_type> to <to_contact_name> tiezheng </to_contact_name>
0	send cheerleading schedule excel to boenickhausen-eiffel	file_share	files	send <file_keyword> cheerleading schedule </file_keyword> <file_type> excel </file_type> to <to_contact_name> boenickhausen-eiffel </to_contact_name>
0	send mindshare vdw to ramovic	file_share	files	send <file_keyword> mindshare </file_keyword> <file_type> vdw </file_type> to <to_contact_name> ramovic </to_contact_name>
0	send bmw presentation to jender	file_share	files	send <file_keyword> bmw </file_keyword> <file_type> presentation </file_type> to <to_contact_name> jender </to_contact_name>
0	send john dodridge vstm to handulleh szalavetz	file_share	files	send <file_keyword> john dodridge </file_keyword> <file_type> vstm </file_type> to <to_contact_name> handulleh szalavetz </to_contact_name>
0	send cute rate with some vsdm to hyvakka	file_share	files	send <file_keyword> cute rate with some </file_keyword> <file_type> vsdm </file_type> to <to_contact_name> hyvakka </to_contact_name>
0	send video games i want to buy Doc to tagenius grunden	file_share	files	send <file_keyword> video games i want to buy </file_keyword> <file_type> Doc </file_type> to <to_contact_name> tagenius grunden </to_contact_name>
0	send ballet practice mpt to duplessix	file_share	files	send <file_keyword> ballet practice </file_keyword> <file_type> mpt </file_type> to <to_contact_name> duplessix </to_contact_name>
0	send cancel babysitting vst to cortelli almoguera	file_share	files	send <file_keyword> cancel babysitting </file_keyword> <file_type> vst </file_type> to <to_contact_name> cortelli almoguera </to_contact_name>
0	send plus fitness deck to shirinski okot	file_share	files	send <file_keyword> plus fitness </file_keyword> <file_type> deck </file_type> to <to_contact_name> shirinski okot </to_contact_name>
0	send iep meeting deck to niso	file_share	files	send <file_keyword> iep meeting </file_keyword> <file_type> deck </file_type> to <to_contact_name> niso </to_contact_name>
0	send bmw decks to sim-deok gaumont	file_share	files	send <file_keyword> bmw </file_keyword> <file_type> decks </file_type> to <to_contact_name> sim-deok gaumont </to_contact_name>
0	send untitled msg to akayd?n	file_share	files	send <file_keyword> untitled </file_keyword> <file_type> msg </file_type> to <to_contact_name> akayd?n </to_contact_name>
0	send hygienist appointment onenotes to peck-eyler batesole	file_share	files	send <file_keyword> hygienist appointment </file_keyword> <file_type> onenotes </file_type> to <to_contact_name> peck-eyler batesole </to_contact_name>
0	send check smart ics to sunobe gemahling	file_share	files	send <file_keyword> check smart </file_keyword> <file_type> ics </file_type> to <to_contact_name> sunobe gemahling </to_contact_name>
0	send plus fitness vstx to pierazzo	file_share	files	send <file_keyword> plus fitness </file_keyword> <file_type> vstx </file_type> to <to_contact_name> pierazzo </to_contact_name>
0	send webroot secure anywhere pptx to brogniart	file_share	files	send <file_keyword> webroot secure anywhere </file_keyword> <file_type> pptx </file_type> to <to_contact_name> brogniart </to_contact_name>
0	send webroot secure anywhere decks to lenkeith kothenschulte	file_share	files	send <file_keyword> webroot secure anywhere </file_keyword> <file_type> decks </file_type> to <to_contact_name> lenkeith kothenschulte </to_contact_name>
0	send untitled notebooks to szalavetz siyami	file_share	files	send <file_keyword> untitled </file_keyword> <file_type> notebooks </file_type> to <to_contact_name> szalavetz siyami </to_contact_name>
0	send edc note to mitroshin giovingo	file_share	files	send <file_keyword> edc </file_keyword> <file_type> note </file_type> to <to_contact_name> mitroshin giovingo </to_contact_name>
0	send watch game doc to steusing tuncel	file_share	files	send <file_keyword> watch game </file_keyword> <file_type> doc </file_type> to <to_contact_name> steusing tuncel </to_contact_name>
0	send memorial weekend tsv to basacar	file_share	files	send <file_keyword> memorial weekend </file_keyword> <file_type> tsv </file_type> to <to_contact_name> basacar </to_contact_name>
0	send let's see how are you? vsdx to tachner	file_share	files	send <file_keyword> let's see how are you? </file_keyword> <file_type> vsdx </file_type> to <to_contact_name> tachner </to_contact_name>
0	send payton thirty csv to chôko aguiati	file_share	files	send <file_keyword> payton thirty </file_keyword> <file_type> csv </file_type> to <to_contact_name> chôko aguiati </to_contact_name>
0	send jackson's flag football game presentations to pirozhkova	file_share	files	send <file_keyword> jackson's flag football game </file_keyword> <file_type> presentations </file_type> to <to_contact_name> pirozhkova </to_contact_name>
0	send moms doctor spec to kawabe iszakovits	file_share	files	send <file_keyword> moms doctor </file_keyword> <file_type> spec </file_type> to <to_contact_name> kawabe iszakovits </to_contact_name>
0	send hey jessie onenote to sochackyj	file_share	files	send <file_keyword> hey jessie </file_keyword> <file_type> onenote </file_type> to <to_contact_name> sochackyj </to_contact_name>
0	send computer science exam jpeg to okot	file_share	files	send <file_keyword> computer science exam </file_keyword> <file_type> jpeg </file_type> to <to_contact_name> okot </to_contact_name>
0	send go to the hospital pptx to gurda petriconi	file_share	files	send <file_keyword> go to the hospital </file_keyword> <file_type> pptx </file_type> to <to_contact_name> gurda petriconi </to_contact_name>
0	send ballet practice word to mitroshin	file_share	files	send <file_keyword> ballet practice </file_keyword> <file_type> word </file_type> to <to_contact_name> mitroshin </to_contact_name>
0	send baby feeding schedule onenote to guillemenot goulinet	file_share	files	send <file_keyword> baby feeding schedule </file_keyword> <file_type> onenote </file_type> to <to_contact_name> guillemenot goulinet </to_contact_name>
0	send watch game deck to aiichi	file_share	files	send <file_keyword> watch game </file_keyword> <file_type> deck </file_type> to <to_contact_name> aiichi </to_contact_name>
0	send go shopping xlsx to sallan	file_share	files	send <file_keyword> go shopping </file_keyword> <file_type> xlsx </file_type> to <to_contact_name> sallan </to_contact_name>
0	send buy beer vstx to merv	file_share	files	send <file_keyword> buy beer </file_keyword> <file_type> vstx </file_type> to <to_contact_name> merv </to_contact_name>
0	send meeting about zoo vsdm to felicides	file_share	files	send <file_keyword> meeting about zoo </file_keyword> <file_type> vsdm </file_type> to <to_contact_name> felicides </to_contact_name>
0	send chennai's birthday powerpoints to gurda duplessix	file_share	files	send <file_keyword> chennai's birthday </file_keyword> <file_type> powerpoints </file_type> to <to_contact_name> gurda duplessix </to_contact_name>
