TurnNumber	PreviousTurnIntent	query	domain	PreviousTurnDomain	TaskFrameStatus	TaskFrameEntityStates	TaskFrameGUID	SpeechPeopleDisambiguationGrammarMatches	ConversationalContext	Source
0		Share this file of this conversation	files							domain_extract_from_slot_query.tsv
0		share file document put cat out	files							domain_extract_from_slot_query.tsv
0		share stopwatch deck	files							domain_extract_from_slot_query.tsv
0		share file elizabeth arden with contessa meeting	files							domain_extract_from_slot_query.tsv
0		share geusen the battersea food fest file	files							domain_extract_from_slot_query.tsv
0		share file doc appointment with bunny with this chat	files							domain_extract_from_slot_query.tsv
0		share file doc brandon workout with this chat	files							domain_extract_from_slot_query.tsv
0		share file document parents are arriving	files							domain_extract_from_slot_query.tsv
0		share file with the holiday plans meeting at 12:35 am	files							domain_extract_from_slot_query.tsv
0		share notes file in test channel window	files							domain_extract_from_slot_query.tsv
0		share roshana file in teams factory conversation window	files							domain_extract_from_slot_query.tsv
0		share vss file with mangicavallo	files							domain_extract_from_slot_query.tsv
0		share all the supplies to buy deck	files							domain_extract_from_slot_query.tsv
0		share file meeting with fleur with the pickups meeting	files							domain_extract_from_slot_query.tsv
0		share conversion files to general conversation window	files							domain_extract_from_slot_query.tsv
0		share agent tap files in teams device chat window	files							domain_extract_from_slot_query.tsv
0		share file to sotea	files							domain_extract_from_slot_query.tsv
0		share file with my 10 pm on Wednesday meeting attendees	files							domain_extract_from_slot_query.tsv
0		share appointment for blood file with voice skills stand up team window	files							domain_extract_from_slot_query.tsv
0		share file dave and rita miller with group six meeting	files							domain_extract_from_slot_query.tsv
0		share pdf file with szentvolgyi	files							domain_extract_from_slot_query.tsv
0		share file doc magazine designing	files							domain_extract_from_slot_query.tsv
0		share file psya 2 with next internet history meeting	files							domain_extract_from_slot_query.tsv
0		Share brownbag OneNote I was using to the meeting	files							domain_extract_from_slot_query.tsv
0		share go get a drink file in teams factory chat window	files							domain_extract_from_slot_query.tsv
0		share new rental file with test conversation	files							domain_extract_from_slot_query.tsv
0		share file disneyland with next bose meeting	files							domain_extract_from_slot_query.tsv
0		share file document buckle appointment	files							domain_extract_from_slot_query.tsv
0		share file masonic home with the release of suicide squad meeting	files							domain_extract_from_slot_query.tsv
0		share file doc pension meeting with this chat	files							domain_extract_from_slot_query.tsv
0		share hey sam's club deck	files							domain_extract_from_slot_query.tsv
0		share file add on folder with mealman	files							domain_extract_from_slot_query.tsv
0		share file document appointment for my hair	files							domain_extract_from_slot_query.tsv
0		share schama the buy kaylie ice cream file	files							domain_extract_from_slot_query.tsv
0		share file b. m. w. service with the monsoon meeting	files							domain_extract_from_slot_query.tsv
0		Share deployment timeline PowerPoint using the next conversation	files							domain_extract_from_slot_query.tsv
0		share file appointment with adam with uegler	files							domain_extract_from_slot_query.tsv
0		share notebooks file with polifron	files							domain_extract_from_slot_query.tsv
0		Share this file with my meeting at 7am	files							domain_extract_from_slot_query.tsv
0		share file dinner with kyle with cassegrain	files							domain_extract_from_slot_query.tsv
0		share file to vencovsky	files							domain_extract_from_slot_query.tsv
0		share file doc check the book in the study with this chat	files							domain_extract_from_slot_query.tsv
0		share notes file with test channel window	files							domain_extract_from_slot_query.tsv
0		Share workplace files on that chat	files							domain_extract_from_slot_query.tsv
0		share file yoga date with the memorial of christ death meeting	files							domain_extract_from_slot_query.tsv
0		share Doc file with ruszkovszki	files							domain_extract_from_slot_query.tsv
0		share file meet rick baker on job site with next dinner at al fresco's meeting	files							domain_extract_from_slot_query.tsv
0		share bring calculator file with my 4:00 o'clock meeting	files							domain_extract_from_slot_query.tsv
0		share train journey file to teams device meeting window	files							domain_extract_from_slot_query.tsv
0		share file with 2:14 am meeting	files							domain_extract_from_slot_query.tsv
0		share liverpool in football finals deck	files							domain_extract_from_slot_query.tsv
0		share a file with my meeting participants at next	files							domain_extract_from_slot_query.tsv
0		share file to vere	files							domain_extract_from_slot_query.tsv
0		share aigrain the dance on the twelfth file	files							domain_extract_from_slot_query.tsv
0		share check change my calendar file with the 12:35 am meeting	files							domain_extract_from_slot_query.tsv
0		share bonnie to come over file in general team window	files							domain_extract_from_slot_query.tsv
0		Share file brownbag with this conversation	files							domain_extract_from_slot_query.tsv
0		share file doc magazine designing with this chat	files							domain_extract_from_slot_query.tsv
0		share files with John	files							domain_extract_from_slot_query.tsv
0		share choir rehearsal file to intelligence one team window	files							domain_extract_from_slot_query.tsv
0		share deployment timeline files with Jacob	files							domain_extract_from_slot_query.tsv
0		share file signature with next deadline meeting	files							domain_extract_from_slot_query.tsv
0		share file ballarat hub with webinar at dcu unlimited meeting	files							domain_extract_from_slot_query.tsv
0		Share file insurance to shiproom meeting	files							domain_extract_from_slot_query.tsv
0		share file with current chat	files							domain_extract_from_slot_query.tsv
0		share preview test plan document file with jay	files							domain_extract_from_slot_query.tsv
0		share spa file in shiproom channel	files							domain_extract_from_slot_query.tsv
0		share file document laps	files							domain_extract_from_slot_query.tsv
0		share hair appointment files in voice skill meeting window	files							domain_extract_from_slot_query.tsv
0		share brandon workout deck	files							domain_extract_from_slot_query.tsv
0		share file document liverpool in football finals	files							domain_extract_from_slot_query.tsv
0		share file celine's id with next meet annie for saturday shopping meeting	files							domain_extract_from_slot_query.tsv
0		share file embryo injection with frizzeli	files							domain_extract_from_slot_query.tsv
0		share umra the stabbing file	files							domain_extract_from_slot_query.tsv
0		share file document utorrent	files							domain_extract_from_slot_query.tsv
0		share pictures with joel and danica file in stand up chat window	files							domain_extract_from_slot_query.tsv
0		share payroll file with my 11AM this chat	files							domain_extract_from_slot_query.tsv
0		share lab likes the boys labs deck	files							domain_extract_from_slot_query.tsv
0		Share document I had up before with design sync conversation	files							domain_extract_from_slot_query.tsv
0		share notebooks file with kakashi	files							domain_extract_from_slot_query.tsv
0		Share LT review discussion file in that channel	files							domain_extract_from_slot_query.tsv
0		share file with my chat at tomorrow	files							domain_extract_from_slot_query.tsv
0		share file document call mason	files							domain_extract_from_slot_query.tsv
0		Share file preview test plan document with design sync meeting attendees	files							domain_extract_from_slot_query.tsv
0		share file document and r	files							domain_extract_from_slot_query.tsv
0		Share LT review discussion files on this meeting participants	files							domain_extract_from_slot_query.tsv
0		share go see christine file in teams device meeting window	files							domain_extract_from_slot_query.tsv
0		share file xyz with my meeting at 10 pm on Wednesday	files							domain_extract_from_slot_query.tsv
0		Share most recently used Word using the 11AM meeting	files							domain_extract_from_slot_query.tsv
0		share file spec out new computers for chris with the call mike eagle meeting	files							domain_extract_from_slot_query.tsv
0		share file wanted with next call drama trip blood brothers southampton meeting	files							domain_extract_from_slot_query.tsv
0		share bazeries the pcp group interview file	files							domain_extract_from_slot_query.tsv
0		share voice skills file with alice	files							domain_extract_from_slot_query.tsv
0		share bring calculator file with the 2:14 am meeting	files							domain_extract_from_slot_query.tsv
0		share file ballarat hub with next webinar at dcu unlimited meeting	files							domain_extract_from_slot_query.tsv
0		share cash flow statement hyphen fifteen sixteen file with design sync conversation	files							domain_extract_from_slot_query.tsv
0		share green city deck	files							domain_extract_from_slot_query.tsv
0		share file celine's id with meet annie for saturday shopping meeting	files							domain_extract_from_slot_query.tsv
0		Share this file with my next meeting.	files							domain_extract_from_slot_query.tsv
0		share medical post files in shiproom conversation window	files							domain_extract_from_slot_query.tsv
0		share workplace file using roger	files							domain_extract_from_slot_query.tsv
0		share baseball appointment file in teams factory team window	files							domain_extract_from_slot_query.tsv
0		share file to islamoglu-inan	files							domain_extract_from_slot_query.tsv
0		share mechanic appointment file to this team window	files							domain_extract_from_slot_query.tsv
0		share file cecilius baptism with the meeting with vodafone meeting	files							domain_extract_from_slot_query.tsv
0		share gardawski the appointment seattle children ' s file	files							domain_extract_from_slot_query.tsv
0		share keith-lee the stabbing file	files							domain_extract_from_slot_query.tsv
0		share blue tooth file with here channel	files							domain_extract_from_slot_query.tsv
0		share file doc seven and ten with this chat	files							domain_extract_from_slot_query.tsv
0		share weekend errands file in voice skill conversation window	files							domain_extract_from_slot_query.tsv
0		Share file voice skills using shiproom chat	files							domain_extract_from_slot_query.tsv
0		share file bffs birthday with dommanget	files							domain_extract_from_slot_query.tsv
0		Share insurance document I was creating in the conversation	files							domain_extract_from_slot_query.tsv
0		share one on west deck	files							domain_extract_from_slot_query.tsv
0		Share lt review file about this chat	files							domain_extract_from_slot_query.tsv
0		share vsdm file with steinmeier	files							domain_extract_from_slot_query.tsv
0		share glandion the carla ' s birthday file	files							domain_extract_from_slot_query.tsv
0		Share planning PPT I was composing with 11AM meeting attendees	files							domain_extract_from_slot_query.tsv
0		share make a new email account file with intelligence one chat window	files							domain_extract_from_slot_query.tsv
0		share vss file with kossira	files							domain_extract_from_slot_query.tsv
0		share file alpha technical services with the housesitting meeting	files							domain_extract_from_slot_query.tsv
0		share planning files with my 11AM voice skills stand up meeting participants	files							domain_extract_from_slot_query.tsv
0		share file doc work party with this chat	files							domain_extract_from_slot_query.tsv
0		share file document grocery items to pick up	files							domain_extract_from_slot_query.tsv
0		share file doc national council of jewish women with this chat	files							domain_extract_from_slot_query.tsv
0		share file to zimmerebner	files							domain_extract_from_slot_query.tsv
0		share homework assignment file to search conversation window	files							domain_extract_from_slot_query.tsv
0		share file doc put cat out with this chat	files							domain_extract_from_slot_query.tsv
0		share png file with vicks	files							domain_extract_from_slot_query.tsv
0		share file doc sync shopping	files							domain_extract_from_slot_query.tsv
0		share meet dan file in shiproom meeting window	files							domain_extract_from_slot_query.tsv
0		share file doc go to walmart	files							domain_extract_from_slot_query.tsv
0		share medical post file to design sync channel	files							domain_extract_from_slot_query.tsv
0		share file document one on west	files							domain_extract_from_slot_query.tsv
0		share file play klein meeting with apodoca	files							domain_extract_from_slot_query.tsv
0		share notebook file with yonamoto	files							domain_extract_from_slot_query.tsv
0		share file doc numbers with this chat	files							domain_extract_from_slot_query.tsv
0		Share that file about this meeting participants	files							domain_extract_from_slot_query.tsv
0		share powerpoint file with brackins	files							domain_extract_from_slot_query.tsv
0		share chawa the appointment for shopping file	files							domain_extract_from_slot_query.tsv
0		share file doc meet glenn	files							domain_extract_from_slot_query.tsv
0		share brown bare  table	web							domain_extract_from_slot_query.tsv
0		share electric stovetop mini	web							domain_extract_from_slot_query.tsv
0		share cost for trash barrels	web							domain_extract_from_slot_query.tsv
0		share type t	web							domain_extract_from_slot_query.tsv
0		share free standing lighted mirror	web							domain_extract_from_slot_query.tsv
0		share outdoor electrical cover	web							domain_extract_from_slot_query.tsv
0		share polyeurethane exterior	web							domain_extract_from_slot_query.tsv
0		share 1.5 pvc pipe	web							domain_extract_from_slot_query.tsv
0		share 5 gallon of beige bucket of paint for inside the house	web							domain_extract_from_slot_query.tsv
0		share Fein tool	web							domain_extract_from_slot_query.tsv
0		share honda tillers	web							domain_extract_from_slot_query.tsv
0		share Standing Pilot Gas	web							domain_extract_from_slot_query.tsv
0		share heater fan	web							domain_extract_from_slot_query.tsv
0		share gilmore 3/4  hose	web							domain_extract_from_slot_query.tsv
0		share chrome door hinges	web							domain_extract_from_slot_query.tsv
0		share bad chair	web							domain_extract_from_slot_query.tsv
0		share Window Latch Mechanism	web							domain_extract_from_slot_query.tsv
0		share WORK LAMP	web							domain_extract_from_slot_query.tsv
0		share wand spray insulation	web							domain_extract_from_slot_query.tsv
0		share trigger makita skillsaw	web							domain_extract_from_slot_query.tsv
0		share Propane line plug	web							domain_extract_from_slot_query.tsv
0		share knaack	web							domain_extract_from_slot_query.tsv
0		share rg6 connecto	web							domain_extract_from_slot_query.tsv
0		share 1 1/8' spade drill	web							domain_extract_from_slot_query.tsv
0		share wired shelving add ons	web							domain_extract_from_slot_query.tsv
0		share owens	web							domain_extract_from_slot_query.tsv
0		share honewell wireless doorbell	web							domain_extract_from_slot_query.tsv
0		share jacuzzi toilet wax ring kit	web							domain_extract_from_slot_query.tsv
0		share 60  tubs freestanding	web							domain_extract_from_slot_query.tsv
0		share temporary handicap shower pole	web							domain_extract_from_slot_query.tsv
0		share almond cover switch	web							domain_extract_from_slot_query.tsv
0		share Kindle	web							domain_extract_from_slot_query.tsv
0		share clear glass fixture shade	web							domain_extract_from_slot_query.tsv
0		share hampton bay edington patio chair	web							domain_extract_from_slot_query.tsv
0		share rusteoulm spray paint	web							domain_extract_from_slot_query.tsv
0		share outdoor patio shades	web							domain_extract_from_slot_query.tsv
0		share bosch 1 in drill bits	web							domain_extract_from_slot_query.tsv
0		share white led ceiling fan	web							domain_extract_from_slot_query.tsv
0		share seam strips	web							domain_extract_from_slot_query.tsv
0		share clawfoot tub	web							domain_extract_from_slot_query.tsv
0		share 1-1/4 to 3/4 threaded reducer pvc	web							domain_extract_from_slot_query.tsv
0		share 48 inch westbrook gate	web							domain_extract_from_slot_query.tsv
0		share black and decker  cordless lantern	web							domain_extract_from_slot_query.tsv
0		share applewood	web							domain_extract_from_slot_query.tsv
0		share black maytag french door refrigirator	web							domain_extract_from_slot_query.tsv
0		share shaker style cabinets	web							domain_extract_from_slot_query.tsv
0		share plastic storage racks	web							domain_extract_from_slot_query.tsv
0		share porcelain tile flooring	web							domain_extract_from_slot_query.tsv
0		share corner fencing	web							domain_extract_from_slot_query.tsv
0		share wet dry vac hose	web							domain_extract_from_slot_query.tsv
0		share milwaukee angle grinder	web							domain_extract_from_slot_query.tsv
0		share coaxial splitter	web							domain_extract_from_slot_query.tsv
0		share bathroom faucet single stainless	web							domain_extract_from_slot_query.tsv
0		share table cloth covering	web							domain_extract_from_slot_query.tsv
0		share tile house number frames	web							domain_extract_from_slot_query.tsv
0		share paint sprayer nylon mesh filter	web							domain_extract_from_slot_query.tsv
0		share wood chips best to cover	web							domain_extract_from_slot_query.tsv
0		share car charger	web							domain_extract_from_slot_query.tsv
0		share fiberglass epoxy	web							domain_extract_from_slot_query.tsv
0		share firepits kit	web							domain_extract_from_slot_query.tsv
0		share gimmble led can light	web							domain_extract_from_slot_query.tsv
0		share light switch remote	web							domain_extract_from_slot_query.tsv
0		share foam strips	web							domain_extract_from_slot_query.tsv
0		share shallow well jet pump	web							domain_extract_from_slot_query.tsv
0		share Moen bathroom faucets	web							domain_extract_from_slot_query.tsv
0		share exterior oil primer	web							domain_extract_from_slot_query.tsv
0		share stainless steel kithen faucet with soap dispenser	web							domain_extract_from_slot_query.tsv
0		share metallic tape	web							domain_extract_from_slot_query.tsv
0		share Cobalt Blue Glasses	web							domain_extract_from_slot_query.tsv
0		share gray floor tile	web							domain_extract_from_slot_query.tsv
0		share 7/16 bolts x 8'	web							domain_extract_from_slot_query.tsv
0		share la casa chairs	web							domain_extract_from_slot_query.tsv
0		share ryobi staple gun	web							domain_extract_from_slot_query.tsv
0		share shelving closet	web							domain_extract_from_slot_query.tsv
0		share extertal air vent  cover	web							domain_extract_from_slot_query.tsv
0		share 25w bulb	web							domain_extract_from_slot_query.tsv
0		share bisquit tub refinish kit	web							domain_extract_from_slot_query.tsv
0		share gas water radiator	web							domain_extract_from_slot_query.tsv
0		share led  circuline bulbs	web							domain_extract_from_slot_query.tsv
0		share slotted angle	web							domain_extract_from_slot_query.tsv
0		share rainbird sprinkler heads  rnh	web							domain_extract_from_slot_query.tsv
0		share dewalt contractors powershop	web							domain_extract_from_slot_query.tsv
0		share prebent aluminum facia	web							domain_extract_from_slot_query.tsv
0		share wall tile for kitchen 4	web							domain_extract_from_slot_query.tsv
0		share pricepfister kitchen faucet g135	web							domain_extract_from_slot_query.tsv
0		share faux wood blind 73'	web							domain_extract_from_slot_query.tsv
0		share swiffer refills	web							domain_extract_from_slot_query.tsv
0		share ge wood panel reffridge	web							domain_extract_from_slot_query.tsv
0		share nut one 4763rln	web							domain_extract_from_slot_query.tsv
0		share tile accessories	web							domain_extract_from_slot_query.tsv
0		share globe lighting	web							domain_extract_from_slot_query.tsv
0		share potassium chloride	web							domain_extract_from_slot_query.tsv
0		share mataeials needed for paver patio	web							domain_extract_from_slot_query.tsv
0		share window plastic instulation	web							domain_extract_from_slot_query.tsv
0		share two panel interior doors 78	web							domain_extract_from_slot_query.tsv
0		share round grass edger	web							domain_extract_from_slot_query.tsv
0		share led puck light	web							domain_extract_from_slot_query.tsv
0		share refrigerator door lock	web							domain_extract_from_slot_query.tsv
0		share tools 5 in one	web							domain_extract_from_slot_query.tsv
0		share mask and seal jasco	web							domain_extract_from_slot_query.tsv
0		share brandenburg 12' x 12' louvered vinyl pergola	web							domain_extract_from_slot_query.tsv
0		share Fiberglass roof panel	web							domain_extract_from_slot_query.tsv
0		share ceiling fan bronze	web							domain_extract_from_slot_query.tsv
0		share floor repair kit	web							domain_extract_from_slot_query.tsv
0		share spray can cap with straw	web							domain_extract_from_slot_query.tsv
0		share miricale	web							domain_extract_from_slot_query.tsv
0		share porch liht fixture	web							domain_extract_from_slot_query.tsv
0		share 10/3  flex  250  feet	web							domain_extract_from_slot_query.tsv
0		share plywood 4x8	web							domain_extract_from_slot_query.tsv
0		share ceramic tile tools	web							domain_extract_from_slot_query.tsv
0		share 5 inch duct	web							domain_extract_from_slot_query.tsv
0		share hardie backer blade	web							domain_extract_from_slot_query.tsv
0		share indoor table lamps	web							domain_extract_from_slot_query.tsv
0		share camping lantern	web							domain_extract_from_slot_query.tsv
0		share 1x1 rail decorative wood	web							domain_extract_from_slot_query.tsv
0		share 2 an a half inch extra screws	web							domain_extract_from_slot_query.tsv
0		share stone veneer panels	web							domain_extract_from_slot_query.tsv
0		share 4 doorguard	web							domain_extract_from_slot_query.tsv
0		share shower bronze flange	web							domain_extract_from_slot_query.tsv
0		share shelving premier	web							domain_extract_from_slot_query.tsv
0		share eaton br200 panel	web							domain_extract_from_slot_query.tsv
0		share bosch 30 dual fuel range	web							domain_extract_from_slot_query.tsv
0		share simpson strong tie plate	web							domain_extract_from_slot_query.tsv
0		share self priming house paint	web							domain_extract_from_slot_query.tsv
0		share kimtec	web							domain_extract_from_slot_query.tsv
0		share bunn coffee maker	web							domain_extract_from_slot_query.tsv
0		share self sticking tile	web							domain_extract_from_slot_query.tsv
0		share shower door with pebble glass	web							domain_extract_from_slot_query.tsv
0		share round beech	web							domain_extract_from_slot_query.tsv
0		share beech	web							domain_extract_from_slot_query.tsv
0		share gavanized pipe 20 feet	web							domain_extract_from_slot_query.tsv
0		share poly blend grout re	web							domain_extract_from_slot_query.tsv
0		share pergo xp grand oak steps	web							domain_extract_from_slot_query.tsv
0		share cushions for wecker furniture	web							domain_extract_from_slot_query.tsv
0		share kitchen faucet delta	web							domain_extract_from_slot_query.tsv
0		share 36in vinale fence	web							domain_extract_from_slot_query.tsv
0		share hex tiles	web							domain_extract_from_slot_query.tsv
0		share Shop lights led	web							domain_extract_from_slot_query.tsv
0		share stringer	web							domain_extract_from_slot_query.tsv
0		share 44 planter	web							domain_extract_from_slot_query.tsv
0		share Sizes of showers	web							domain_extract_from_slot_query.tsv
0		share 21 cubic foot top freezer frigidaire refrigerator	web							domain_extract_from_slot_query.tsv
0		share hand sanitizer	web							domain_extract_from_slot_query.tsv
0		share shaw	web							domain_extract_from_slot_query.tsv
0		share brushed nickel cabinet pulls	web							domain_extract_from_slot_query.tsv
0		share honolule center drain	web							domain_extract_from_slot_query.tsv
0		share composite panel	web							domain_extract_from_slot_query.tsv
0		share outside wood paneling	web							domain_extract_from_slot_query.tsv
0		share pink adi car	web							domain_extract_from_slot_query.tsv
0		share apple drawer knob	web							domain_extract_from_slot_query.tsv
0		share decorative posts	web							domain_extract_from_slot_query.tsv
0		share led light bulbs par30l	web							domain_extract_from_slot_query.tsv
0		share in line dimmer	web							domain_extract_from_slot_query.tsv
0		share satin paint	web							domain_extract_from_slot_query.tsv
0		share kitchen  sinks	web							domain_extract_from_slot_query.tsv
0		share wall mounted jewelry cabinet	web							domain_extract_from_slot_query.tsv
0		share 14.4 cordless drywall gun	web							domain_extract_from_slot_query.tsv
0		share garlend lights	web							domain_extract_from_slot_query.tsv
0		share plastic gutter channel drain	web							domain_extract_from_slot_query.tsv
0		share sonoma oak	web							domain_extract_from_slot_query.tsv
0		share shower curtain tension rod	web							domain_extract_from_slot_query.tsv
