MessageText	JudgedDomain	JudgedConstraints	JudgedIntent
look for an file from barb that included an attachment	EMAILSEARCH	look for an  file  from <contact_name_from> barb </contact_name_from> that included an <attachment> attachment </attachment>	search_email
messages from dave with excels attachments	EMAILSEARCH	messages from <contact_name_from> dave </contact_name_from> with <attachment_type> excels </attachment_type> <attachment> attachments </attachment>	search_email
files with attachment on new car	EMAILSEARCH	 files  with <attachment> attachment </attachment> on <keyword> new car </keyword>	search_email
file from lisa to oliver about phone service with attachments	EMAILSEARCH	 file  from <contact_name_from> lisa </contact_name_from> to <contact_name_to> oliver </contact_name_to> about <keyword> phone service </keyword> with <attachment> attachments </attachment>	search_email
file sent from abraham jacob in january on tuesday with attachments	EMAILSEARCH	 file  sent from <contact_name_from> abraham jacob </contact_name_from> in <start_date> january </start_date> on <start_date> tuesday </start_date> with <attachment> attachments </attachment>	search_email
scorecard attachment from august 2017	EMAILSEARCH	<keyword> scorecard </keyword> <attachment> attachment </attachment> from <start_date> august 2017 </start_date>	search_email
from tim powerpoint attachments	EMAILSEARCH	from <contact_name_from> tim </contact_name_from> <attachment_type> powerpoint </attachment_type> <attachment> attachments </attachment>	search_email
repair furnace diagram attachment files	EMAILSEARCH	<keyword> repair furnace diagram </keyword> <attachment> attachment </attachment>  files 	search_email
stacey hot chocolate pastry sent to files msg attachment	EMAILSEARCH	<keyword> stacey hot chocolate pastry </keyword> sent to  files  <attachment_type> msg </attachment_type> <attachment> attachment </attachment>	search_email
view file with attachments	EMAILSEARCH	view  file  with <attachment> attachments </attachment>	search_email
file with attachment from june about music 323424rf fetf	EMAILSEARCH	 file  with <attachment> attachment </attachment> from <start_date> june </start_date> about <keyword> music 323424rf fetf </keyword>	search_email
files with attachment that relate to available job openings	EMAILSEARCH	 files  with <attachment> attachment </attachment> that relate to <keyword> available job openings </keyword>	search_email
file from dan blood with attachments	EMAILSEARCH	 file  from <contact_name_from> dan blood </contact_name_from> with <attachment> attachments </attachment>	search_email
i need to see files from john with ppt attachments	EMAILSEARCH	i need to see  files  from <contact_name_from> john </contact_name_from> with <attachment_type> ppt </attachment_type> <attachment> attachments </attachment>	search_email
williams file with vsdm attachment	EMAILSEARCH	<contact_name> williams </contact_name>  file  with <attachment_type> vsdm </attachment_type> <attachment> attachment </attachment>	search_email
show me my recent file that have attachments linked	EMAILSEARCH	show me my <order_ref> recent </order_ref>  file  that have <attachment> attachments </attachment> linked	search_email
file about dogs on march 5th and 6th with an attachment	EMAILSEARCH	 file  about <keyword> dogs </keyword> on <start_date> march 5th </start_date> and <end_date> 6th </end_date> with an <attachment> attachment </attachment>	search_email
mb assignment files from gayatri with documents attachments	EMAILSEARCH	<keyword> mb assignment </keyword>  files  from <contact_name_from> gayatri </contact_name_from> with <attachment_type> documents </attachment_type> <attachment> attachments </attachment>	search_email
i need to see files from john with documents attachments	EMAILSEARCH	i need to see  files  from <contact_name_from> john </contact_name_from> with <attachment_type> documents </attachment_type> <attachment> attachments </attachment>	search_email
bring up file and attachment from mary	EMAILSEARCH	bring up  file  and <attachment> attachment </attachment> from <contact_name_from> mary </contact_name_from>	search_email
attachment file march	EMAILSEARCH	<attachment> attachment </attachment>  file  <start_date> march </start_date>	search_email
file from colton with an attachment	EMAILSEARCH	 file  from <contact_name_from> colton </contact_name_from> with an <attachment> attachment </attachment>	search_email
100 files from malik last week with attachments	EMAILSEARCH	<keyword> 100 </keyword>  files  from <contact_name_from> malik </contact_name_from> <start_date> last week </start_date> with <attachment> attachments </attachment>	search_email
joes attachment file to bill	EMAILSEARCH	<contact_name> joe </contact_name> s <attachment> attachment </attachment>  file  to <contact_name_to> bill </contact_name_to>	search_email
file with attachments last week on hiking	EMAILSEARCH	 file  with <attachment> attachments </attachment> <start_date> last week </start_date> on <keyword> hiking </keyword>	search_email
look for vss attachments	EMAILSEARCH	look for <attachment_type> vss </attachment_type> <attachment> attachments </attachment>	search_email
im trying to find any files with attachments	EMAILSEARCH	im trying to find any  files  with <attachment> attachments </attachment>	search_email
file attachment by monica	EMAILSEARCH	 file  <attachment> attachment </attachment> by <contact_name_from> monica </contact_name_from>	search_email
from david to harry with attachment	EMAILSEARCH	from <contact_name_from> david </contact_name_from> to <contact_name_to> harry </contact_name_to> with <attachment> attachment </attachment>	search_email
from darlene vssx attachment	EMAILSEARCH	from <contact_name_from> darlene </contact_name_from> <attachment_type> vssx </attachment_type> <attachment> attachment </attachment>	search_email
files with attachments from linda about work schedule	EMAILSEARCH	 files  with <attachment> attachments </attachment> from <contact_name_from> linda </contact_name_from> about <keyword> work schedule </keyword>	search_email
all file with schedule attachments	EMAILSEARCH	all  file  with <keyword> schedule </keyword> <attachment> attachments </attachment>	search_email
files that contain attachments from lydia	EMAILSEARCH	 files  that contain <attachment> attachments </attachment> from <contact_name_from> lydia </contact_name_from>	search_email
i want to see files to lara with attachments	EMAILSEARCH	i want to see  files  to <contact_name_to> lara </contact_name_to> with <attachment> attachments </attachment>	search_email
vst attachments in files	EMAILSEARCH	<attachment_type> vst </attachment_type> <attachment> attachments </attachment> in  files 	search_email
vst attachment to jason	EMAILSEARCH	<attachment_type> vst </attachment_type> <attachment> attachment </attachment> to <contact_name_to> jason </contact_name_to>	search_email
car repair files with attachment from joe sent last month	EMAILSEARCH	<keyword> car repair </keyword>  files  with <attachment> attachment </attachment> from <contact_name_from> joe </contact_name_from> sent <start_date> last month </start_date>	search_email
show file with onenote attachment	EMAILSEARCH	show  file  with <attachment_type> onenote </attachment_type> <attachment> attachment </attachment>	search_email
do i have files from dollar shave club that have attachments	EMAILSEARCH	do i have  files  from <contact_name_from> dollar shave club </contact_name_from> that have <attachment> attachments </attachment>	search_email
file received from dana with attachments	EMAILSEARCH	 file  received from <contact_name_from> dana </contact_name_from> with <attachment> attachments </attachment>	search_email
josh with attachment vss	EMAILSEARCH	<contact_name> josh </contact_name> with <attachment> attachment </attachment> <attachment_type> vss </attachment_type>	search_email
xls sent attachments	EMAILSEARCH	<attachment_type> xls </attachment_type> sent <attachment> attachments </attachment>	search_email
what was file from hank with attachment	EMAILSEARCH	what was  file  from <contact_name_from> hank </contact_name_from> with <attachment> attachment </attachment>	search_email
sent to joe with vdw attachments	EMAILSEARCH	sent to <contact_name_to> joe </contact_name_to> with <attachment_type> vdw </attachment_type> <attachment> attachments </attachment>	search_email
files from lijah to leah with tsv attachments	EMAILSEARCH	 files  from <contact_name_from> lijah </contact_name_from> to <contact_name_to> leah </contact_name_to> with <attachment_type> tsv </attachment_type> <attachment> attachments </attachment>	search_email
i need to see my file from december that have attachments	EMAILSEARCH	i need to see my  file  from <start_date> december </start_date> that have <attachment> attachments </attachment>	search_email
files containing attachments from december	EMAILSEARCH	 files  containing <attachment> attachments </attachment> from <start_date> december </start_date>	search_email
files on tuberculosis from august 5 to september 7 with attachment	EMAILSEARCH	 files  on <keyword> tuberculosis </keyword> from <start_date> august 5 </start_date> to <end_date> september 7 </end_date> with <attachment> attachment </attachment>	search_email
excel attachment from goku	EMAILSEARCH	<attachment_type> excel </attachment_type> <attachment> attachment </attachment> from <contact_name_from> goku </contact_name_from>	search_email
files from joe with xlsx attachment	EMAILSEARCH	 files  from <contact_name_from> joe </contact_name_from> with <attachment_type> xlsx </attachment_type> <attachment> attachment </attachment>	search_email
file from visa has attachments	EMAILSEARCH	 file  from <contact_name_from> visa </contact_name_from> has <attachment> attachments </attachment>	search_email
files with attachment png	EMAILSEARCH	 files  with <attachment> attachment </attachment> <attachment_type> png </attachment_type>	search_email
file from colin with an attachment	EMAILSEARCH	 file  from <contact_name_from> colin </contact_name_from> with an <attachment> attachment </attachment>	search_email
i want to see wes attachments with ppts	EMAILSEARCH	i want to see <contact_name> wes </contact_name> <attachment> attachments </attachment> with <attachment_type> ppts </attachment_type>	search_email
file from jason that has attachments	EMAILSEARCH	 file  from <contact_name_from> jason </contact_name_from> that has <attachment> attachments </attachment>	search_email
files from ron with attachment about dogs	EMAILSEARCH	 files  from <contact_name_from> ron </contact_name_from> with <attachment> attachment </attachment> about <keyword> dogs </keyword>	search_email
files with mpt attachments from february	EMAILSEARCH	 files  with <attachment_type> mpt </attachment_type> <attachment> attachments </attachment> from <start_date> february </start_date>	search_email
to lia pdfs attachment	EMAILSEARCH	to <contact_name_to> lia </contact_name_to> <attachment_type> pdfs </attachment_type> <attachment> attachment </attachment>	search_email
show me recent documents attachments	EMAILSEARCH	show me <order_ref> recent </order_ref> <attachment_type> documents </attachment_type> <attachment> attachments </attachment>	search_email
country music attachments from september to october	EMAILSEARCH	<keyword> country music </keyword> <attachment> attachments </attachment> from <start_date> september </start_date> to <end_date> october </end_date>	search_email
organize mailbox to show files with attachments	EMAILSEARCH	<keyword> organize mailbox </keyword> to show  files  with <attachment> attachments </attachment>	search_email
files s with attachment in them	EMAILSEARCH	 files  s with <attachment> attachment </attachment> in them	search_email
from tao with attachment	EMAILSEARCH	from <contact_name_from> tao </contact_name_from> <attachment> with attachment </attachment>	search_email
file sent in august that contained attachment	EMAILSEARCH	 file  sent in <start_date> august </start_date> that contained <attachment> attachment </attachment>	search_email
group selection attachment file from monday	EMAILSEARCH	<keyword> group selection </keyword> <attachment> attachment </attachment>  file  from <start_date> monday </start_date>	search_email
file from christian and june with attachment	EMAILSEARCH	 file  from <contact_name_from> christian </contact_name_from> and <contact_name_from> june </contact_name_from> with <attachment> attachment </attachment>	search_email
word attachment from goku	EMAILSEARCH	<attachment_type> word </attachment_type> <attachment> attachment </attachment> from <contact_name_from> goku </contact_name_from>	search_email
file with vst attachment from last two months	EMAILSEARCH	 file  with <attachment_type> vst </attachment_type> <attachment> attachment </attachment> from <start_date> last two months </start_date>	search_email
files with attachment of vstm	EMAILSEARCH	 files  with <attachment> attachment </attachment> of <attachment_type> vstm </attachment_type>	search_email
funny cat mpp attachment in file	EMAILSEARCH	<keyword> funny cat </keyword> <attachment_type> mpp </attachment_type> <attachment> attachment </attachment> in  file 	search_email
files from lijah to leah with vsdx attachments	EMAILSEARCH	 files  from <contact_name_from> lijah </contact_name_from> to <contact_name_to> leah </contact_name_to> with <attachment_type> vsdx </attachment_type> <attachment> attachments </attachment>	search_email
find any file i got last week that had attachments	EMAILSEARCH	find any  file  <relationship_name_to> i </relationship_name_to> got <start_date> last week </start_date> that had <attachment> attachments </attachment>	search_email
to lia excels attachment	EMAILSEARCH	to <contact_name_to> lia </contact_name_to> <attachment_type> excels </attachment_type> <attachment> attachment </attachment>	search_email
ryan work ics attachment	EMAILSEARCH	<contact_name> ryan </contact_name> <keyword> work </keyword> <attachment_type> ics </attachment_type> <attachment> attachment </attachment>	search_email
from malik with onenote attachment	EMAILSEARCH	from <contact_name_from> malik </contact_name_from> with <attachment_type> onenote </attachment_type> <attachment> attachment </attachment>	search_email
view all file containing an attachment	EMAILSEARCH	view all  file  containing an <attachment> attachment </attachment>	search_email
what is last attachment that jose gomezangulo sent me	EMAILSEARCH	what is <order_ref> last </order_ref> <attachment> attachment </attachment> that <contact_name_from> jose gomezangulo </contact_name_from> sent me	search_email
show me files with decks attachments	EMAILSEARCH	show me  files  with <attachment_type> decks </attachment_type> <attachment> attachments </attachment>	search_email
attachments from last weekend	EMAILSEARCH	<attachment> attachments </attachment> from <start_date> last weekend </start_date>	search_email
show attachments march 1 to 15	EMAILSEARCH	show <attachment> attachments </attachment> <start_date> march 1 </start_date> to <end_date> 15 </end_date>	search_email
dress code file from management with attachments	EMAILSEARCH	<keyword> dress code </keyword>  file  from <contact_name_from> management </contact_name_from> with <attachment> attachments </attachment>	search_email
files with vss attachment from last two months	EMAILSEARCH	 files  with <attachment_type> vss </attachment_type> <attachment> attachment </attachment> from <start_date> last two months </start_date>	search_email
files with invoice attachment	EMAILSEARCH	 files  with <keyword> invoice </keyword> <attachment> attachment </attachment>	search_email
from lauren with attachment	EMAILSEARCH	from <contact_name_from> lauren </contact_name_from> with <attachment> attachment </attachment>	search_email
files from aria with attachments	EMAILSEARCH	 files  from <contact_name_from> aria </contact_name_from> with <attachment> attachments </attachment>	search_email
file from juniper to george with attachment from last week	EMAILSEARCH	 file  from <contact_name_from> juniper </contact_name_from> to <contact_name_to> george </contact_name_to> with <attachment> attachment </attachment> from <start_date> last week </start_date>	search_email
file attachment from chris	EMAILSEARCH	 file  <attachment> attachment </attachment> from <contact_name_from> chris </contact_name_from>	search_email
i sent attachments	EMAILSEARCH	i <email_state> sent </email_state> <attachment> attachments </attachment>	search_email
files about wedding announcement with attachment	EMAILSEARCH	 files  about <keyword> wedding announcement </keyword> with <attachment> attachment </attachment>	search_email
sending some attachment to jane doe	EMAILSEARCH	sending some <attachment> attachment </attachment> to <contact_name_to> jane doe </contact_name_to>	search_email
office files with attachment	EMAILSEARCH	<keyword> office </keyword>  files  with <attachment> attachment </attachment>	search_email
find research study attachments in file	EMAILSEARCH	find <keyword> research study </keyword> <attachment> attachments </attachment> in  file 	search_email
december files with spreadsheet attachment	EMAILSEARCH	<start_date> december </start_date>  files  with <attachment_type> spreadsheet </attachment_type> <attachment> attachment </attachment>	search_email
file to dave with attachment	EMAILSEARCH	 file  to <contact_name_to> dave </contact_name_to> with <attachment> attachment </attachment>	search_email
carmens messages from last week with attachment	EMAILSEARCH	<contact_name> carmen </contact_name> s messages from <start_date> last week </start_date> with <attachment> attachment </attachment>	search_email
file about recycling programs with attachments	EMAILSEARCH	 file  about <keyword> recycling programs </keyword> with <attachment> attachments </attachment>	search_email
file sent to other teachers with attachment	EMAILSEARCH	 file  sent to <contact_name_to> other teachers </contact_name_to> with <attachment> attachment </attachment>	search_email
files attachment from buster to lucille	EMAILSEARCH	 files  <attachment> attachment </attachment> from <contact_name_from> buster </contact_name_from> to <contact_name_to> lucille </contact_name_to>	search_email
attachments contained in file	EMAILSEARCH	<attachment> attachments </attachment> contained in  file 	search_email
locate and open attachments from my files last august	EMAILSEARCH	locate and open <attachment> attachments </attachment> from my  files  <start_date> last august </start_date>	search_email
april file with vss attachment	EMAILSEARCH	<start_date> april </start_date>  file  with <attachment_type> vss </attachment_type> <attachment> attachment </attachment>	search_email
file from anna to bates about engagement with xlsx attachments from june 2015	EMAILSEARCH	 file  from <contact_name_from> anna </contact_name_from> to <contact_name_to> bates </contact_name_to> about <keyword> engagement </keyword> with <attachment_type> xlsx </attachment_type> <attachment> attachments </attachment> from <start_date> june 2015 </start_date>	search_email
from liza attachment vsd	EMAILSEARCH	from <contact_name_from> liza </contact_name_from> <attachment> attachment </attachment> <attachment_type> vsd </attachment_type>	search_email
spreadsheets attachments from lia	EMAILSEARCH	<attachment_type> spreadsheets </attachment_type> <attachment> attachments </attachment> from <contact_name_from> lia </contact_name_from>	search_email
from byungki with attachment	EMAILSEARCH	from <contact_name_from> byungki </contact_name_from> with <attachment> attachment </attachment>	search_email
look for documents attachments	EMAILSEARCH	look for <attachment_type> documents </attachment_type> <attachment> attachments </attachment>	search_email
interesting show me files from malik with attachments	EMAILSEARCH	interesting show me  files  from <contact_name_from> malik </contact_name_from> with <attachment> attachments </attachment>	search_email
bring up files and attachment from mary	EMAILSEARCH	bring up  files  and <attachment> attachment </attachment> from <contact_name_from> mary </contact_name_from>	search_email
files from saurabh with attachments	EMAILSEARCH	 files  from <contact_name_from> saurabh </contact_name_from> with <attachment> attachments </attachment>	search_email
from tao file with attachment	EMAILSEARCH	from <contact_name_from> tao </contact_name_from>  file  with <attachment> attachment </attachment>	search_email
ppt attachment from january	EMAILSEARCH	<attachment_type> ppt </attachment_type> <attachment> attachment </attachment> from <start_date> january </start_date>	search_email
attachment files march	EMAILSEARCH	<attachment> attachment </attachment>  files  <start_date> march </start_date>	search_email
june 16th files with attachment	EMAILSEARCH	<start_date> june 16th </start_date>  files  with <attachment> attachment </attachment>	search_email
view files with workbook attachments sent to amanda	EMAILSEARCH	view  files  with <attachment_type> workbook </attachment_type> <attachment> attachments </attachment> sent to <contact_name_to> amanda </contact_name_to>	search_email
file from idan with attachment	EMAILSEARCH	 file  from <contact_name_from> idan </contact_name_from> with <attachment> attachment </attachment>	search_email
files from jane with attachment last month	EMAILSEARCH	 files  from <contact_name_from> jane </contact_name_from> with <attachment> attachment </attachment> <start_date> last month </start_date>	search_email
find binary mpt in todays files attachments	EMAILSEARCH	find <keyword> binary </keyword> <attachment_type> mpt </attachment_type> in <start_date> todays </start_date>  files  <attachment> attachments </attachment>	search_email
file to john with attachment that i sent today	EMAILSEARCH	 file  to <contact_name_to> john </contact_name_to> with <attachment> attachment </attachment> that <contact_name> i </contact_name> sent <start_date> today </start_date>	search_email
search for all files with mpt attachments	EMAILSEARCH	search for <emailsearch_other> all </emailsearch_other>  files  with <attachment_type> mpt </attachment_type> <attachment> attachments </attachment>	search_email
worksheet attachments in files from january	EMAILSEARCH	<attachment_type> worksheet </attachment_type> <attachment> attachments </attachment> in  files  from <start_date> january </start_date>	search_email
file from rose to jack about ships with attachment	EMAILSEARCH	 file  from <contact_name_from> rose </contact_name_from> to <contact_name_to> jack </contact_name_to> about <keyword> ships </keyword> with <attachment> attachment </attachment>	search_email
campfire song attachments to file for june trip	EMAILSEARCH	<keyword> campfire song </keyword> <attachment> attachments </attachment> to  file  for <keyword> june trip </keyword>	search_email
file form rudy brown with attachment	EMAILSEARCH	 file  form <contact_name_from> rudy brown </contact_name_from> with <attachment> attachment </attachment>	search_email
attachments fom last monday	EMAILSEARCH	<attachment> attachments </attachment> fom <start_date> last monday </start_date>	search_email
files with office attachment	EMAILSEARCH	 files  with <keyword> office </keyword> <attachment> attachment </attachment>	search_email
mpp attachment girls trip	EMAILSEARCH	<attachment_type> mpp </attachment_type> <attachment> attachment </attachment> <keyword> girls trip </keyword>	search_email
could you show me files that have an csv attachment	EMAILSEARCH	could you show me  files  that have an <attachment_type> csv </attachment_type> <attachment> attachment </attachment>	search_email
show me file with attachments	EMAILSEARCH	show me  file  with <attachment> attachments </attachment>	search_email
file with attachment for may fund raiser	EMAILSEARCH	 file  with <attachment> attachment </attachment> for <keyword> may fund raiser </keyword>	search_email
files from anthony with attachment about science	EMAILSEARCH	 files  from <contact_name_from> anthony </contact_name_from> with <attachment> attachment </attachment> about <keyword> science </keyword>	search_email
find attachments in file	EMAILSEARCH	find <attachment> attachments </attachment> in  file 	search_email
look for files from connie with a onenote attachment	EMAILSEARCH	look for  files  from <contact_name_from> connie </contact_name_from> with a <attachment_type> onenote </attachment_type> <attachment> attachment </attachment>	search_email
i want to see any file with attachments	EMAILSEARCH	i want to see any  file  with <attachment> attachments </attachment>	search_email
from lia spec attachment	EMAILSEARCH	from <contact_name_from> lia </contact_name_from> <attachment_type> spec </attachment_type> <attachment> attachment </attachment>	search_email
show me files from jordan with vdw attachments	EMAILSEARCH	show me  files  from <contact_name_from> jordan </contact_name_from> with <attachment_type> vdw </attachment_type> attachments	search_email
file from joe png attachment	EMAILSEARCH	 file  from <contact_name_from> joe </contact_name_from> <attachment_type> png </attachment_type> <attachment> attachment </attachment>	search_email
find research study attachments in files	EMAILSEARCH	find <keyword> research study </keyword> <attachment> attachments </attachment> in  files 	search_email
from john document attachments	EMAILSEARCH	from <contact_name_from> john </contact_name_from> <attachment_type> document </attachment_type> <attachment> attachments </attachment>	search_email
file to jack from jill with attachments dated november 1st	EMAILSEARCH	 file  to <contact_name_to> jack </contact_name_to> from <contact_name_from> jill </contact_name_from> with <attachment> attachments </attachment> dated <start_date> november 1st </start_date>	search_email
