MessageText	JudgedDomain	JudgedConstraints	JudgedIntent
files with database file attachment	EMAILSEARCH	 files  with <keyword> database </keyword> file <attachment> attachment </attachment>	search_email
recent files with attachments	EMAILSEARCH	<order_ref> recent </order_ref>  files  with <attachment> attachments </attachment>	search_email
file from sapna with multiple attachments	EMAILSEARCH	 file  from <contact_name_from> sapna </contact_name_from> with <keyword> multiple </keyword> <attachment> attachments </attachment>	search_email
file with attachment inside	EMAILSEARCH	 file  with <attachment> attachment </attachment> inside	search_email
spreadsheet attachment girls trip	EMAILSEARCH	<attachment_type> spreadsheet </attachment_type> <attachment> attachment </attachment> <keyword> girls trip </keyword>	search_email
locate attachment in file	EMAILSEARCH	locate <attachment> attachment </attachment> in  file 	search_email
xlsx attachment from jim	EMAILSEARCH	<attachment_type> xlsx </attachment_type> <attachment> attachment </attachment> from <contact_name_from> jim </contact_name_from>	search_email
attachment ppts from youngs	EMAILSEARCH	<attachment> attachment </attachment> <attachment_type> ppts </attachment_type> from <contact_name_from> youngs </contact_name_from>	search_email
messages to ed with attachment	EMAILSEARCH	messages to <contact_name_to> ed </contact_name_to> with <attachment> attachment </attachment>	search_email
look up travel file that have an attachment	EMAILSEARCH	look up <keyword> travel </keyword>  file  that have an <attachment> attachment </attachment>	search_email
files from lizzie to sally re resignation with mpt attachment	EMAILSEARCH	 files  from <contact_name_from> lizzie </contact_name_from> to <contact_name_to> sally </contact_name_to> re <keyword> resignation </keyword> with <attachment_type> mpt </attachment_type> <attachment> attachment </attachment>	search_email
file with frog powerpoint attachment	EMAILSEARCH	 file  with <keyword> frog </keyword> <attachment_type> powerpoint </attachment_type> <attachment> attachment </attachment>	search_email
attachment with word	EMAILSEARCH	<attachment> attachment </attachment> with <attachment_type> word </attachment_type>	search_email
files with attachment from last two weeks	EMAILSEARCH	 files  with <attachment> attachment </attachment> from <start_date> last two weeks </start_date>	search_email
find vivs file with ics attachment	EMAILSEARCH	find <contact_name> viv </contact_name> s  file  with <attachment_type> ics </attachment_type> <attachment> attachment </attachment>	search_email
files from jon hamaker with pdfs attachments	EMAILSEARCH	 files  from <contact_name_from> jon hamaker </contact_name_from> with <attachment_type> pdfs </attachment_type> <attachment> attachments </attachment>	search_email
doc was included on attachment	EMAILSEARCH	<attachment_type> doc </attachment_type> was included on <attachment> attachment </attachment>	search_email
files with attachment from kennedy about vacation	EMAILSEARCH	 files  with <attachment> attachment </attachment> from <contact_name_from> kennedy </contact_name_from> about <keyword> vacation </keyword>	search_email
onenote attachment	EMAILSEARCH	<attachment_type> onenote </attachment_type> <attachment> attachment </attachment>	search_email
show me file with an attachment came in november	EMAILSEARCH	show me  file  with an <attachment> attachment </attachment> came in <start_date> november </start_date>	search_email
files from april with attachment	EMAILSEARCH	 files  from <start_date> april </start_date> with <attachment> attachment </attachment>	search_email
mail with attachment from sssjune about music birthdayd file with attachments between august and october	EMAILSEARCH	mail with <attachment> attachment </attachment> from <contact_name_from> sssjune </contact_name_from> about <keyword> music birthdayd </keyword>  file  with <attachment> attachments </attachment> between <start_date> august </start_date> and <end_date> october </end_date>	search_email
w9 worksheet attachment	EMAILSEARCH	<keyword> w9 </keyword> <attachment_type> worksheet </attachment_type> <attachment> attachment </attachment>	search_email
file from greg with attachment	EMAILSEARCH	 file  from <contact_name_from> greg </contact_name_from> with <attachment> attachment </attachment>	search_email
i want to see wes attachments with vst	EMAILSEARCH	i want to see <contact_name> wes </contact_name> <attachment> attachments </attachment> with <attachment_type> vst </attachment_type>	search_email
show file containing attachments	EMAILSEARCH	show  file  containing <attachment> attachments </attachment>	search_email
file sent with an attachment	EMAILSEARCH	 file  sent with an <attachment> attachment </attachment>	search_email
list out all file that have attachments on them	EMAILSEARCH	list out all  file  that have <attachment> attachments </attachment> on them	search_email
files from jim boyle with slides attachments	EMAILSEARCH	 files  from <contact_name_from> jim boyle </contact_name_from> with <attachment_type> slides </attachment_type> <attachment> attachments </attachment>	search_email
file with any attachments about art	EMAILSEARCH	 file  with any <attachment> attachments </attachment> about <keyword> art </keyword>	search_email
from scott with attachment to olivia	EMAILSEARCH	from <contact_name_from> scott </contact_name_from> with <attachment> attachment </attachment> to <contact_name_to> olivia </contact_name_to>	search_email
attachment pizza from ina	EMAILSEARCH	<attachment> attachment </attachment> <keyword> pizza </keyword> from <contact_name_from> ina </contact_name_from>	search_email
boss sent me an attachment regarding work for tomorrow	EMAILSEARCH	<relationship_name_from> boss </relationship_name_from> sent <relationship_name_to> me </relationship_name_to> an <attachment> attachment </attachment> regarding <keyword> work for tomorrow </keyword>	search_email
files from rose to jack about ships with attachment	EMAILSEARCH	 files  from <contact_name_from> rose </contact_name_from> to <contact_name_to> jack </contact_name_to> about <keyword> ships </keyword> with <attachment> attachment </attachment>	search_email
show wanda file attachments	EMAILSEARCH	show <contact_name> wanda </contact_name>  file  <attachment> attachments </attachment>	search_email
to lia vsdm attachment	EMAILSEARCH	to <contact_name_to> lia </contact_name_to> <attachment_type> vsdm </attachment_type> <attachment> attachment </attachment>	search_email
files sent from ana mendes 3 weeks ago with attachments	EMAILSEARCH	 files  sent from <contact_name_from> ana mendes </contact_name_from> <start_date> 3 weeks ago </start_date> with <attachment> attachments </attachment>	search_email
files messages from danny powers but only if they have attachments	EMAILSEARCH	 files  messages from <contact_name_from> danny powers </contact_name_from> but only if they have <attachment> attachments </attachment>	search_email
onenote attachments in file	EMAILSEARCH	<attachment_type> onenote </attachment_type> <attachment> attachments </attachment> in  file 	search_email
file from tristan with attachment	EMAILSEARCH	 file  from <contact_name_from> tristan </contact_name_from> with <attachment> attachment </attachment>	search_email
file from john to jane sent between march 1 and march 15 about birthday with attachment	EMAILSEARCH	 file  from <contact_name_from> john </contact_name_from> to <contact_name_to> jane </contact_name_to> sent between <start_date> march 1 </start_date> and <end_date> march 15 </end_date> about <keyword> birthday </keyword> with <attachment> attachment </attachment>	search_email
file to john has attachment	EMAILSEARCH	 file  to <contact_name_to> john </contact_name_to> has <attachment> attachment </attachment>	search_email
give me files with tsv attachments	EMAILSEARCH	give me  files  with <attachment_type> tsv </attachment_type> <attachment> attachments </attachment>	search_email
files with an attachment from last week	EMAILSEARCH	 files  with an <attachment> attachment </attachment> from <start_date> last week </start_date>	search_email
look for file with decks attachments	EMAILSEARCH	look for  file  with <attachment_type> decks </attachment_type> <attachment> attachments </attachment>	search_email
find my file with attachment	EMAILSEARCH	find my  file  with <attachment> attachment </attachment>	search_email
files with slides attachments	EMAILSEARCH	 files  with <attachment_type> slides </attachment_type> <attachment> attachments </attachment>	search_email
onenote attachment girls trip	EMAILSEARCH	<attachment_type> onenote </attachment_type> <attachment> attachment </attachment> <keyword> girls trip </keyword>	search_email
file about concert tickets with attachment sent in december 2019	EMAILSEARCH	 file  about <keyword> concert tickets </keyword> with <attachment> attachment </attachment> sent in <start_date> december 2019 </start_date>	search_email
file containing music attachments	EMAILSEARCH	 file  containing <keyword> music </keyword> <attachment> attachments </attachment>	search_email
file from greg to ellen with attachment about tigers	EMAILSEARCH	 file  from <contact_name_from> greg </contact_name_from> to <contact_name_to> ellen </contact_name_to> with <attachment> attachment </attachment> about <keyword> tigers </keyword>	search_email
from bates to anna with attachment	EMAILSEARCH	from <contact_name_from> bates </contact_name_from> to <contact_name_to> anna </contact_name_to> with <attachment> attachment </attachment>	search_email
vssx hasattachmentstrue	EMAILSEARCH	<attachment_type> vssx </attachment_type> hasattachmentstrue	search_email
file stan sent me with some attachments	EMAILSEARCH	 file  <contact_name_from> stan </contact_name_from> sent me with some <attachment> attachments </attachment>	search_email
files from malik with attachments last week	EMAILSEARCH	 files  from <contact_name_from> malik </contact_name_from> with <attachment> attachments </attachment> <start_date> last week </start_date>	search_email
file from july with doc attachments	EMAILSEARCH	 file  from <start_date> july </start_date> with <attachment_type> doc </attachment_type> <attachment> attachments </attachment>	search_email
file with attachment about rb singers	EMAILSEARCH	 file  with <attachment> attachment </attachment> about <keyword> rampb singers </keyword>	search_email
file with attachment from jayson to anthon	EMAILSEARCH	 file  with <attachment> attachment </attachment> from <contact_name_from> jayson </contact_name_from> to <contact_name_to> anthon </contact_name_to>	search_email
search for any files from last week that had attachments	EMAILSEARCH	search for any  files  from <start_date> last week </start_date> that had <attachment> attachments </attachment>	search_email
new work schedule attachments from may to june	EMAILSEARCH	<keyword> new work schedule </keyword> <attachment> attachments </attachment> from <start_date> may </start_date> to <end_date> june </end_date>	search_email
show me my file that have dog food attachments linked	EMAILSEARCH	show me my  file  that have <keyword> dog food </keyword> <attachment> attachments </attachment> linked	search_email
file from jim boyle with presentations attachments	EMAILSEARCH	 file  from <contact_name_from> jim boyle </contact_name_from> with <attachment_type> presentations </attachment_type> <attachment> attachments </attachment>	search_email
view file with vst attachments	EMAILSEARCH	view  file  with <attachment_type> vst </attachment_type> <attachment> attachments </attachment>	search_email
files about dogs on march 5th and 6th with an attachment	EMAILSEARCH	 files  about <keyword> dogs </keyword> on <start_date> march 5th </start_date> and <end_date> 6th </end_date> with an <attachment> attachment </attachment>	search_email
bring up file with tsv attachments	EMAILSEARCH	bring up  file  with <attachment_type> tsv </attachment_type> <attachment> attachments </attachment>	search_email
tim with sheet attachments	EMAILSEARCH	<contact_name> tim </contact_name> with <attachment_type> sheet </attachment_type> <attachment> attachments </attachment>	search_email
file from jayson with attachments about pop music	EMAILSEARCH	 file  from <contact_name_from> jayson </contact_name_from> with <attachment> attachments </attachment> about <keyword> pop music </keyword>	search_email
calendar attachment	EMAILSEARCH	<keyword> calendar </keyword> <attachment> attachment </attachment>	search_email
spec attachments sent to jim	EMAILSEARCH	<attachment_type> spec </attachment_type> <attachment> attachments </attachment> sent to <contact_name_to> jim </contact_name_to>	search_email
file from joe with sheets attachment	EMAILSEARCH	 file  from <contact_name_from> joe </contact_name_from> with <attachment_type> sheets </attachment_type> <attachment> attachment </attachment>	search_email
files sent to john with spreadsheet attachment	EMAILSEARCH	 files  sent to <contact_name_to> john </contact_name_to> with <attachment_type> spreadsheet </attachment_type> <attachment> attachment </attachment>	search_email
play files from allison with power point attachment	EMAILSEARCH	play  files  from <contact_name_from> allison </contact_name_from> with <attachment_type> power point </attachment_type> <attachment> attachment </attachment>	search_email
june email with attachment	EMAILSEARCH	<start_date> june </start_date> <keyword> email </keyword> with <attachment> attachment </attachment>	search_email
file with attachment from last year	EMAILSEARCH	 file  with <attachment> attachment </attachment> from <start_date> last year </start_date>	search_email
files with pdfs attachment from jack	EMAILSEARCH	 files  with <attachment_type> pdfs </attachment_type> <attachment> attachment </attachment> from <contact_name_from> jack </contact_name_from>	search_email
give me file with vst attachments	EMAILSEARCH	give me  file  with <attachment_type> vst </attachment_type> <attachment> attachments </attachment>	search_email
february files attachments	EMAILSEARCH	<start_date> february </start_date>  files  <attachment> attachments </attachment>	search_email
attachments from january to febuary file	EMAILSEARCH	<attachment> attachments </attachment> from <start_date> january </start_date> to <end_date> febuary </end_date>  file 	search_email
file from danny to keith with attachment	EMAILSEARCH	 file  from <contact_name_from> danny </contact_name_from> to <contact_name_to> keith </contact_name_to> with <attachment> attachment </attachment>	search_email
greg presentations attachment files	EMAILSEARCH	<contact_name> greg </contact_name> <attachment_type> presentations </attachment_type> <attachment> attachment </attachment>  files 	search_email
files correspondence with attachment	EMAILSEARCH	 files  correspondence with <attachment> attachment </attachment>	search_email
attachment files from goku doc	EMAILSEARCH	<attachment> attachment </attachment>  files  from <contact_name_from> goku </contact_name_from> <attachment_type> doc </attachment_type>	search_email
file to jake with attachment	EMAILSEARCH	 file  to <contact_name_to> jake </contact_name_to> with <attachment> attachment </attachment>	search_email
look up file with employee review attachments	EMAILSEARCH	look up  file  with <keyword> employee review </keyword> <attachment> attachments </attachment>	search_email
rosas file from january with attachments	EMAILSEARCH	<contact_name> rosa </contact_name> s  file  from <start_date> january </start_date> with <attachment> attachments </attachment>	search_email
attachments that are with an file	EMAILSEARCH	<attachment> attachments </attachment> that are with an  file 	search_email
file with attachment received between august 3 and august 14	EMAILSEARCH	 file  with <attachment> attachment </attachment> received between <start_date> august 3 </start_date> and <end_date> august 14 </end_date>	search_email
show last weeks attachments	EMAILSEARCH	show <start_date> last week </start_date> s <attachment> attachments </attachment>	search_email
give me all attachment files	EMAILSEARCH	give me all <attachment> attachment </attachment>  files 	search_email
ppt attachment in files	EMAILSEARCH	<attachment_type> ppt </attachment_type> <attachment> attachment </attachment> in  files 	search_email
files received from december 1st to 10th with attachments	EMAILSEARCH	 files  received from <start_date> december 1st </start_date> to <end_date> 10th </end_date> with <attachment> attachments </attachment>	search_email
file that has an attachment and is from gale	EMAILSEARCH	 file  that has an <attachment> attachment </attachment> and is from <contact_name_from> gale </contact_name_from>	search_email
jacob file with attachment	EMAILSEARCH	<contact_name> jacob </contact_name>  file  with <attachment> attachment </attachment>	search_email
files from glenn to cherie with attachment from last month	EMAILSEARCH	 files  from <contact_name_from> glenn </contact_name_from> to <contact_name_to> cherie </contact_name_to> with <attachment> attachment </attachment> from <start_date> last month </start_date>	search_email
email from supervisor with attachment	EMAILSEARCH	<message_type> from <relationship_name_from> supervisor </relationship_name_from> with <attachment> attachment </attachment>	search_email
greg worksheet attachment file	EMAILSEARCH	<contact_name> greg </contact_name> <attachment_type> worksheet </attachment_type> <attachment> attachment </attachment>  file 	search_email
file from tim with attachment	EMAILSEARCH	 file  from <contact_name_from> tim </contact_name_from> with <attachment> attachment </attachment>	search_email
graduation file with attachment	EMAILSEARCH	<keyword> graduation </keyword>  file  with <attachment> attachment </attachment>	search_email
work order files with attachments from may	EMAILSEARCH	<keyword> work order </keyword>  files  with <attachment> attachments </attachment> from <start_date> may </start_date>	search_email
show me files from jordan with onenote attachments	EMAILSEARCH	show me  files  from <contact_name_from> jordan </contact_name_from> with <attachment_type> onenote </attachment_type> attachments	search_email
xlsx attachment to jason	EMAILSEARCH	<attachment_type> xlsx </attachment_type> <attachment> attachment </attachment> to <contact_name_to> jason </contact_name_to>	search_email
help me find file from pat with attachment	EMAILSEARCH	help me find  file  from <contact_name_from> pat </contact_name_from> with <attachment> attachment </attachment>	search_email
onenote attachment to jack	EMAILSEARCH	<attachment_type> onenote </attachment_type> <attachment> attachment </attachment> to <contact_name_to> jack </contact_name_to>	search_email
play file from allison with spreadsheet attachment	EMAILSEARCH	play  file  from <contact_name_from> allison </contact_name_from> with <attachment_type> spreadsheet </attachment_type> <attachment> attachment </attachment>	search_email
from yeyi with attachment	EMAILSEARCH	from <contact_name_from> yeyi </contact_name_from> with <attachment> attachment </attachment>	search_email
all file from hue with attachments please	EMAILSEARCH	all  file  from <contact_name_from> hue </contact_name_from> with <attachment> attachments </attachment> please	search_email
files from amy with attachments	EMAILSEARCH	 files  from <contact_name_from> amy </contact_name_from> with <attachment> attachments </attachment>	search_email
view files with doc attachments sent to amanda	EMAILSEARCH	view  files  with <attachment_type> doc </attachment_type> <attachment> attachments </attachment> sent to <contact_name_to> amanda </contact_name_to>	search_email
search for audit forms in my files attachments	EMAILSEARCH	search for <keyword> audit forms </keyword> in my  files  <attachment> attachments </attachment>	search_email
files from boss with attachment	EMAILSEARCH	 files  from <relationship_name_from> boss </relationship_name_from> with <attachment> attachment </attachment>	search_email
files from dapriy with attachments	EMAILSEARCH	 files  from <contact_name_from> dapriy </contact_name_from> with <attachment> attachments </attachment>	search_email
file received with attachments from january 7th through january 26th	EMAILSEARCH	 file  received with <attachment> attachments </attachment> from <start_date> january 7th </start_date> through <end_date> january 26th </end_date>	search_email
file from greg to vanessa about teaching with attachment	EMAILSEARCH	 file  from <contact_name_from> greg </contact_name_from> to <contact_name_to> vanessa </contact_name_to> about <keyword> teaching </keyword> with <attachment> attachment </attachment>	search_email
look at attachments in file	EMAILSEARCH	look at <attachment> attachments </attachment> in  file 	search_email
files from emma with attachments	EMAILSEARCH	 files  from <contact_name_from> emma </contact_name_from> with <attachment> attachments </attachment>	search_email
file with attachment about biology	EMAILSEARCH	 file  with <attachment> attachment </attachment> about <keyword> biology </keyword>	search_email
find vivs files with pdfs attachment	EMAILSEARCH	find <contact_name> viv </contact_name> s  files  with <attachment_type> pdfs </attachment_type> <attachment> attachment </attachment>	search_email
files from terry to mia with attachment	EMAILSEARCH	 files  from <contact_name_from> terry </contact_name_from> to <contact_name_to> mia </contact_name_to> with <attachment> attachment </attachment>	search_email
locate file with attachments between december 3rd and december 12th	EMAILSEARCH	locate  file  with <attachment> attachments </attachment> between <start_date> december 3rd </start_date> and <end_date> december 12th </end_date>	search_email
tennis files with attachment	EMAILSEARCH	<keyword> tennis </keyword>  files  with <attachment> attachment </attachment>	search_email
josh file from last night with some attachment	EMAILSEARCH	<contact_name> josh </contact_name>  file  from <start_time> last night </start_time> with some <attachment> attachment </attachment>	search_email
kevin files to dave with attachment	EMAILSEARCH	<contact_name> kevin </contact_name>  files  to <contact_name_to> dave </contact_name_to> with <attachment> attachment </attachment>	search_email
files from penny with dog sheet attachment from december	EMAILSEARCH	 files  from <contact_name_from> penny </contact_name_from> with <keyword> dog </keyword> <attachment_type> sheet </attachment_type> <attachment> attachment </attachment> from <start_date> december </start_date>	search_email
daisys file with attachment	EMAILSEARCH	<contact_name> daisy </contact_name> s  file  with <attachment> attachment </attachment>	search_email
attachments from rose	EMAILSEARCH	<attachment> attachments </attachment> from <contact_name_from> rose </contact_name_from>	search_email
file from robert to cora re chamberlain visit with vst attachments july 2015 to august 2015	EMAILSEARCH	 file  from <contact_name_from> robert </contact_name_from> to <contact_name_to> cora </contact_name_to> re <keyword> chamberlain visit </keyword> with <attachment_type> vst </attachment_type> <attachment> attachments </attachment> <start_date> july 2015 </start_date> to <end_date> august 2015 </end_date>	search_email
show me file from file with vstm	EMAILSEARCH	show me  file  from  file  with <attachment_type> vstm </attachment_type>	search_email
file with attachments from january 1 through march 3	EMAILSEARCH	 file  with <attachment> attachments </attachment> from <start_date> january 1 </start_date> through <end_date> march 3 </end_date>	search_email
look for files with attachments sent last week	EMAILSEARCH	look for  files  with <attachment> attachments </attachment> sent <start_date> last week </start_date>	search_email
look for purchase order attachments in file	EMAILSEARCH	look for <keyword> purchase order </keyword> <attachment> attachments </attachment> in  file 	search_email
file i sent to john with an attachment	EMAILSEARCH	 file  i sent to <contact_name_to> john </contact_name_to> with an <attachment> attachment </attachment>	search_email
find new file from allison with attachments	EMAILSEARCH	find <message_category> new </message_category>  file  from <contact_name_from> allison </contact_name_from> with <attachment> attachments </attachment>	search_email
to dad with pdf attachment	EMAILSEARCH	to <relationship_name_to> dad </relationship_name_to> with <attachment_type> pdf </attachment_type> <attachment> attachment </attachment>	search_email
stacey hot chocolate pastry sent to file decks attachment	EMAILSEARCH	<keyword> stacey hot chocolate pastry </keyword> sent to  file  <attachment_type> decks </attachment_type> <attachment> attachment </attachment>	search_email
files from yesterday with attachments	EMAILSEARCH	 files  from <start_date> yesterday </start_date> with <attachment> attachments </attachment>	search_email
show me attachment ics with tim	EMAILSEARCH	show me <attachment> attachment </attachment> <attachment_type> ics </attachment_type> with <contact_name> tim </contact_name>	search_email
file sent without attachment	EMAILSEARCH	 file  sent <without_attachment> without attachment </without_attachment>	search_email
file with presentation attachment from april	EMAILSEARCH	 file  with <attachment_type> presentation </attachment_type> <attachment> attachment </attachment> from <start_date> april </start_date>	search_email
kristy with attachment words	EMAILSEARCH	<contact_name> kristy </contact_name> with <attachment> attachment </attachment> <attachment_type> words </attachment_type>	search_email
