MessageText	JudgedDomain	JudgedConstraints	JudgedIntent
files with attachments from lisa to oliver from january	EMAILSEARCH	 files  with <attachment> attachments </attachment> from <contact_name_from> lisa </contact_name_from> to <contact_name_to> oliver </contact_name_to> from <start_date> january </start_date>	search_email
files from paul with attachments about country music	EMAILSEARCH	 files  from <contact_name_from> paul </contact_name_from> with <attachment> attachments </attachment> about <keyword> country music </keyword>	search_email
vcs attachment from jim	EMAILSEARCH	<attachment_type> vcs </attachment_type> <attachment> attachment </attachment> from <contact_name_from> jim </contact_name_from>	search_email
show files from bill with attachment	EMAILSEARCH	show  files  from <contact_name_from> bill </contact_name_from> with <attachment> attachment </attachment>	search_email
attachment from tim	EMAILSEARCH	<attachment> attachment </attachment> from <contact_name_from> tim </contact_name_from>	search_email
files with attachment of presentation	EMAILSEARCH	 files  with <attachment> attachment </attachment> of <attachment_type> presentation </attachment_type>	search_email
greg vst attachment files	EMAILSEARCH	<contact_name> greg </contact_name> <attachment_type> vst </attachment_type> <attachment> attachment </attachment>  files 	search_email
reply to john brown regarding your attachment	EMAILSEARCH	<email_state> reply </email_state> to <contact_name_to> john brown </contact_name_to> regarding <keyword> your attachment </keyword>	search_email
files with attachments received from march 2012 to june 2012 regarding delamo mall sale	EMAILSEARCH	 files  with <attachment> attachments </attachment> received from <start_date> march 2012 </start_date> to <end_date> june 2012 </end_date> regarding <keyword> delamo mall sale </keyword>	search_email
birthday invitation from jayson with attachment from january 1 to january 5	EMAILSEARCH	<keyword> birthday invitation </keyword> from <contact_name_from> jayson </contact_name_from> with <attachment> attachment </attachment> from <start_date> january 1 </start_date> to <end_date> january 5 </end_date>	search_email
show files with attachments about furniture	EMAILSEARCH	show  files  with <attachment> attachments </attachment> about <keyword> furniture </keyword>	search_email
files from paul with vssx attachments	EMAILSEARCH	 files  from <contact_name_from> paul </contact_name_from> with <attachment_type> vssx </attachment_type> <attachment> attachments </attachment>	search_email
file from paul with ppt attachments	EMAILSEARCH	 file  from <contact_name_from> paul </contact_name_from> with <attachment_type> ppt </attachment_type> <attachment> attachments </attachment>	search_email
file with attachment from december about tigers	EMAILSEARCH	 file  with <attachment> attachment </attachment> from <start_date> december </start_date> about <keyword> tigers </keyword>	search_email
find files containing attachments	EMAILSEARCH	find  files  containing <attachment> attachments </attachment>	search_email
file from jon hamaker with attachments	EMAILSEARCH	 file  from <contact_name_from> jon hamaker </contact_name_from> with <attachment> attachments </attachment>	search_email
yesterday mark sent an file attachment to martha	EMAILSEARCH	<start_date> yesterday </start_date> <contact_name> mark </contact_name> sent an  file  <attachment> attachment </attachment> to <contact_name_to> martha </contact_name_to>	search_email
email with attachment on music	EMAILSEARCH	<message_type> with <attachment> attachment </attachment> on <keyword> music </keyword>	search_email
bring up files from chas shows an attachment	EMAILSEARCH	bring up  files  from <contact_name_from> chas </contact_name_from> shows an <attachment> attachment </attachment>	search_email
files attachments from third week in january	EMAILSEARCH	 files  <attachment> attachments </attachment> from <start_date> third week in january </start_date>	search_email
tsv attachment from dad	EMAILSEARCH	<attachment_type> tsv </attachment_type> <attachment> attachment </attachment> from <relationship_name_from> dad </relationship_name_from>	search_email
word attachments in files from january	EMAILSEARCH	<attachment_type> word </attachment_type> <attachment> attachments </attachment> in  files  from <start_date> january </start_date>	search_email
doc attachment to jason	EMAILSEARCH	<attachment_type> doc </attachment_type> <attachment> attachment </attachment> to <contact_name_to> jason </contact_name_to>	search_email
files to reginald with attachment from last month	EMAILSEARCH	 files  to <contact_name_to> reginald </contact_name_to> with <attachment> attachment </attachment> from <start_date> last month </start_date>	search_email
png sent attachments	EMAILSEARCH	<attachment_type> png </attachment_type> sent <attachment> attachments </attachment>	search_email
file with attachments february 8 through february 10	EMAILSEARCH	 file  with <attachment> attachments </attachment> <start_date> february 8 </start_date> through <end_date> february 10 </end_date>	search_email
from howard include attachment	EMAILSEARCH	from <contact_name_from> howard </contact_name_from> include <attachment> attachment </attachment>	search_email
is there an files from alfred with an attachment	EMAILSEARCH	is there an  files  from <contact_name_from> alfred </contact_name_from> with an <attachment> attachment </attachment>	search_email
julia file with attachment	EMAILSEARCH	<contact_name> julia </contact_name>  file  with <attachment> attachment </attachment>	search_email
presentation attachment from goku	EMAILSEARCH	<attachment_type> presentation </attachment_type> <attachment> attachment </attachment> from <contact_name_from> goku </contact_name_from>	search_email
find files with attachments	EMAILSEARCH	find  files  with <attachment> attachments </attachment>	search_email
files from august 2019 with multiple attachments	EMAILSEARCH	 files  from <start_date> august 2019 </start_date> with multiple <attachment> attachments </attachment>	search_email
i want to see files attachments	EMAILSEARCH	i want to see  files  <attachment> attachments </attachment>	search_email
from darlene ics attachment	EMAILSEARCH	from <contact_name_from> darlene </contact_name_from> <attachment_type> ics </attachment_type> <attachment> attachment </attachment>	search_email
show me file from file with spec	EMAILSEARCH	show me  file  from  file  with <attachment_type> spec </attachment_type>	search_email
attachment file from goku xls	EMAILSEARCH	<attachment> attachment </attachment>  file  from <contact_name_from> goku </contact_name_from> <attachment_type> xls </attachment_type>	search_email
show file with diego send me last week with attachments in where town was on it	EMAILSEARCH	show  file  with <contact_name_from> diego </contact_name_from> send <relationship_name_to> me </relationship_name_to> <start_date> last week </start_date> with <attachment> attachments </attachment> in where <keyword> town </keyword> was on it	search_email
file featuring multiple attachments	EMAILSEARCH	 file  featuring multiple <attachment> attachments </attachment>	search_email
onenote attachments from joshua	EMAILSEARCH	<attachment_type> onenote </attachment_type> <attachment> attachments </attachment> from <contact_name_from> joshua </contact_name_from>	search_email
sent to joe with presentation attachments	EMAILSEARCH	sent to <contact_name_to> joe </contact_name_to> with <attachment_type> presentation </attachment_type> <attachment> attachments </attachment>	search_email
look in files for compliance review attachments	EMAILSEARCH	look in  files  for <keyword> compliance review </keyword> <attachment> attachments </attachment>	search_email
to bob with attachments	EMAILSEARCH	to <contact_name_to> bob </contact_name_to> with <attachment> attachments </attachment>	search_email
file about big dig with attachment	EMAILSEARCH	 file  about <keyword> big dig </keyword> with <attachment> attachment </attachment>	search_email
from ming attachment	EMAILSEARCH	from <contact_name_from> ming </contact_name_from> <attachment> attachment </attachment>	search_email
files from september 1st with amazon shopping link attachments	EMAILSEARCH	 files  from <start_date> september 1st </start_date> with <keyword> amazon shopping link </keyword> <attachment> attachments </attachment>	search_email
look for document attachments	EMAILSEARCH	look for <attachment_type> document </attachment_type> <attachment> attachments </attachment>	search_email
find any files i got last week that had attachments	EMAILSEARCH	find any  files  <relationship_name_to> i </relationship_name_to> got <start_date> last week </start_date> that had <attachment> attachments </attachment>	search_email
from cindy attachment onenotes	EMAILSEARCH	from <contact_name_from> cindy </contact_name_from> <attachment> attachment </attachment> <attachment_type> onenotes </attachment_type>	search_email
files from july with docs attachments	EMAILSEARCH	 files  from <start_date> july </start_date> with <attachment_type> docs </attachment_type> <attachment> attachments </attachment>	search_email
find all file from reggie with an attachment	EMAILSEARCH	find all  file  from <contact_name_from> reggie </contact_name_from> with an <attachment> attachment </attachment>	search_email
files about conference with attachment	EMAILSEARCH	 files  about <keyword> conference </keyword> with <attachment> attachment </attachment>	search_email
msg attachment from han zhang	EMAILSEARCH	<attachment_type> msg </attachment_type> <attachment> attachment </attachment> from <contact_name_from> han zhang </contact_name_from>	search_email
waynes file from october with attachments	EMAILSEARCH	<contact_name> wayne </contact_name> s  file  from <start_date> october </start_date> with <attachment> attachments </attachment>	search_email
files with attachment from december about tigers	EMAILSEARCH	 files  with <attachment> attachment </attachment> from <start_date> december </start_date> about <keyword> tigers </keyword>	search_email
file from july with ics attachments	EMAILSEARCH	 file  from <start_date> july </start_date> with <attachment_type> ics </attachment_type> <attachment> attachments </attachment>	search_email
files with attachment between february 9 and february 15	EMAILSEARCH	 files  with <attachment> attachment </attachment> between <start_date> february 9 </start_date> and <end_date> february 15 </end_date>	search_email
files with attachment between june and november	EMAILSEARCH	 files  with <attachment> attachment </attachment> between <start_date> june </start_date> and <end_date> november </end_date>	search_email
files with attachment from rick about furniture delivery	EMAILSEARCH	 files  with <attachment> attachment </attachment> from <contact_name_from> rick </contact_name_from> about <keyword> furniture delivery </keyword>	search_email
yesterday he sent me an files about words attachments on dogs	EMAILSEARCH	<start_date> yesterday </start_date> he sent <relationship_name_to> me </relationship_name_to> an  files  about <attachment_type> words </attachment_type> <attachment> attachments </attachment> on <keyword> dogs </keyword>	search_email
file about dogs with attachment from cindy	EMAILSEARCH	 file  about <keyword> dogs </keyword> with <attachment> attachment </attachment> from <contact_name_from> cindy </contact_name_from>	search_email
jasons file with attachment from last monday	EMAILSEARCH	<contact_name> jason </contact_name> s  file  with <attachment> attachment </attachment> from <start_date> last monday </start_date>	search_email
last weeks files with attachments	EMAILSEARCH	<start_date> last week </start_date> s  files  with <attachment> attachments </attachment>	search_email
file s that came with attachments	EMAILSEARCH	 file  s that came with <attachment> attachments </attachment>	search_email
find all files attachments	EMAILSEARCH	find all  files  <attachment> attachments </attachment>	search_email
file from spock to will with attachment	EMAILSEARCH	 file  from <contact_name_from> spock </contact_name_from> to <contact_name_to> will </contact_name_to> with <attachment> attachment </attachment>	search_email
i want to see file with attachments	EMAILSEARCH	i want to see  file  with <attachment> attachments </attachment>	search_email
i need to view file from janel with an attachment in it	EMAILSEARCH	i need to view  file  from <contact_name_from> janel </contact_name_from> with an <attachment> attachment </attachment> in it	search_email
files with attachment from anson	EMAILSEARCH	 files  with <attachment> attachment </attachment> from <contact_name_from> anson </contact_name_from>	search_email
show me file from viv with an attachment	EMAILSEARCH	show me  file  from <contact_name_from> viv </contact_name_from> with an <attachment> attachment </attachment>	search_email
kristy with attachment vsdm	EMAILSEARCH	<contact_name> kristy </contact_name> with <attachment> attachment </attachment> <attachment_type> vsdm </attachment_type>	search_email
file from penny with dog vstx attachment from december	EMAILSEARCH	 file  from <contact_name_from> penny </contact_name_from> with <keyword> dog </keyword> <attachment_type> vstx </attachment_type> <attachment> attachment </attachment> from <start_date> december </start_date>	search_email
attachment from mary anne document	EMAILSEARCH	<attachment> attachment </attachment> from <contact_name_from> mary anne </contact_name_from> <attachment_type> document </attachment_type>	search_email
file from someone with attachment	EMAILSEARCH	 file  from someone with <attachment> attachment </attachment>	search_email
files to joe with attachment	EMAILSEARCH	 files  to <contact_name_to> joe </contact_name_to> with <attachment> attachment </attachment>	search_email
april attachments	EMAILSEARCH	<start_date> april </start_date> <attachment> attachments </attachment>	search_email
what recent file do i have which have attachments	EMAILSEARCH	what <order_ref> recent </order_ref>  file  do i have which have <attachment> attachments </attachment>	search_email
view files with worksheet attachments	EMAILSEARCH	view  files  with <attachment_type> worksheet </attachment_type> <attachment> attachments </attachment>	search_email
to maurice attachments	EMAILSEARCH	to <contact_name_to> maurice </contact_name_to> <attachment> attachments </attachment>	search_email
vssx attachments sent to jim	EMAILSEARCH	<attachment_type> vssx </attachment_type> <attachment> attachments </attachment> sent to <contact_name_to> jim </contact_name_to>	search_email
from shuyin containing attachment	EMAILSEARCH	from <contact_name_from> shuyin </contact_name_from> containing <attachment> attachment </attachment>	search_email
tracys file with budget attachment	EMAILSEARCH	<contact_name> tracy </contact_name> s  file  with <keyword> budget </keyword> <attachment> attachment </attachment>	search_email
sundays file with attachment on park slides	EMAILSEARCH	<start_date> sunday </start_date> s  file  with <attachment> attachment </attachment> on <keyword> park </keyword> <attachment_type> slides </attachment_type>	search_email
let me see files with spreadsheet attachments	EMAILSEARCH	let me see  files  with <attachment_type> spreadsheet </attachment_type> <attachment> attachments </attachment>	search_email
file with any attachment	EMAILSEARCH	 file  with any <attachment> attachment </attachment>	search_email
attachments from january to febuary files	EMAILSEARCH	<attachment> attachments </attachment> from <start_date> january </start_date> to <end_date> febuary </end_date>  files 	search_email
rosas files from january with attachments	EMAILSEARCH	<contact_name> rosa </contact_name> s  files  from <start_date> january </start_date> with <attachment> attachments </attachment>	search_email
payment attachment file with balance	EMAILSEARCH	<keyword> payment </keyword> <attachment> attachment </attachment>  file  with <keyword> balance </keyword>	search_email
attachments to greg	EMAILSEARCH	<attachment> attachments </attachment> to <contact_name_to> greg </contact_name_to>	search_email
kellys files with updated project attachment	EMAILSEARCH	<contact_name> kelly </contact_name> s  files  with <keyword> updated project </keyword> <attachment> attachment </attachment>	search_email
december files with vcs attachment	EMAILSEARCH	<start_date> december </start_date>  files  with <attachment_type> vcs </attachment_type> <attachment> attachment </attachment>	search_email
from jamil with attachment	EMAILSEARCH	from <contact_name_from> jamil </contact_name_from> <attachment> with attachment </attachment>	search_email
message from carly with an attachment	EMAILSEARCH	message from <contact_name_from> carly </contact_name_from> with an <attachment> attachment </attachment>	search_email
file from doctor sofia with attachment about health between january and march	EMAILSEARCH	 file  from <contact_name_from> doctor sofia </contact_name_from> with <attachment> attachment </attachment> about <keyword> health </keyword> between <start_date> january </start_date> and <end_date> march </end_date>	search_email
find vivs files with pdf attachment	EMAILSEARCH	find <contact_name> viv </contact_name> s  files  with <attachment_type> pdf </attachment_type> <attachment> attachment </attachment>	search_email
file with attachments from lia	EMAILSEARCH	 file  with <attachment> attachments </attachment> from <contact_name_from> lia </contact_name_from>	search_email
mias files with ppt attachments	EMAILSEARCH	<contact_name> mia </contact_name> s  files  with <attachment_type> ppt </attachment_type> <attachment> attachments </attachment>	search_email
funny cat ics attachment in file	EMAILSEARCH	<keyword> funny cat </keyword> <attachment_type> ics </attachment_type> <attachment> attachment </attachment> in  file 	search_email
files with surgeon update ppts attachment	EMAILSEARCH	 files  with <keyword> surgeon update </keyword> <attachment_type> ppts </attachment_type> <attachment> attachment </attachment>	search_email
ebook attachments in files	EMAILSEARCH	<keyword> ebook </keyword> <attachment> attachments </attachment> in  files 	search_email
from laura with attachment jokes	EMAILSEARCH	from <contact_name_from> laura </contact_name_from> with <attachment> attachment </attachment> <keyword> jokes </keyword>	search_email
file with frog worksheet attachment	EMAILSEARCH	 file  with <keyword> frog </keyword> <attachment_type> worksheet </attachment_type> <attachment> attachment </attachment>	search_email
pias files to john with form attachments from march	EMAILSEARCH	<contact_name> pia </contact_name> s  files  to <contact_name_to> john </contact_name_to> with <keyword> form </keyword> <attachment> attachments </attachment> from <start_date> march </start_date>	search_email
show all attachments	EMAILSEARCH	show all <attachment> attachments </attachment>	search_email
attachments from february 2 and today	EMAILSEARCH	<attachment> attachments </attachment> from <start_date> february 2 </start_date> and <end_date> today </end_date>	search_email
files that have credit card expense attachments	EMAILSEARCH	 files  that have <keyword> credit card expense </keyword> <attachment> attachments </attachment>	search_email
files attachment re edith	EMAILSEARCH	 files  <attachment> attachment </attachment> re <keyword> edith </keyword>	search_email
file from paul with attachments about country music	EMAILSEARCH	 file  from <contact_name_from> paul </contact_name_from> with <attachment> attachments </attachment> about <keyword> country music </keyword>	search_email
attachments i sent to virgil	EMAILSEARCH	<attachment> attachments </attachment> i sent to <contact_name_to> virgil </contact_name_to>	search_email
msg hasattachmentstrue	EMAILSEARCH	<attachment_type> msg </attachment_type> hasattachmentstrue	search_email
show my file to kevin with attachments on project	EMAILSEARCH	show my  file  to <contact_name_to> kevin </contact_name_to> with <attachment> attachments </attachment> on <keyword> project </keyword>	search_email
files received between march 1 and march 15 with attachments	EMAILSEARCH	 files  received between <start_date> march 1 </start_date> and <end_date> march 15 </end_date> with <attachment> attachments </attachment>	search_email
tim with powerpoint attachments	EMAILSEARCH	<contact_name> tim </contact_name> with <attachment_type> powerpoint </attachment_type> <attachment> attachments </attachment>	search_email
file from trisha with attachment from last year	EMAILSEARCH	 file  from <contact_name_from> trisha </contact_name_from> with <attachment> attachment </attachment> from <start_date> last year </start_date>	search_email
message from last month with attachments	EMAILSEARCH	message from <start_date> last month </start_date> with <attachment> attachments </attachment>	search_email
view files with documents attachments	EMAILSEARCH	view  files  with <attachment_type> documents </attachment_type> <attachment> attachments </attachment>	search_email
view files with attachments	EMAILSEARCH	view  files  with <attachment> attachments </attachment>	search_email
file from january 4 to february 4 with bill attachment	EMAILSEARCH	 file  from <start_date> january 4 </start_date> to <end_date> february 4 </end_date> with <keyword> bill </keyword> <attachment> attachment </attachment>	search_email
show file with ics attachments from marie	EMAILSEARCH	show  file  with <attachment_type> ics </attachment_type> <attachment> attachments </attachment> from <contact_name_from> marie </contact_name_from>	search_email
open file on visiting hospital with png attachment	EMAILSEARCH	open  file  on <keyword> visiting hospital </keyword> with <attachment_type> png </attachment_type> <attachment> attachment </attachment>	search_email
from darlene vst attachment	EMAILSEARCH	from <contact_name_from> darlene </contact_name_from> <attachment_type> vst </attachment_type> <attachment> attachment </attachment>	search_email
file with attachment from roselyn	EMAILSEARCH	 file  with <attachment> attachment </attachment> from <contact_name_from> roselyn </contact_name_from>	search_email
rickys files to jim with attachments sent in july	EMAILSEARCH	<contact_name_from> ricky </contact_name_from> s  files  to <contact_name_to> jim </contact_name_to> with <attachment> attachments </attachment> sent in <start_date> july </start_date>	search_email
search for file sent to todd that contain deck attachments	EMAILSEARCH	search for  file  sent to <contact_name_to> todd </contact_name_to> that contain <attachment_type> deck </attachment_type> <attachment> attachments </attachment>	search_email
find karens files containing attachment	EMAILSEARCH	find <contact_name> karen </contact_name> s  files  containing <attachment> attachment </attachment>	search_email
show me files from jon with attachments last week	EMAILSEARCH	show me  files  from <contact_name_from> jon </contact_name_from> with <attachment> attachments </attachment> <start_date> last week </start_date>	search_email
find all files to reggie with any attachments	EMAILSEARCH	find all  files  to <contact_name_to> reggie </contact_name_to> with any <attachment> attachments </attachment>	search_email
file from jake to martha with portfolio attachment	EMAILSEARCH	 file  from <contact_name_from> jake </contact_name_from> to <contact_name_to> martha </contact_name_to> with <keyword> portfolio </keyword> <attachment> attachment </attachment>	search_email
from greg with files attachment on office party	EMAILSEARCH	from <contact_name_from> greg </contact_name_from> with  files  <attachment> attachment </attachment> on <keyword> office party </keyword>	search_email
documents hasattachmentstrue	EMAILSEARCH	<attachment_type> documents </attachment_type> hasattachmentstrue	search_email
to jim attachment doc	EMAILSEARCH	to <contact_name_to> jim </contact_name_to> <attachment> attachment </attachment> <attachment_type> doc </attachment_type>	search_email
look for files from connie with a power point attachment	EMAILSEARCH	look for  files  from <contact_name_from> connie </contact_name_from> with a <attachment_type> power point </attachment_type> <attachment> attachment </attachment>	search_email
anniversary file with attachments between june and july	EMAILSEARCH	<keyword> anniversary </keyword>  file  with <attachment> attachments </attachment> between <start_date> june </start_date> and <end_date> july </end_date>	search_email
most recent files from carmen with attachment	EMAILSEARCH	<order_ref> most recent </order_ref>  files  from <contact_name_from> carmen </contact_name_from> with <attachment> attachment </attachment>	search_email
attachments to fishing files	EMAILSEARCH	<attachment> attachments </attachment> to <keyword> fishing </keyword>  files 	search_email
files from george from may and with attachment	EMAILSEARCH	 files  from <contact_name_from> george </contact_name_from> from <start_date> may </start_date> and with <attachment> attachment </attachment>	search_email
files with attachment to jon snow	EMAILSEARCH	 files  with <attachment> attachment </attachment> to <contact_name_to> jon snow </contact_name_to>	search_email
attachments april 1st to april 2nd	EMAILSEARCH	<attachment> attachments </attachment> <start_date> april 1st </start_date> to <end_date> april 2nd </end_date>	search_email
from tim with attachment	EMAILSEARCH	from <contact_name_from> tim </contact_name_from> with <attachment> attachment </attachment>	search_email
file archived with attachment	EMAILSEARCH	 file  <email_state> archived </email_state> with <attachment> attachment </attachment>	search_email
