0	show basketball summer camp with vacche	file_share	files	show <file_keyword> basketball summer camp </file_keyword> <to_contact_name> vacche </to_contact_name>
0	show appointment with monique with paumard	file_share	files	show <file_keyword> appointment with monique </file_keyword> <to_contact_name> paumard </to_contact_name>
0	show watch godzilla with ekoji	file_share	files	show <file_keyword> watch godzilla </file_keyword> <to_contact_name> ekoji </to_contact_name>
0	show calculus final exam with landsbygdens	file_share	files	show <file_keyword> calculus final exam </file_keyword> <to_contact_name> landsbygdens </to_contact_name>
0	show volleyball event with schloezer	file_share	files	show <file_keyword> volleyball event </file_keyword> <to_contact_name> schloezer </to_contact_name>
0	show irs rant with clennyson	file_share	files	show <file_keyword> irs rant </file_keyword> <to_contact_name> clennyson </to_contact_name>
0	show go shopping for coats in parramatta with koksteinova	file_share	files	show <file_keyword> go shopping for coats in parramatta </file_keyword> <to_contact_name> koksteinova </to_contact_name>
0	show one on one with palsberg	file_share	files	show <file_keyword> one on one </file_keyword> <to_contact_name> palsberg </to_contact_name>
0	show nikolas ' haircut appointment with chiappalone	file_share	files	show <file_keyword> nikolas ' haircut appointment </file_keyword> <to_contact_name> chiappalone </to_contact_name>
0	show damon hill with zena	file_share	files	show <file_keyword> damon hill </file_keyword> <to_contact_name> zena </to_contact_name>
0	show doctor bucks with hargsten	file_share	files	show <file_keyword> doctor bucks </file_keyword> <to_contact_name> hargsten </to_contact_name>
0	show triage with faczan	file_share	files	show <file_keyword> triage </file_keyword> <to_contact_name> faczan </to_contact_name>
0	show work appointment with hangl	file_share	files	show <file_keyword> work appointment </file_keyword> <to_contact_name> hangl </to_contact_name>
0	show but i get home with mathías	file_share	files	show <file_keyword> but i get home </file_keyword> <to_contact_name> mathías </to_contact_name>
0	show remploy appointment with dilja	file_share	files	show <file_keyword> remploy appointment </file_keyword> <to_contact_name> dilja </to_contact_name>
0	show water delivery with iervolino	file_share	files	show <file_keyword> water delivery </file_keyword> <to_contact_name> iervolino </to_contact_name>
0	show alberhasky eye clinic with perers	file_share	files	show <file_keyword> alberhasky eye clinic </file_keyword> <to_contact_name> perers </to_contact_name>
0	show saugatuck michigan with kalegi	file_share	files	show <file_keyword> saugatuck michigan </file_keyword> <to_contact_name> kalegi </to_contact_name>
0	show remploy appointment with owuor	file_share	files	show <file_keyword> remploy appointment </file_keyword> <to_contact_name> owuor </to_contact_name>
0	show all tasks i made with meslee	file_share	files	show <file_keyword> all tasks i made </file_keyword> <to_contact_name> meslee </to_contact_name>
0	show dentist olivia johnson with koorenee	file_share	files	show <file_keyword> dentist olivia johnson </file_keyword> <to_contact_name> koorenee </to_contact_name>
0	show see doctor kundi with unneback	file_share	files	show <file_keyword> see doctor kundi </file_keyword> <to_contact_name> unneback </to_contact_name>
0	show programming ideas with vidy	file_share	files	show <file_keyword> programming ideas </file_keyword> <to_contact_name> vidy </to_contact_name>
0	show kaylee ' s basketball tournament with swinea	file_share	files	show <file_keyword> kaylee ' s basketball tournament </file_keyword> <to_contact_name> swinea </to_contact_name>
0	show meeting amanda with yarrish	file_share	files	show <file_keyword> meeting amanda </file_keyword> <to_contact_name> yarrish </to_contact_name>
0	show cvs map with kantermo	file_share	files	show <file_keyword> cvs map </file_keyword> <to_contact_name> kantermo </to_contact_name>
0	show dentist olivia johnson with strijp	file_share	files	show <file_keyword> dentist olivia johnson </file_keyword> <to_contact_name> strijp </to_contact_name>
0	show basketball summer camp with becedas	file_share	files	show <file_keyword> basketball summer camp </file_keyword> <to_contact_name> becedas </to_contact_name>
0	show trader with wiskowski	file_share	files	show <file_keyword> trader </file_keyword> <to_contact_name> wiskowski </to_contact_name>
0	show housesitting with lemi?	file_share	files	show <file_keyword> housesitting </file_keyword> <to_contact_name> lemi? </to_contact_name>
0	show go shopping for coats in parramatta with ekoji	file_share	files	show <file_keyword> go shopping for coats in parramatta </file_keyword> <to_contact_name> ekoji </to_contact_name>
0	show kristin ' s birthday with altiokaian	file_share	files	show <file_keyword> kristin ' s birthday </file_keyword> <to_contact_name> altiokaian </to_contact_name>
0	show dr appointment with supaksorn	file_share	files	show <file_keyword> dr appointment </file_keyword> <to_contact_name> supaksorn </to_contact_name>
0	show financial materials with nusserwanjee	file_share	files	show <file_keyword> financial materials </file_keyword> <to_contact_name> nusserwanjee </to_contact_name>
0	show going to boston with adrians	file_share	files	show <file_keyword> going to boston </file_keyword> <to_contact_name> adrians </to_contact_name>
0	show payroll with sulaym	file_share	files	show <file_keyword> payroll </file_keyword> <to_contact_name> sulaym </to_contact_name>
0	show soccer meeting jin jones kelly baker lynn notice with yonashiro	file_share	files	show <file_keyword> soccer meeting jin jones kelly baker lynn notice </file_keyword> <to_contact_name> yonashiro </to_contact_name>
0	show appointment with doctor amin with zellar	file_share	files	show <file_keyword> appointment with doctor amin </file_keyword> <to_contact_name> zellar </to_contact_name>
0	show nikolas ' haircut appointment with ursescu	file_share	files	show <file_keyword> nikolas ' haircut appointment </file_keyword> <to_contact_name> ursescu </to_contact_name>
0	show diary with gurrad	file_share	files	show <file_keyword> diary </file_keyword> <to_contact_name> gurrad </to_contact_name>
0	show meeting amanda with athaldo	file_share	files	show <file_keyword> meeting amanda </file_keyword> <to_contact_name> athaldo </to_contact_name>
0	show matter with dorgebray	file_share	files	show <file_keyword> matter </file_keyword> <to_contact_name> dorgebray </to_contact_name>
0	show matter with daninthe	file_share	files	show <file_keyword> matter </file_keyword> <to_contact_name> daninthe </to_contact_name>
0	show clean out the garage with altiner	file_share	files	show <file_keyword> clean out the garage </file_keyword> <to_contact_name> altiner </to_contact_name>
0	show probation review meeting with shlosser	file_share	files	show <file_keyword> probation review meeting </file_keyword> <to_contact_name> shlosser </to_contact_name>
0	show kristin ' s birthday with paumard	file_share	files	show <file_keyword> kristin ' s birthday </file_keyword> <to_contact_name> paumard </to_contact_name>
0	show bake potato with greenhagen	file_share	files	show <file_keyword> bake potato </file_keyword> <to_contact_name> greenhagen </to_contact_name>
0	show summer reading with tokoname	file_share	files	show <file_keyword> summer reading </file_keyword> <to_contact_name> tokoname </to_contact_name>
0	show get a blowjob with babstock	file_share	files	show <file_keyword> get a blowjob </file_keyword> <to_contact_name> babstock </to_contact_name>
0	show the day i get married with sikai	file_share	files	show <file_keyword> the day i get married </file_keyword> <to_contact_name> sikai </to_contact_name>
0	show doctor furlow with bousserez	file_share	files	show <file_keyword> doctor furlow </file_keyword> <to_contact_name> bousserez </to_contact_name>
0	show six fifty five pm with villita	file_share	files	show <file_keyword> six fifty five pm </file_keyword> <to_contact_name> villita </to_contact_name>
0	show phone jody with meslee	file_share	files	show <file_keyword> phone jody </file_keyword> <to_contact_name> meslee </to_contact_name>
0	show damon hill with zellar	file_share	files	show <file_keyword> damon hill </file_keyword> <to_contact_name> zellar </to_contact_name>
0	show josiah is birthday with almér	file_share	files	show <file_keyword> josiah is birthday </file_keyword> <to_contact_name> almér </to_contact_name>
0	show public with curras	file_share	files	show <file_keyword> public </file_keyword> <to_contact_name> curras </to_contact_name>
0	show drop mama and dad off with jun-hong	file_share	files	show <file_keyword> drop mama and dad off </file_keyword> <to_contact_name> jun-hong </to_contact_name>
0	show bookstore with nieksen	file_share	files	show <file_keyword> bookstore </file_keyword> <to_contact_name> nieksen </to_contact_name>
0	show yvette ' s wedding with sakhir	file_share	files	show <file_keyword> yvette ' s wedding </file_keyword> <to_contact_name> sakhir </to_contact_name>
0	show irs rant with lagui	file_share	files	show <file_keyword> irs rant </file_keyword> <to_contact_name> lagui </to_contact_name>
0	show one on one with landsbygdens	file_share	files	show <file_keyword> one on one </file_keyword> <to_contact_name> landsbygdens </to_contact_name>
0	show holiday travel plans with gegg	file_share	files	show <file_keyword> holiday travel plans </file_keyword> <to_contact_name> gegg </to_contact_name>
0	show go shopping for coats in parramatta with habibifar	file_share	files	show <file_keyword> go shopping for coats in parramatta </file_keyword> <to_contact_name> habibifar </to_contact_name>
0	show pedicure appointment with kensing	file_share	files	show <file_keyword> pedicure appointment </file_keyword> <to_contact_name> kensing </to_contact_name>
0	show financial materials with eldrett	file_share	files	show <file_keyword> financial materials </file_keyword> <to_contact_name> eldrett </to_contact_name>
0	show sunday service with djeneba	file_share	files	show <file_keyword> sunday service </file_keyword> <to_contact_name> djeneba </to_contact_name>
0	show youth group with jun-hong	file_share	files	show <file_keyword> youth group </file_keyword> <to_contact_name> jun-hong </to_contact_name>
0	show kaylee ' s basketball tournament with villita	file_share	files	show <file_keyword> kaylee ' s basketball tournament </file_keyword> <to_contact_name> villita </to_contact_name>
0	show babysitting cole with almér	file_share	files	show <file_keyword> babysitting cole </file_keyword> <to_contact_name> almér </to_contact_name>
0	show doctor leisha with hangl	file_share	files	show <file_keyword> doctor leisha </file_keyword> <to_contact_name> hangl </to_contact_name>
0	show moot assignment with bisztrai	file_share	files	show <file_keyword> moot assignment </file_keyword> <to_contact_name> bisztrai </to_contact_name>
0	show hotel visit with castus	file_share	files	show <file_keyword> hotel visit </file_keyword> <to_contact_name> castus </to_contact_name>
0	show gp appointment with babstock	file_share	files	show <file_keyword> gp appointment </file_keyword> <to_contact_name> babstock </to_contact_name>
0	show college dance with begluk	file_share	files	show <file_keyword> college dance </file_keyword> <to_contact_name> begluk </to_contact_name>
0	show peer grading with folatre	file_share	files	show <file_keyword> peer grading </file_keyword> <to_contact_name> folatre </to_contact_name>
0	show lunch mom with chiappalone	file_share	files	show <file_keyword> lunch mom </file_keyword> <to_contact_name> chiappalone </to_contact_name>
0	show dr appointment with antiveduto	file_share	files	show <file_keyword> dr appointment </file_keyword> <to_contact_name> antiveduto </to_contact_name>
0	show clean out the garage with sakhir	file_share	files	show <file_keyword> clean out the garage </file_keyword> <to_contact_name> sakhir </to_contact_name>
0	show hanging out with esther with ekoji	file_share	files	show <file_keyword> hanging out with esther </file_keyword> <to_contact_name> ekoji </to_contact_name>
0	show cvs map with devoge	file_share	files	show <file_keyword> cvs map </file_keyword> <to_contact_name> devoge </to_contact_name>
0	show csu tickets with wret	file_share	files	show <file_keyword> csu tickets </file_keyword> <to_contact_name> wret </to_contact_name>
0	show goodwill with pangnark	file_share	files	show <file_keyword> goodwill </file_keyword> <to_contact_name> pangnark </to_contact_name>
0	show kevin ' s dad funeral with supaksorn	file_share	files	show <file_keyword> kevin ' s dad funeral </file_keyword> <to_contact_name> supaksorn </to_contact_name>
0	show programming ideas with yosomatsu	file_share	files	show <file_keyword> programming ideas </file_keyword> <to_contact_name> yosomatsu </to_contact_name>
0	show yvette ' s wedding with kocúriková	file_share	files	show <file_keyword> yvette ' s wedding </file_keyword> <to_contact_name> kocúriková </to_contact_name>
0	show creative leicestershire in a day with chataigneau	file_share	files	show <file_keyword> creative leicestershire in a day </file_keyword> <to_contact_name> chataigneau </to_contact_name>
0	show wigwam with klusackova	file_share	files	show <file_keyword> wigwam </file_keyword> <to_contact_name> klusackova </to_contact_name>
0	show payroll with bringuier	file_share	files	show <file_keyword> payroll </file_keyword> <to_contact_name> bringuier </to_contact_name>
0	show kiss ruthie with jekenyi	file_share	files	show <file_keyword> kiss ruthie </file_keyword> <to_contact_name> jekenyi </to_contact_name>
0	show bake potato with baerug	file_share	files	show <file_keyword> bake potato </file_keyword> <to_contact_name> baerug </to_contact_name>
0	show family day with chrysopolitanus	file_share	files	show <file_keyword> family day </file_keyword> <to_contact_name> chrysopolitanus </to_contact_name>
0	show meeting amanda with udescu	file_share	files	show <file_keyword> meeting amanda </file_keyword> <to_contact_name> udescu </to_contact_name>
0	show goodwill with pataki	file_share	files	show <file_keyword> goodwill </file_keyword> <to_contact_name> pataki </to_contact_name>
0	show band event with naimee	file_share	files	show <file_keyword> band event </file_keyword> <to_contact_name> naimee </to_contact_name>
0	show kaylee ' s basketball tournament with yarrish	file_share	files	show <file_keyword> kaylee ' s basketball tournament </file_keyword> <to_contact_name> yarrish </to_contact_name>
0	show matter with baerug	file_share	files	show <file_keyword> matter </file_keyword> <to_contact_name> baerug </to_contact_name>
0	show pepsi meeting with haralds	file_share	files	show <file_keyword> pepsi meeting </file_keyword> <to_contact_name> haralds </to_contact_name>
0	show damon hill with morreel	file_share	files	show <file_keyword> damon hill </file_keyword> <to_contact_name> morreel </to_contact_name>
0	show programming ideas with nieksen	file_share	files	show <file_keyword> programming ideas </file_keyword> <to_contact_name> nieksen </to_contact_name>
0	show child care with lofts	file_share	files	show <file_keyword> child care </file_keyword> <to_contact_name> lofts </to_contact_name>
0	show fred's test with franchère	file_share	files	show <file_keyword> fred's test </file_keyword> <to_contact_name> franchère </to_contact_name>
0	show school day with altiner	file_share	files	show <file_keyword> school day </file_keyword> <to_contact_name> altiner </to_contact_name>
0	show farmers insurance with svens	file_share	files	show <file_keyword> farmers insurance </file_keyword> <to_contact_name> svens </to_contact_name>
0	show kiss ruthie with altgenug	file_share	files	show <file_keyword> kiss ruthie </file_keyword> <to_contact_name> altgenug </to_contact_name>
0	show wing night with yosomatsu	file_share	files	show <file_keyword> wing night </file_keyword> <to_contact_name> yosomatsu </to_contact_name>
0	show laser gate with kapelar	file_share	files	show <file_keyword> laser gate </file_keyword> <to_contact_name> kapelar </to_contact_name>
0	show jasper eye test with glazebrook	file_share	files	show <file_keyword> jasper eye test </file_keyword> <to_contact_name> glazebrook </to_contact_name>
0	show creative leicestershire in a day with glaucio	file_share	files	show <file_keyword> creative leicestershire in a day </file_keyword> <to_contact_name> glaucio </to_contact_name>
0	show to class with jun-hong	file_share	files	show <file_keyword> to class </file_keyword> <to_contact_name> jun-hong </to_contact_name>
0	show four interviews with edarh-bossou	file_share	files	show <file_keyword> four interviews </file_keyword> <to_contact_name> edarh-bossou </to_contact_name>
0	show dad with cavirot	file_share	files	show <file_keyword> dad </file_keyword> <to_contact_name> cavirot </to_contact_name>
0	show meet with people from moffitt cancer center with buyck	file_share	files	show <file_keyword> meet with people from moffitt cancer center </file_keyword> <to_contact_name> buyck </to_contact_name>
0	show band event with ector	file_share	files	show <file_keyword> band event </file_keyword> <to_contact_name> ector </to_contact_name>
0	show triage with djeneba	file_share	files	show <file_keyword> triage </file_keyword> <to_contact_name> djeneba </to_contact_name>
0	show lego group meeting with devoge	file_share	files	show <file_keyword> lego group meeting </file_keyword> <to_contact_name> devoge </to_contact_name>
0	show to do with mukbel	file_share	files	show <file_keyword> to do </file_keyword> <to_contact_name> mukbel </to_contact_name>
0	show kevin ' s dad funeral with see-hee	file_share	files	show <file_keyword> kevin ' s dad funeral </file_keyword> <to_contact_name> see-hee </to_contact_name>
0	show meet john and john ' s desk with irinez	file_share	files	show <file_keyword> meet john and john ' s desk </file_keyword> <to_contact_name> irinez </to_contact_name>
0	show last fm with koorenee	file_share	files	show <file_keyword> last fm </file_keyword> <to_contact_name> koorenee </to_contact_name>
0	show dancing lesson with onokuni	file_share	files	show <file_keyword> dancing lesson </file_keyword> <to_contact_name> onokuni </to_contact_name>
0	show parents saving with yonashiro	file_share	files	show <file_keyword> parents saving </file_keyword> <to_contact_name> yonashiro </to_contact_name>
0	show alberhasky eye clinic with ettingher	file_share	files	show <file_keyword> alberhasky eye clinic </file_keyword> <to_contact_name> ettingher </to_contact_name>
0	show run errands on lunch break with greenhagen	file_share	files	show <file_keyword> run errands on lunch break </file_keyword> <to_contact_name> greenhagen </to_contact_name>
0	show meet john and john ' s desk with ettingher	file_share	files	show <file_keyword> meet john and john ' s desk </file_keyword> <to_contact_name> ettingher </to_contact_name>
0	show school intranet session with kapelar	file_share	files	show <file_keyword> school intranet session </file_keyword> <to_contact_name> kapelar </to_contact_name>
0	show alberhasky eye clinic with tikko	file_share	files	show <file_keyword> alberhasky eye clinic </file_keyword> <to_contact_name> tikko </to_contact_name>
0	show parents saving with dejust	file_share	files	show <file_keyword> parents saving </file_keyword> <to_contact_name> dejust </to_contact_name>
0	show birthday party for sarah fay with ducz	file_share	files	show <file_keyword> birthday party for sarah fay </file_keyword> <to_contact_name> ducz </to_contact_name>
0	show how to eat with valecia	file_share	files	show <file_keyword> how to eat </file_keyword> <to_contact_name> valecia </to_contact_name>
0	show party map with rothchild	file_share	files	show <file_keyword> party map </file_keyword> <to_contact_name> rothchild </to_contact_name>
0	show dancing lesson with mitchell-smith	file_share	files	show <file_keyword> dancing lesson </file_keyword> <to_contact_name> mitchell-smith </to_contact_name>
0	show meet with people from moffitt cancer center with namier	file_share	files	show <file_keyword> meet with people from moffitt cancer center </file_keyword> <to_contact_name> namier </to_contact_name>
0	show install game for me with nusserwanjee	file_share	files	show <file_keyword> install game for me </file_keyword> <to_contact_name> nusserwanjee </to_contact_name>
0	show hotel visit with jobling	file_share	files	show <file_keyword> hotel visit </file_keyword> <to_contact_name> jobling </to_contact_name>
0	show watch godzilla with meslee	file_share	files	show <file_keyword> watch godzilla </file_keyword> <to_contact_name> meslee </to_contact_name>
0	show go shopping for coats in parramatta with altiner	file_share	files	show <file_keyword> go shopping for coats in parramatta </file_keyword> <to_contact_name> altiner </to_contact_name>
0	show bulls game with vidy	file_share	files	show <file_keyword> bulls game </file_keyword> <to_contact_name> vidy </to_contact_name>
0	show last fm with krasnokutsky	file_share	files	show <file_keyword> last fm </file_keyword> <to_contact_name> krasnokutsky </to_contact_name>
0	show send parts to kevin with koksteinova	file_share	files	show <file_keyword> send parts to kevin </file_keyword> <to_contact_name> koksteinova </to_contact_name>
0	show potty with fayman	file_share	files	show <file_keyword> potty </file_keyword> <to_contact_name> fayman </to_contact_name>
0	show water delivery with klusackova	file_share	files	show <file_keyword> water delivery </file_keyword> <to_contact_name> klusackova </to_contact_name>
0	show sports day for the girls with al-mutlaq	file_share	files	show <file_keyword> sports day for the girls </file_keyword> <to_contact_name> al-mutlaq </to_contact_name>
0	show watch the love story with greenhagen	file_share	files	show <file_keyword> watch the love story </file_keyword> <to_contact_name> greenhagen </to_contact_name>
0	show nights with baufreton	file_share	files	show <file_keyword> nights </file_keyword> <to_contact_name> baufreton </to_contact_name>
0	show four interviews with dilja	file_share	files	show <file_keyword> four interviews </file_keyword> <to_contact_name> dilja </to_contact_name>
0	show hilltop funeral home with baerug	file_share	files	show <file_keyword> hilltop funeral home </file_keyword> <to_contact_name> baerug </to_contact_name>
0	show eye testing with faczan	file_share	files	show <file_keyword> eye testing </file_keyword> <to_contact_name> faczan </to_contact_name>
0	show bookstore with kramis	file_share	files	show <file_keyword> bookstore </file_keyword> <to_contact_name> kramis </to_contact_name>
0	show corporate charity event with dumalanede	file_share	files	show <file_keyword> corporate charity event </file_keyword> <to_contact_name> dumalanede </to_contact_name>
0	show test on cortana with koltonovski	file_share	files	show <file_keyword> test on cortana </file_keyword> <to_contact_name> koltonovski </to_contact_name>
0	show see doctor kundi with altgenug	file_share	files	show <file_keyword> see doctor kundi </file_keyword> <to_contact_name> altgenug </to_contact_name>
0	show call face painting company with shillae	file_share	files	show <file_keyword> call face painting company </file_keyword> <to_contact_name> shillae </to_contact_name>
0	show josiah is birthday with yarrish	file_share	files	show <file_keyword> josiah is birthday </file_keyword> <to_contact_name> yarrish </to_contact_name>
0	show probation review meeting with zellar	file_share	files	show <file_keyword> probation review meeting </file_keyword> <to_contact_name> zellar </to_contact_name>
0	show cvs map with tikko	file_share	files	show <file_keyword> cvs map </file_keyword> <to_contact_name> tikko </to_contact_name>
0	show doctor leisha with merryman	file_share	files	show <file_keyword> doctor leisha </file_keyword> <to_contact_name> merryman </to_contact_name>
0	show work appointments with sakhir	file_share	files	show <file_keyword> work appointments </file_keyword> <to_contact_name> sakhir </to_contact_name>
0	show power wash with chrysopolitanus	file_share	files	show <file_keyword> power wash </file_keyword> <to_contact_name> chrysopolitanus </to_contact_name>
0	show dad with esterlado	file_share	files	show <file_keyword> dad </file_keyword> <to_contact_name> esterlado </to_contact_name>
0	show blah blah blah blah with klimm	file_share	files	show <file_keyword> blah blah blah blah </file_keyword> <to_contact_name> klimm </to_contact_name>
0	show blah blah blah blah with strijp	file_share	files	show <file_keyword> blah blah blah blah </file_keyword> <to_contact_name> strijp </to_contact_name>
0	show mammogram with klimm	file_share	files	show <file_keyword> mammogram </file_keyword> <to_contact_name> klimm </to_contact_name>
0	show farmers insurance with ettingher	file_share	files	show <file_keyword> farmers insurance </file_keyword> <to_contact_name> ettingher </to_contact_name>
0	show give charlie his medicine with baerug	file_share	files	show <file_keyword> give charlie his medicine </file_keyword> <to_contact_name> baerug </to_contact_name>
0	show hey tht appointment with klimm	file_share	files	show <file_keyword> hey tht appointment </file_keyword> <to_contact_name> klimm </to_contact_name>
0	show all tasks i made with muller-planitz	file_share	files	show <file_keyword> all tasks i made </file_keyword> <to_contact_name> muller-planitz </to_contact_name>
0	show auto service with iervolino	file_share	files	show <file_keyword> auto service </file_keyword> <to_contact_name> iervolino </to_contact_name>
0	show work appointments with krylova	file_share	files	show <file_keyword> work appointments </file_keyword> <to_contact_name> krylova </to_contact_name>
