0	Show watch godzilla with meslee	file_share	files	show <file_keyword> watch godzilla </file_keyword> <to_contact_name> meslee </to_contact_name>
0	Show go shopping for coats in parramatta with altiner	file_share	files	show <file_keyword> go shopping for coats in parramatta </file_keyword> <to_contact_name> altiner </to_contact_name>
0	Show bulls game with vidy	file_share	files	show <file_keyword> bulls game </file_keyword> <to_contact_name> vidy </to_contact_name>
0	Show last fm with krasnokutsky	file_share	files	show <file_keyword> last fm </file_keyword> <to_contact_name> krasnokutsky </to_contact_name>
0	Show send parts to kevin with koksteinova	file_share	files	show <file_keyword> send parts to kevin </file_keyword> <to_contact_name> koksteinova </to_contact_name>
0	Show potty with fayman	file_share	files	show <file_keyword> potty </file_keyword> <to_contact_name> fayman </to_contact_name>
0	Show water delivery with klusackova	file_share	files	show <file_keyword> water delivery </file_keyword> <to_contact_name> klusackova </to_contact_name>
0	Show sports day for the girls with al-mutlaq	file_share	files	show <file_keyword> sports day for the girls </file_keyword> <to_contact_name> al-mutlaq </to_contact_name>
0	Show watch the love story with greenhagen	file_share	files	show <file_keyword> watch the love story </file_keyword> <to_contact_name> greenhagen </to_contact_name>
0	Show nights with baufreton	file_share	files	show <file_keyword> nights </file_keyword> <to_contact_name> baufreton </to_contact_name>
0	Show four interviews with dilja	file_share	files	show <file_keyword> four interviews </file_keyword> <to_contact_name> dilja </to_contact_name>
0	Show hilltop funeral home with baerug	file_share	files	show <file_keyword> hilltop funeral home </file_keyword> <to_contact_name> baerug </to_contact_name>
0	Show eye testing with faczan	file_share	files	show <file_keyword> eye testing </file_keyword> <to_contact_name> faczan </to_contact_name>
0	Show bookstore with kramis	file_share	files	show <file_keyword> bookstore </file_keyword> <to_contact_name> kramis </to_contact_name>
0	Show corporate charity event with dumalanede	file_share	files	show <file_keyword> corporate charity event </file_keyword> <to_contact_name> dumalanede </to_contact_name>
0	Show test on cortana with koltonovski	file_share	files	show <file_keyword> test on cortana </file_keyword> <to_contact_name> koltonovski </to_contact_name>
0	Show see doctor kundi with altgenug	file_share	files	show <file_keyword> see doctor kundi </file_keyword> <to_contact_name> altgenug </to_contact_name>
0	Show call face painting company with shillae	file_share	files	show <file_keyword> call face painting company </file_keyword> <to_contact_name> shillae </to_contact_name>
0	Show josiah is birthday with yarrish	file_share	files	show <file_keyword> josiah is birthday </file_keyword> <to_contact_name> yarrish </to_contact_name>
0	Show probation review meeting with zellar	file_share	files	show <file_keyword> probation review meeting </file_keyword> <to_contact_name> zellar </to_contact_name>
0	Show cvs map with tikko	file_share	files	show <file_keyword> cvs map </file_keyword> <to_contact_name> tikko </to_contact_name>
0	Show doctor leisha with merryman	file_share	files	show <file_keyword> doctor leisha </file_keyword> <to_contact_name> merryman </to_contact_name>
0	Show work appointments with sakhir	file_share	files	show <file_keyword> work appointments </file_keyword> <to_contact_name> sakhir </to_contact_name>
0	Show power wash with chrysopolitanus	file_share	files	show <file_keyword> power wash </file_keyword> <to_contact_name> chrysopolitanus </to_contact_name>
0	Show dad with esterlado	file_share	files	show <file_keyword> dad </file_keyword> <to_contact_name> esterlado </to_contact_name>
0	Show blah blah blah blah with klimm	file_share	files	show <file_keyword> blah blah blah blah </file_keyword> <to_contact_name> klimm </to_contact_name>
0	Show blah blah blah blah with strijp	file_share	files	show <file_keyword> blah blah blah blah </file_keyword> <to_contact_name> strijp </to_contact_name>
0	Show mammogram with klimm	file_share	files	show <file_keyword> mammogram </file_keyword> <to_contact_name> klimm </to_contact_name>
0	Show farmers insurance with ettingher	file_share	files	show <file_keyword> farmers insurance </file_keyword> <to_contact_name> ettingher </to_contact_name>
0	Show give charlie his medicine with baerug	file_share	files	show <file_keyword> give charlie his medicine </file_keyword> <to_contact_name> baerug </to_contact_name>
0	Show hey tht appointment with klimm	file_share	files	show <file_keyword> hey tht appointment </file_keyword> <to_contact_name> klimm </to_contact_name>
0	Show all tasks i made with muller-planitz	file_share	files	show <file_keyword> all tasks i made </file_keyword> <to_contact_name> muller-planitz </to_contact_name>
0	Show auto service with iervolino	file_share	files	show <file_keyword> auto service </file_keyword> <to_contact_name> iervolino </to_contact_name>
0	Show work appointments with krylova	file_share	files	show <file_keyword> work appointments </file_keyword> <to_contact_name> krylova </to_contact_name>
0	Show driving licence due with zanat	file_share	files	show <file_keyword> driving licence due </file_keyword> <to_contact_name> zanat </to_contact_name>
0	Show band event with lais	file_share	files	show <file_keyword> band event </file_keyword> <to_contact_name> lais </to_contact_name>
0	Show meet with people from moffitt cancer center with dumalanede	file_share	files	show <file_keyword> meet with people from moffitt cancer center </file_keyword> <to_contact_name> dumalanede </to_contact_name>
0	Show to class with hangl	file_share	files	show <file_keyword> to class </file_keyword> <to_contact_name> hangl </to_contact_name>
0	Show jasper eye test with yonashiro	file_share	files	show <file_keyword> jasper eye test </file_keyword> <to_contact_name> yonashiro </to_contact_name>
0	Show hilltop funeral home with brunaeus	file_share	files	show <file_keyword> hilltop funeral home </file_keyword> <to_contact_name> brunaeus </to_contact_name>
0	Show mammogram with wiskowski	file_share	files	show <file_keyword> mammogram </file_keyword> <to_contact_name> wiskowski </to_contact_name>
0	Show water delivery with koorenee	file_share	files	show <file_keyword> water delivery </file_keyword> <to_contact_name> koorenee </to_contact_name>
0	Show potty with brisemiche	file_share	files	show <file_keyword> potty </file_keyword> <to_contact_name> brisemiche </to_contact_name>
0	Show soccer meeting jin jones kelly baker lynn notice with turback	file_share	files	show <file_keyword> soccer meeting jin jones kelly baker lynn notice </file_keyword> <to_contact_name> turback </to_contact_name>
0	Show annual cleaning with baerug	file_share	files	show <file_keyword> annual cleaning </file_keyword> <to_contact_name> baerug </to_contact_name>
0	Show soccer meeting jin jones kelly baker lynn notice with ekers	file_share	files	show <file_keyword> soccer meeting jin jones kelly baker lynn notice </file_keyword> <to_contact_name> ekers </to_contact_name>
0	Show bookstore with esterlado	file_share	files	show <file_keyword> bookstore </file_keyword> <to_contact_name> esterlado </to_contact_name>
0	Show but i get home with klusackova	file_share	files	show <file_keyword> but i get home </file_keyword> <to_contact_name> klusackova </to_contact_name>
0	Show six fifty five pm with pangnark	file_share	files	show <file_keyword> six fifty five pm </file_keyword> <to_contact_name> pangnark </to_contact_name>
0	Show nikolas ' haircut appointment with becedas	file_share	files	show <file_keyword> nikolas ' haircut appointment </file_keyword> <to_contact_name> becedas </to_contact_name>
0	Show visit charlie poulson in hospital with jurafsky	file_share	files	show <file_keyword> visit charlie poulson in hospital </file_keyword> <to_contact_name> jurafsky </to_contact_name>
0	Show going away party with djeneba	file_share	files	show <file_keyword> going away party </file_keyword> <to_contact_name> djeneba </to_contact_name>
0	Show meet my daughter ' s teacher with honinbo	file_share	files	show <file_keyword> meet my daughter ' s teacher </file_keyword> <to_contact_name> honinbo </to_contact_name>
0	Show song titles database with nieksen	file_share	files	show <file_keyword> song titles database </file_keyword> <to_contact_name> nieksen </to_contact_name>
0	Show water delivery with dilja	file_share	files	show <file_keyword> water delivery </file_keyword> <to_contact_name> dilja </to_contact_name>
0	Show appointment with rebecca with jurafsky	file_share	files	show <file_keyword> appointment with rebecca </file_keyword> <to_contact_name> jurafsky </to_contact_name>
0	Show sasha at play with krishtafovich	file_share	files	show <file_keyword> sasha at play </file_keyword> <to_contact_name> krishtafovich </to_contact_name>
0	Show saugatuck michigan with ivanjac	file_share	files	show <file_keyword> saugatuck michigan </file_keyword> <to_contact_name> ivanjac </to_contact_name>
0	Show x ray with owuor	file_share	files	show <file_keyword> x ray </file_keyword> <to_contact_name> owuor </to_contact_name>
0	Show fred's test with mikolaj	file_share	files	show <file_keyword> fred's test </file_keyword> <to_contact_name> mikolaj </to_contact_name>
0	Show potty with ekers	file_share	files	show <file_keyword> potty </file_keyword> <to_contact_name> ekers </to_contact_name>
0	Show creative leicestershire in a day with meslee	file_share	files	show <file_keyword> creative leicestershire in a day </file_keyword> <to_contact_name> meslee </to_contact_name>
0	Show trentons 15 month well baby check up with folatre	file_share	files	show <file_keyword> trentons 15 month well baby check up </file_keyword> <to_contact_name> folatre </to_contact_name>
0	Show call face painting company with cerchi	file_share	files	show <file_keyword> call face painting company </file_keyword> <to_contact_name> cerchi </to_contact_name>
0	Show bake potato with wiskowski	file_share	files	show <file_keyword> bake potato </file_keyword> <to_contact_name> wiskowski </to_contact_name>
0	Show playlist for the wedding with tikko	file_share	files	show <file_keyword> playlist for the wedding </file_keyword> <to_contact_name> tikko </to_contact_name>
0	Show this file with vacche	file_share	files	show <file_keyword> this </file_keyword> file with <to_contact_name> vacche </to_contact_name>
0	Show this file with turback	file_share	files	show <file_keyword> this </file_keyword> file with <to_contact_name> turback </to_contact_name>
0	Show this file with paumard	file_share	files	show <file_keyword> this </file_keyword> file with <to_contact_name> paumard </to_contact_name>
0	Show this file with spirka	file_share	files	show <file_keyword> this </file_keyword> file with <to_contact_name> spirka </to_contact_name>
0	Show this file with ekoji	file_share	files	show <file_keyword> this </file_keyword> file with <to_contact_name> ekoji </to_contact_name>
0	Show this file with bogdasa	file_share	files	show <file_keyword> this </file_keyword> file with <to_contact_name> bogdasa </to_contact_name>
0	Show this file with landsbygdens	file_share	files	show <file_keyword> this </file_keyword> file with <to_contact_name> landsbygdens </to_contact_name>
0	Show this file with tallach	file_share	files	show <file_keyword> this </file_keyword> file with <to_contact_name> tallach </to_contact_name>
0	Show this file with schloezer	file_share	files	show <file_keyword> this </file_keyword> file with <to_contact_name> schloezer </to_contact_name>
0	Show this file with faganello	file_share	files	show <file_keyword> this </file_keyword> file with <to_contact_name> faganello </to_contact_name>
0	Show this file with clennyson	file_share	files	show <file_keyword> this </file_keyword> file with <to_contact_name> clennyson </to_contact_name>
0	Show this file with yonashiro	file_share	files	show <file_keyword> this </file_keyword> file with <to_contact_name> yonashiro </to_contact_name>
0	Show this file with koksteinova	file_share	files	show <file_keyword> this </file_keyword> file with <to_contact_name> koksteinova </to_contact_name>
0	Show this file with schloezer	file_share	files	show <file_keyword> this </file_keyword> file with <to_contact_name> schloezer </to_contact_name>
0	Show this file with palsberg	file_share	files	show <file_keyword> this </file_keyword> file with <to_contact_name> palsberg </to_contact_name>
0	Show this file with klimm	file_share	files	show <file_keyword> this </file_keyword> file with <to_contact_name> klimm </to_contact_name>
0	Show this file with chiappalone	file_share	files	show <file_keyword> this </file_keyword> file with <to_contact_name> chiappalone </to_contact_name>
0	Show this file with morreel	file_share	files	show <file_keyword> this </file_keyword> file with <to_contact_name> morreel </to_contact_name>
0	Show this file with zena	file_share	files	show <file_keyword> this </file_keyword> file with <to_contact_name> zena </to_contact_name>
0	Show this file with altiokaian	file_share	files	show <file_keyword> this </file_keyword> file with <to_contact_name> altiokaian </to_contact_name>
0	Show this file with hargsten	file_share	files	show <file_keyword> this </file_keyword> file with <to_contact_name> hargsten </to_contact_name>
0	Show this file with mitchell-smith	file_share	files	show <file_keyword> this </file_keyword> file with <to_contact_name> mitchell-smith </to_contact_name>
0	Show this file with faczan	file_share	files	show <file_keyword> this </file_keyword> file with <to_contact_name> faczan </to_contact_name>
0	Show this file with ducz	file_share	files	show <file_keyword> this </file_keyword> file with <to_contact_name> ducz </to_contact_name>
0	Show this file with hangl	file_share	files	show <file_keyword> this </file_keyword> file with <to_contact_name> hangl </to_contact_name>
0	Show this file with buyck	file_share	files	show <file_keyword> this </file_keyword> file with <to_contact_name> buyck </to_contact_name>
0	Show this file with mathías	file_share	files	show <file_keyword> this </file_keyword> file with <to_contact_name> mathías </to_contact_name>
0	Show this file with chiappalone	file_share	files	show <file_keyword> this </file_keyword> file with <to_contact_name> chiappalone </to_contact_name>
0	Show this file with dilja	file_share	files	show <file_keyword> this </file_keyword> file with <to_contact_name> dilja </to_contact_name>
0	Show this file with kamiurushi	file_share	files	show <file_keyword> this </file_keyword> file with <to_contact_name> kamiurushi </to_contact_name>
0	Show this file with iervolino	file_share	files	show <file_keyword> this </file_keyword> file with <to_contact_name> iervolino </to_contact_name>
0	Show this file with arkhangel?ski?	file_share	files	show <file_keyword> this </file_keyword> file with <to_contact_name> arkhangel?ski? </to_contact_name>
0	Show this file with perers	file_share	files	show <file_keyword> this </file_keyword> file with <to_contact_name> perers </to_contact_name>
0	Show this file with kalitayev	file_share	files	show <file_keyword> this </file_keyword> file with <to_contact_name> kalitayev </to_contact_name>
0	Show this file with kalegi	file_share	files	show <file_keyword> this </file_keyword> file with <to_contact_name> kalegi </to_contact_name>
0	Show this file with fayman	file_share	files	show <file_keyword> this </file_keyword> file with <to_contact_name> fayman </to_contact_name>
0	Show this file with owuor	file_share	files	show <file_keyword> this </file_keyword> file with <to_contact_name> owuor </to_contact_name>
0	Show this file with kamiurushi	file_share	files	show <file_keyword> this </file_keyword> file with <to_contact_name> kamiurushi </to_contact_name>
0	Show this file with meslee	file_share	files	show <file_keyword> this </file_keyword> file with <to_contact_name> meslee </to_contact_name>
0	Show this file with castus	file_share	files	show <file_keyword> this </file_keyword> file with <to_contact_name> castus </to_contact_name>
0	Show this file with koorenee	file_share	files	show <file_keyword> this </file_keyword> file with <to_contact_name> koorenee </to_contact_name>
0	Show this file with kandis	file_share	files	show <file_keyword> this </file_keyword> file with <to_contact_name> kandis </to_contact_name>
0	Show this file with unneback	file_share	files	show <file_keyword> this </file_keyword> file with <to_contact_name> unneback </to_contact_name>
0	Show this file with svens	file_share	files	show <file_keyword> this </file_keyword> file with <to_contact_name> svens </to_contact_name>
0	Show this file with vidy	file_share	files	show <file_keyword> this </file_keyword> file with <to_contact_name> vidy </to_contact_name>
0	Show this file with cardis	file_share	files	show <file_keyword> this </file_keyword> file with <to_contact_name> cardis </to_contact_name>
0	Show this file with swinea	file_share	files	show <file_keyword> this </file_keyword> file with <to_contact_name> swinea </to_contact_name>
0	Show this file with kantermo	file_share	files	show <file_keyword> this </file_keyword> file with <to_contact_name> kantermo </to_contact_name>
0	Show this file with yarrish	file_share	files	show <file_keyword> this </file_keyword> file with <to_contact_name> yarrish </to_contact_name>
0	Show this file with ekers	file_share	files	show <file_keyword> this </file_keyword> file with <to_contact_name> ekers </to_contact_name>
0	Show this file with kantermo	file_share	files	show <file_keyword> this </file_keyword> file with <to_contact_name> kantermo </to_contact_name>
0	Show this file with baerug	file_share	files	show <file_keyword> this </file_keyword> file with <to_contact_name> baerug </to_contact_name>
0	Show this file with strijp	file_share	files	show <file_keyword> this </file_keyword> file with <to_contact_name> strijp </to_contact_name>
0	Show this file with kandis	file_share	files	show <file_keyword> this </file_keyword> file with <to_contact_name> kandis </to_contact_name>
0	Show this file with becedas	file_share	files	show <file_keyword> this </file_keyword> file with <to_contact_name> becedas </to_contact_name>
0	Show this file with turback	file_share	files	show <file_keyword> this </file_keyword> file with <to_contact_name> turback </to_contact_name>
0	Show this file with wiskowski	file_share	files	show <file_keyword> this </file_keyword> file with <to_contact_name> wiskowski </to_contact_name>
0	Show this file with see-hee	file_share	files	show <file_keyword> this </file_keyword> file with <to_contact_name> see-hee </to_contact_name>
0	Show this file with lemi?	file_share	files	show <file_keyword> this </file_keyword> file with <to_contact_name> lemi? </to_contact_name>
0	Show this file with marie-philippe	file_share	files	show <file_keyword> this </file_keyword> file with <to_contact_name> marie-philippe </to_contact_name>
0	Show this file with ekoji	file_share	files	show <file_keyword> this </file_keyword> file with <to_contact_name> ekoji </to_contact_name>
0	Show this file with schloezer	file_share	files	show <file_keyword> this </file_keyword> file with <to_contact_name> schloezer </to_contact_name>
0	Show this file with altiokaian	file_share	files	show <file_keyword> this </file_keyword> file with <to_contact_name> altiokaian </to_contact_name>
0	Show this file with udescu	file_share	files	show <file_keyword> this </file_keyword> file with <to_contact_name> udescu </to_contact_name>
0	Show this file with supaksorn	file_share	files	show <file_keyword> this </file_keyword> file with <to_contact_name> supaksorn </to_contact_name>
0	Show this file with strijp	file_share	files	show <file_keyword> this </file_keyword> file with <to_contact_name> strijp </to_contact_name>
0	Show this file with nusserwanjee	file_share	files	show <file_keyword> this </file_keyword> file with <to_contact_name> nusserwanjee </to_contact_name>
0	Show this file with glazebrook	file_share	files	show <file_keyword> this </file_keyword> file with <to_contact_name> glazebrook </to_contact_name>
0	Show this file with adrians	file_share	files	show <file_keyword> this </file_keyword> file with <to_contact_name> adrians </to_contact_name>
0	Show this file with tamantini	file_share	files	show <file_keyword> this </file_keyword> file with <to_contact_name> tamantini </to_contact_name>
0	Show this file with sulaym	file_share	files	show <file_keyword> this </file_keyword> file with <to_contact_name> sulaym </to_contact_name>
0	Show this file with kang	file_share	files	show <file_keyword> this </file_keyword> file with <to_contact_name> kang </to_contact_name>
0	Show this file with yonashiro	file_share	files	show <file_keyword> this </file_keyword> file with <to_contact_name> yonashiro </to_contact_name>
0	Show this file with brunaeus	file_share	files	show <file_keyword> this </file_keyword> file with <to_contact_name> brunaeus </to_contact_name>
0	Show this file with zellar	file_share	files	show <file_keyword> this </file_keyword> file with <to_contact_name> zellar </to_contact_name>
0	Show this file with krishtafovich	file_share	files	show <file_keyword> this </file_keyword> file with <to_contact_name> krishtafovich </to_contact_name>
0	Show this file with ursescu	file_share	files	show <file_keyword> this </file_keyword> file with <to_contact_name> ursescu </to_contact_name>
0	Show this file with morreel	file_share	files	show <file_keyword> this </file_keyword> file with <to_contact_name> morreel </to_contact_name>
0	Show this file with gurrad	file_share	files	show <file_keyword> this </file_keyword> file with <to_contact_name> gurrad </to_contact_name>
0	Show this file with stuewer	file_share	files	show <file_keyword> this </file_keyword> file with <to_contact_name> stuewer </to_contact_name>
0	Show this file with athaldo	file_share	files	show <file_keyword> this </file_keyword> file with <to_contact_name> athaldo </to_contact_name>
0	Show this file with ekers	file_share	files	show <file_keyword> this </file_keyword> file with <to_contact_name> ekers </to_contact_name>
0	Show this file with dorgebray	file_share	files	show <file_keyword> this </file_keyword> file with <to_contact_name> dorgebray </to_contact_name>
0	Show this file with shillae	file_share	files	show <file_keyword> this </file_keyword> file with <to_contact_name> shillae </to_contact_name>
0	Show this file with daninthe	file_share	files	show <file_keyword> this </file_keyword> file with <to_contact_name> daninthe </to_contact_name>
0	Show this file with shillae	file_share	files	show <file_keyword> this </file_keyword> file with <to_contact_name> shillae </to_contact_name>
0	Show this file with altiner	file_share	files	show <file_keyword> this </file_keyword> file with <to_contact_name> altiner </to_contact_name>
0	Show this file with mathías	file_share	files	show <file_keyword> this </file_keyword> file with <to_contact_name> mathías </to_contact_name>
0	Show this file with shlosser	file_share	files	show <file_keyword> this </file_keyword> file with <to_contact_name> shlosser </to_contact_name>
0	Show this file with p-orridge	file_share	files	show <file_keyword> this </file_keyword> file with <to_contact_name> p-orridge </to_contact_name>
0	Show this file with paumard	file_share	files	show <file_keyword> this </file_keyword> file with <to_contact_name> paumard </to_contact_name>
0	Show this file with udescu	file_share	files	show <file_keyword> this </file_keyword> file with <to_contact_name> udescu </to_contact_name>
0	Show this file with greenhagen	file_share	files	show <file_keyword> this </file_keyword> file with <to_contact_name> greenhagen </to_contact_name>
0	Show this file with lais	file_share	files	show <file_keyword> this </file_keyword> file with <to_contact_name> lais </to_contact_name>
0	Show this file with tokoname	file_share	files	show <file_keyword> this </file_keyword> file with <to_contact_name> tokoname </to_contact_name>
0	Show this file with elsebeth	file_share	files	show <file_keyword> this </file_keyword> file with <to_contact_name> elsebeth </to_contact_name>
0	Show this file with babstock	file_share	files	show <file_keyword> this </file_keyword> file with <to_contact_name> babstock </to_contact_name>
0	Show this file with clennyson	file_share	files	show <file_keyword> this </file_keyword> file with <to_contact_name> clennyson </to_contact_name>
0	Show this file with sikai	file_share	files	show <file_keyword> this </file_keyword> file with <to_contact_name> sikai </to_contact_name>
0	Show this file with krylova	file_share	files	show <file_keyword> this </file_keyword> file with <to_contact_name> krylova </to_contact_name>
0	Show this file with bousserez	file_share	files	show <file_keyword> this </file_keyword> file with <to_contact_name> bousserez </to_contact_name>
0	Show this file with devoge	file_share	files	show <file_keyword> this </file_keyword> file with <to_contact_name> devoge </to_contact_name>
0	Show this file with villita	file_share	files	show <file_keyword> this </file_keyword> file with <to_contact_name> villita </to_contact_name>
0	Show this file with pounde	file_share	files	show <file_keyword> this </file_keyword> file with <to_contact_name> pounde </to_contact_name>
0	Show this file with meslee	file_share	files	show <file_keyword> this </file_keyword> file with <to_contact_name> meslee </to_contact_name>
0	Show this file with yosomatsu	file_share	files	show <file_keyword> this </file_keyword> file with <to_contact_name> yosomatsu </to_contact_name>
0	Show this file with zellar	file_share	files	show <file_keyword> this </file_keyword> file with <to_contact_name> zellar </to_contact_name>
