0	send papapantoleon the barrens report manuscript file	file_share	files	send <to_contact_name> papapantoleon </to_contact_name> the <file_keyword> barrens report manuscript </file_keyword> file
0	send dautrix the marketing meet file	file_share	files	send <to_contact_name> dautrix </to_contact_name> the <file_keyword> marketing meet </file_keyword> file
0	send blackhawk the gsc meeting file	file_share	files	send <to_contact_name> blackhawk </to_contact_name> the <file_keyword> gsc meeting </file_keyword> file
0	send lunnes the warehouse meeting with dan and marketing file	file_share	files	send <to_contact_name> lunnes </to_contact_name> the <file_keyword> warehouse meeting with dan and marketing </file_keyword> file
0	send awono the appointment with the pet stylist file	file_share	files	send <to_contact_name> awono </to_contact_name> the <file_keyword> appointment with the pet stylist </file_keyword> file
0	send kimiyoshi the cassie ' s birthday file	file_share	files	send <to_contact_name> kimiyoshi </to_contact_name> the <file_keyword> cassie ' s birthday </file_keyword> file
0	send evlakhov the meeting for getting things done file	file_share	files	send <to_contact_name> evlakhov </to_contact_name> the <file_keyword> meeting for getting things done </file_keyword> file
0	send deagan the pedro ' s birthday file	file_share	files	send <to_contact_name> deagan </to_contact_name> the <file_keyword> pedro ' s birthday </file_keyword> file
0	send matyssek the dance on the twelfth file	file_share	files	send <to_contact_name> matyssek </to_contact_name> the <file_keyword> dance on the twelfth </file_keyword> file
0	send évanturel the sunday church service file	file_share	files	send <to_contact_name> évanturel </to_contact_name> the <file_keyword> sunday church service </file_keyword> file
0	send lagorce the basketball camp file	file_share	files	send <to_contact_name> lagorce </to_contact_name> the <file_keyword> basketball camp </file_keyword> file
0	send umra the doctor at interstate south file	file_share	files	send <to_contact_name> umra </to_contact_name> the <file_keyword> doctor at interstate south </file_keyword> file
0	send fastbom the manh.txt file	file_share	files	send <to_contact_name> fastbom </to_contact_name> the <file_keyword> manh.txt </file_keyword> file
0	send punkka the square meeting file	file_share	files	send <to_contact_name> punkka </to_contact_name> the <file_keyword> square meeting </file_keyword> file
0	send yoshieda the market meet file	file_share	files	send <to_contact_name> yoshieda </to_contact_name> the <file_keyword> market meet </file_keyword> file
0	send geusen the battersea food fest file	file_share	files	send <to_contact_name> geusen </to_contact_name> the <file_keyword> battersea food fest </file_keyword> file
0	send sharri the veterinarian file	file_share	files	send <to_contact_name> sharri </to_contact_name> the <file_keyword> veterinarian </file_keyword> file
0	send dong-hee the meeting for getting things done file	file_share	files	send <to_contact_name> dong-hee </to_contact_name> the <file_keyword> meeting for getting things done </file_keyword> file
0	send faske the appointment seattle children ' s file	file_share	files	send <to_contact_name> faske </to_contact_name> the <file_keyword> appointment seattle children ' s </file_keyword> file
0	send ya-ming the reminder file	file_share	files	send <to_contact_name> ya-ming </to_contact_name> the <file_keyword> reminder </file_keyword> file
0	send yoshieda the at the park file	file_share	files	send <to_contact_name> yoshieda </to_contact_name> the <file_keyword> at the park </file_keyword> file
0	send brekveld the purchase new car file	file_share	files	send <to_contact_name> brekveld </to_contact_name> the <file_keyword> purchase new car </file_keyword> file
0	send mannesman the football match file	file_share	files	send <to_contact_name> mannesman </to_contact_name> the <file_keyword> football match </file_keyword> file
0	send aigrain the dance on the twelfth file	file_share	files	send <to_contact_name> aigrain </to_contact_name> the <file_keyword> dance on the twelfth </file_keyword> file
0	send occleve the sales rep file	file_share	files	send <to_contact_name> occleve </to_contact_name> the <file_keyword> sales rep </file_keyword> file
0	send deshurand the spa day with alternate file	file_share	files	send <to_contact_name> deshurand </to_contact_name> the <file_keyword> spa day with alternate </file_keyword> file
0	send bokanovich the luke skywalker convention file	file_share	files	send <to_contact_name> bokanovich </to_contact_name> the <file_keyword> luke skywalker convention </file_keyword> file
0	send hnizdilova the sewing projects file	file_share	files	send <to_contact_name> hnizdilova </to_contact_name> the <file_keyword> sewing projects </file_keyword> file
0	send worchester the square meeting file	file_share	files	send <to_contact_name> worchester </to_contact_name> the <file_keyword> square meeting </file_keyword> file
0	send matyssek the arthur ' s birthday file	file_share	files	send <to_contact_name> matyssek </to_contact_name> the <file_keyword> arthur ' s birthday </file_keyword> file
0	send eggelton the claims_processing file	file_share	files	send <to_contact_name> eggelton </to_contact_name> the <file_keyword> claims_processing </file_keyword> file
0	send lebraud the pcp group interview file	file_share	files	send <to_contact_name> lebraud </to_contact_name> the <file_keyword> pcp group interview </file_keyword> file
0	send himawan the basketball camp file	file_share	files	send <to_contact_name> himawan </to_contact_name> the <file_keyword> basketball camp </file_keyword> file
0	send ochiba the alberta health services appt file	file_share	files	send <to_contact_name> ochiba </to_contact_name> the <file_keyword> alberta health services appt </file_keyword> file
0	send schama the buy kaylie ice cream file	file_share	files	send <to_contact_name> schama </to_contact_name> the <file_keyword> buy kaylie ice cream </file_keyword> file
0	send ristani the violin and cora concert file	file_share	files	send <to_contact_name> ristani </to_contact_name> the <file_keyword> violin and cora concert </file_keyword> file
0	send terselius the springdale job file	file_share	files	send <to_contact_name> terselius </to_contact_name> the <file_keyword> springdale job </file_keyword> file
0	send gardawski the appointment seattle children ' s file	file_share	files	send <to_contact_name> gardawski </to_contact_name> the <file_keyword> appointment seattle children ' s </file_keyword> file
0	send kinonagusa the food drive file	file_share	files	send <to_contact_name> kinonagusa </to_contact_name> the <file_keyword> food drive </file_keyword> file
0	send awono the call doctors to diary file	file_share	files	send <to_contact_name> awono </to_contact_name> the <file_keyword> call doctors to diary </file_keyword> file
0	send obokata the income tax file	file_share	files	send <to_contact_name> obokata </to_contact_name> the <file_keyword> income tax </file_keyword> file
0	send seiba the pedro ' s birthday file	file_share	files	send <to_contact_name> seiba </to_contact_name> the <file_keyword> pedro ' s birthday </file_keyword> file
0	send buccolini the figure out alfred for funeral file	file_share	files	send <to_contact_name> buccolini </to_contact_name> the <file_keyword> figure out alfred for funeral </file_keyword> file
0	send leovic the work one file	file_share	files	send <to_contact_name> leovic </to_contact_name> the <file_keyword> work one </file_keyword> file
0	send gredsted the soccer game won file	file_share	files	send <to_contact_name> gredsted </to_contact_name> the <file_keyword> soccer game won </file_keyword> file
0	send bazeries the packing list for my trip to italy file	file_share	files	send <to_contact_name> bazeries </to_contact_name> the <file_keyword> packing list for my trip to italy </file_keyword> file
0	send madziarczyk the trip to michigan file	file_share	files	send <to_contact_name> madziarczyk </to_contact_name> the <file_keyword> trip to michigan </file_keyword> file
0	send chastaine the cradle of filth ' s concert file	file_share	files	send <to_contact_name> chastaine </to_contact_name> the <file_keyword> cradle of filth ' s concert </file_keyword> file
0	send madziarczyk the figure out alfred for funeral file	file_share	files	send <to_contact_name> madziarczyk </to_contact_name> the <file_keyword> figure out alfred for funeral </file_keyword> file
0	send eggelton the insulin appoinement file	file_share	files	send <to_contact_name> eggelton </to_contact_name> the <file_keyword> insulin appoinement </file_keyword> file
0	send ebens the trip to michigan file	file_share	files	send <to_contact_name> ebens </to_contact_name> the <file_keyword> trip to michigan </file_keyword> file
0	send chatziantoniou the packing list for my trip to italy file	file_share	files	send <to_contact_name> chatziantoniou </to_contact_name> the <file_keyword> packing list for my trip to italy </file_keyword> file
0	send thozama the michener museum file	file_share	files	send <to_contact_name> thozama </to_contact_name> the <file_keyword> michener museum </file_keyword> file
0	send ssebaana the matilda file	file_share	files	send <to_contact_name> ssebaana </to_contact_name> the <file_keyword> matilda </file_keyword> file
0	send umayya the have a shower? file	file_share	files	send <to_contact_name> umayya </to_contact_name> the <file_keyword> have a shower? </file_keyword> file
0	send darbefeuille the soccer game won file	file_share	files	send <to_contact_name> darbefeuille </to_contact_name> the <file_keyword> soccer game won </file_keyword> file
0	send gerstein-mccollum the springdale job file	file_share	files	send <to_contact_name> gerstein-mccollum </to_contact_name> the <file_keyword> springdale job </file_keyword> file
0	send arshari the firefighters parade file	file_share	files	send <to_contact_name> arshari </to_contact_name> the <file_keyword> firefighters parade </file_keyword> file
0	send kilicli the doctor lavani file	file_share	files	send <to_contact_name> kilicli </to_contact_name> the <file_keyword> doctor lavani </file_keyword> file
0	send hammerton the dinner with julie file	file_share	files	send <to_contact_name> hammerton </to_contact_name> the <file_keyword> dinner with julie </file_keyword> file
0	send bokanovich the phone call appointment file	file_share	files	send <to_contact_name> bokanovich </to_contact_name> the <file_keyword> phone call appointment </file_keyword> file
0	send siehndel the aldi file	file_share	files	send <to_contact_name> siehndel </to_contact_name> the <file_keyword> aldi </file_keyword> file
0	send lintyner the work one file	file_share	files	send <to_contact_name> lintyner </to_contact_name> the <file_keyword> work one </file_keyword> file
0	send mizior the kick off file	file_share	files	send <to_contact_name> mizior </to_contact_name> the <file_keyword> kick off </file_keyword> file
0	send rebillard the meet rick baker on job site file	file_share	files	send <to_contact_name> rebillard </to_contact_name> the <file_keyword> meet rick baker on job site </file_keyword> file
0	send umra the stabbing file	file_share	files	send <to_contact_name> umra </to_contact_name> the <file_keyword> stabbing </file_keyword> file
0	send helgren the office mgr meet file	file_share	files	send <to_contact_name> helgren </to_contact_name> the <file_keyword> office mgr meet </file_keyword> file
0	send chastaine the mike ' s barbeque file	file_share	files	send <to_contact_name> chastaine </to_contact_name> the <file_keyword> mike ' s barbeque </file_keyword> file
0	send glebin the kristine lunch file	file_share	files	send <to_contact_name> glebin </to_contact_name> the <file_keyword> kristine lunch </file_keyword> file
0	send albera the buy kaylie ice cream file	file_share	files	send <to_contact_name> albera </to_contact_name> the <file_keyword> buy kaylie ice cream </file_keyword> file
0	send yoshieda the upcoming basketball game file	file_share	files	send <to_contact_name> yoshieda </to_contact_name> the <file_keyword> upcoming basketball game </file_keyword> file
0	send taher the pay credit card thirteen eighty file	file_share	files	send <to_contact_name> taher </to_contact_name> the <file_keyword> pay credit card thirteen eighty </file_keyword> file
0	send sahlan the dye file	file_share	files	send <to_contact_name> sahlan </to_contact_name> the <file_keyword> dye </file_keyword> file
0	send schliesman the dr visit file	file_share	files	send <to_contact_name> schliesman </to_contact_name> the <file_keyword> dr visit </file_keyword> file
0	send bogunov the d m v file	file_share	files	send <to_contact_name> bogunov </to_contact_name> the <file_keyword> d m v </file_keyword> file
0	send worchester the shower prep file	file_share	files	send <to_contact_name> worchester </to_contact_name> the <file_keyword> shower prep </file_keyword> file
0	send natalucci the veterinary appointment file	file_share	files	send <to_contact_name> natalucci </to_contact_name> the <file_keyword> veterinary appointment </file_keyword> file
0	send ya-ming the power users manual file	file_share	files	send <to_contact_name> ya-ming </to_contact_name> the <file_keyword> power users manual </file_keyword> file
0	send kleeberg the study file	file_share	files	send <to_contact_name> kleeberg </to_contact_name> the <file_keyword> study </file_keyword> file
0	send ebens the appointment with the pet stylist file	file_share	files	send <to_contact_name> ebens </to_contact_name> the <file_keyword> appointment with the pet stylist </file_keyword> file
0	send swartwout the test this app file	file_share	files	send <to_contact_name> swartwout </to_contact_name> the <file_keyword> test this app </file_keyword> file
0	send blackhawk the aggie football file	file_share	files	send <to_contact_name> blackhawk </to_contact_name> the <file_keyword> aggie football </file_keyword> file
0	send geusen the is amy's scan file	file_share	files	send <to_contact_name> geusen </to_contact_name> the <file_keyword> is amy's scan </file_keyword> file
0	send sgarabotto the violin and cora concert file	file_share	files	send <to_contact_name> sgarabotto </to_contact_name> the <file_keyword> violin and cora concert </file_keyword> file
0	send vukojicic the crew train trip file	file_share	files	send <to_contact_name> vukojicic </to_contact_name> the <file_keyword> crew train trip </file_keyword> file
0	send votankova the crew train trip file	file_share	files	send <to_contact_name> votankova </to_contact_name> the <file_keyword> crew train trip </file_keyword> file
0	send vukojicic the end of regular file	file_share	files	send <to_contact_name> vukojicic </to_contact_name> the <file_keyword> end of regular </file_keyword> file
0	send madziarczyk the sewing projects file	file_share	files	send <to_contact_name> madziarczyk </to_contact_name> the <file_keyword> sewing projects </file_keyword> file
0	send yoshieda the lesson file	file_share	files	send <to_contact_name> yoshieda </to_contact_name> the <file_keyword> lesson </file_keyword> file
0	send vukojicic the weekly grocery file	file_share	files	send <to_contact_name> vukojicic </to_contact_name> the <file_keyword> weekly grocery </file_keyword> file
0	send viherkentta the weekly coffee date file	file_share	files	send <to_contact_name> viherkentta </to_contact_name> the <file_keyword> weekly coffee date </file_keyword> file
0	send keith-lee the sticky file	file_share	files	send <to_contact_name> keith-lee </to_contact_name> the <file_keyword> sticky </file_keyword> file
0	send bardoureau the aggie football file	file_share	files	send <to_contact_name> bardoureau </to_contact_name> the <file_keyword> aggie football </file_keyword> file
0	send puybertier the laila harbor ' s birthday file	file_share	files	send <to_contact_name> puybertier </to_contact_name> the <file_keyword> laila harbor ' s birthday </file_keyword> file
0	send sanehide the appointment seattle children ' s file	file_share	files	send <to_contact_name> sanehide </to_contact_name> the <file_keyword> appointment seattle children ' s </file_keyword> file
0	send schliesman the springdale job file	file_share	files	send <to_contact_name> schliesman </to_contact_name> the <file_keyword> springdale job </file_keyword> file
0	send adelugba the alberta health services appt file	file_share	files	send <to_contact_name> adelugba </to_contact_name> the <file_keyword> alberta health services appt </file_keyword> file
0	send bazeries the pcp group interview file	file_share	files	send <to_contact_name> bazeries </to_contact_name> the <file_keyword> pcp group interview </file_keyword> file
0	send gaty the upcoming basketball game file	file_share	files	send <to_contact_name> gaty </to_contact_name> the <file_keyword> upcoming basketball game </file_keyword> file
0	send essl the end of regular file	file_share	files	send <to_contact_name> essl </to_contact_name> the <file_keyword> end of regular </file_keyword> file
0	send leovic the stabbing file	file_share	files	send <to_contact_name> leovic </to_contact_name> the <file_keyword> stabbing </file_keyword> file
0	send dahod the meet rick baker on job site file	file_share	files	send <to_contact_name> dahod </to_contact_name> the <file_keyword> meet rick baker on job site </file_keyword> file
0	send praitano the technician will fix my washer file	file_share	files	send <to_contact_name> praitano </to_contact_name> the <file_keyword> technician will fix my washer </file_keyword> file
0	send yoshieda the precious kings sickle cell file	file_share	files	send <to_contact_name> yoshieda </to_contact_name> the <file_keyword> precious kings sickle cell </file_keyword> file
0	send benoite the technician will fix my washer file	file_share	files	send <to_contact_name> benoite </to_contact_name> the <file_keyword> technician will fix my washer </file_keyword> file
0	send sgarabotto the dye file	file_share	files	send <to_contact_name> sgarabotto </to_contact_name> the <file_keyword> dye </file_keyword> file
0	send umra the teeth cleaned file	file_share	files	send <to_contact_name> umra </to_contact_name> the <file_keyword> teeth cleaned </file_keyword> file
0	send evlakhov the oxford file	file_share	files	send <to_contact_name> evlakhov </to_contact_name> the <file_keyword> oxford </file_keyword> file
0	send bissen the khaki curry file	file_share	files	send <to_contact_name> bissen </to_contact_name> the <file_keyword> khaki curry </file_keyword> file
0	send mijea the libray convention file	file_share	files	send <to_contact_name> mijea </to_contact_name> the <file_keyword> libray convention </file_keyword> file
0	send kinonagusa the ronnie ' s birthday party file	file_share	files	send <to_contact_name> kinonagusa </to_contact_name> the <file_keyword> ronnie ' s birthday party </file_keyword> file
0	send glandion the carla ' s birthday file	file_share	files	send <to_contact_name> glandion </to_contact_name> the <file_keyword> carla ' s birthday </file_keyword> file
0	send aigrain the brush kids teeth file	file_share	files	send <to_contact_name> aigrain </to_contact_name> the <file_keyword> brush kids teeth </file_keyword> file
0	send albera the stabbing file	file_share	files	send <to_contact_name> albera </to_contact_name> the <file_keyword> stabbing </file_keyword> file
0	send mijea the meeting at the church file	file_share	files	send <to_contact_name> mijea </to_contact_name> the <file_keyword> meeting at the church </file_keyword> file
0	send raugul the moo moo cow file	file_share	files	send <to_contact_name> raugul </to_contact_name> the <file_keyword> moo moo cow </file_keyword> file
0	send sakisio the school project file	file_share	files	send <to_contact_name> sakisio </to_contact_name> the <file_keyword> school project </file_keyword> file
0	send gardner-gausten the piano class file	file_share	files	send <to_contact_name> gardner-gausten </to_contact_name> the <file_keyword> piano class </file_keyword> file
0	send gauderiot the spa day with alternate file	file_share	files	send <to_contact_name> gauderiot </to_contact_name> the <file_keyword> spa day with alternate </file_keyword> file
0	send benoite the meet rick baker on job site file	file_share	files	send <to_contact_name> benoite </to_contact_name> the <file_keyword> meet rick baker on job site </file_keyword> file
0	send hammerton the basketball camp file	file_share	files	send <to_contact_name> hammerton </to_contact_name> the <file_keyword> basketball camp </file_keyword> file
0	send bibhuti the annual leave cancelled file	file_share	files	send <to_contact_name> bibhuti </to_contact_name> the <file_keyword> annual leave cancelled </file_keyword> file
0	send deverly the veterinary appointment file	file_share	files	send <to_contact_name> deverly </to_contact_name> the <file_keyword> veterinary appointment </file_keyword> file
0	send essl the market meet file	file_share	files	send <to_contact_name> essl </to_contact_name> the <file_keyword> market meet </file_keyword> file
0	send ebens the florida trip file	file_share	files	send <to_contact_name> ebens </to_contact_name> the <file_keyword> florida trip </file_keyword> file
0	share belcev the band event file	file_share	files	share <to_contact_name> belcev </to_contact_name> the <file_keyword> band event </file_keyword> file
0	share chawa the i birthday file	file_share	files	share <to_contact_name> chawa </to_contact_name> the <file_keyword> i birthday </file_keyword> file
0	share lunnes the dinner with julie file	file_share	files	share <to_contact_name> lunnes </to_contact_name> the <file_keyword> dinner with julie </file_keyword> file
0	share lemartin the birthday dugdale dave file	file_share	files	share <to_contact_name> lemartin </to_contact_name> the <file_keyword> birthday dugdale dave </file_keyword> file
0	share shirotani the meeting joe file	file_share	files	share <to_contact_name> shirotani </to_contact_name> the <file_keyword> meeting joe </file_keyword> file
0	share ke-ik the david times file	file_share	files	share <to_contact_name> ke-ik </to_contact_name> the <file_keyword> david times </file_keyword> file
0	share mizior the phone call appointment file	file_share	files	share <to_contact_name> mizior </to_contact_name> the <file_keyword> phone call appointment </file_keyword> file
0	share parcak the meet engineer file	file_share	files	share <to_contact_name> parcak </to_contact_name> the <file_keyword> meet engineer </file_keyword> file
0	share papapantoleon the khaki curry file	file_share	files	share <to_contact_name> papapantoleon </to_contact_name> the <file_keyword> khaki curry </file_keyword> file
0	share fasianok the football match file	file_share	files	share <to_contact_name> fasianok </to_contact_name> the <file_keyword> football match </file_keyword> file
0	share macsorley the scheduling taxes file	file_share	files	share <to_contact_name> macsorley </to_contact_name> the <file_keyword> scheduling taxes </file_keyword> file
0	share taher the food drive file	file_share	files	share <to_contact_name> taher </to_contact_name> the <file_keyword> food drive </file_keyword> file
0	share adelugba the principals' meeting file	file_share	files	share <to_contact_name> adelugba </to_contact_name> the <file_keyword> principals' meeting </file_keyword> file
0	share maracinescu the teeth cleaned file	file_share	files	share <to_contact_name> maracinescu </to_contact_name> the <file_keyword> teeth cleaned </file_keyword> file
0	share albera the mom fly in file	file_share	files	share <to_contact_name> albera </to_contact_name> the <file_keyword> mom fly in </file_keyword> file
0	share keith-lee the stabbing file	file_share	files	share <to_contact_name> keith-lee </to_contact_name> the <file_keyword> stabbing </file_keyword> file
0	share sandstroem the trip to michigan file	file_share	files	share <to_contact_name> sandstroem </to_contact_name> the <file_keyword> trip to michigan </file_keyword> file
0	share satalic the school project file	file_share	files	share <to_contact_name> satalic </to_contact_name> the <file_keyword> school project </file_keyword> file
0	share gardner-gausten the mom fly in file	file_share	files	share <to_contact_name> gardner-gausten </to_contact_name> the <file_keyword> mom fly in </file_keyword> file
0	share hammerton the weekly coffee date file	file_share	files	share <to_contact_name> hammerton </to_contact_name> the <file_keyword> weekly coffee date </file_keyword> file
0	share leovic the mom's christmas shopping file	file_share	files	share <to_contact_name> leovic </to_contact_name> the <file_keyword> mom's christmas shopping </file_keyword> file
0	share duseautois the shower prep file	file_share	files	share <to_contact_name> duseautois </to_contact_name> the <file_keyword> shower prep </file_keyword> file
0	share siehndel the dance on the twelfth file	file_share	files	share <to_contact_name> siehndel </to_contact_name> the <file_keyword> dance on the twelfth </file_keyword> file
0	share youkui the reminder file	file_share	files	share <to_contact_name> youkui </to_contact_name> the <file_keyword> reminder </file_keyword> file
0	share ya-ming the veterinarian file	file_share	files	share <to_contact_name> ya-ming </to_contact_name> the <file_keyword> veterinarian </file_keyword> file
0	share dawoodi the appointment with the pet stylist file	file_share	files	share <to_contact_name> dawoodi </to_contact_name> the <file_keyword> appointment with the pet stylist </file_keyword> file
0	share votankova the mom's christmas shopping file	file_share	files	share <to_contact_name> votankova </to_contact_name> the <file_keyword> mom's christmas shopping </file_keyword> file
