0	Show this file with altiokaian	file_share	files	show <file_keyword> this </file_keyword> file with <to_contact_name> altiokaian </to_contact_name>
0	Show this file with almér	file_share	files	show <file_keyword> this </file_keyword> file with <to_contact_name> almér </to_contact_name>
0	Show this file with faczan	file_share	files	show <file_keyword> this </file_keyword> file with <to_contact_name> faczan </to_contact_name>
0	Show this file with curras	file_share	files	show <file_keyword> this </file_keyword> file with <to_contact_name> curras </to_contact_name>
0	Show this file with nusserwanjee	file_share	files	show <file_keyword> this </file_keyword> file with <to_contact_name> nusserwanjee </to_contact_name>
0	Show this file with jun-hong	file_share	files	show <file_keyword> this </file_keyword> file with <to_contact_name> jun-hong </to_contact_name>
0	Show this file with djeneba	file_share	files	show <file_keyword> this </file_keyword> file with <to_contact_name> djeneba </to_contact_name>
0	Show this file with nieksen	file_share	files	show <file_keyword> this </file_keyword> file with <to_contact_name> nieksen </to_contact_name>
0	Show this file with huckridge	file_share	files	show <file_keyword> this </file_keyword> file with <to_contact_name> huckridge </to_contact_name>
0	Show this file with sakhir	file_share	files	show <file_keyword> this </file_keyword> file with <to_contact_name> sakhir </to_contact_name>
0	Show this file with mikolaj	file_share	files	show <file_keyword> this </file_keyword> file with <to_contact_name> mikolaj </to_contact_name>
0	Show this file with lagui	file_share	files	show <file_keyword> this </file_keyword> file with <to_contact_name> lagui </to_contact_name>
0	Show this file with yonashiro	file_share	files	show <file_keyword> this </file_keyword> file with <to_contact_name> yonashiro </to_contact_name>
0	Show this file with landsbygdens	file_share	files	show <file_keyword> this </file_keyword> file with <to_contact_name> landsbygdens </to_contact_name>
0	Show this file with klimm	file_share	files	show <file_keyword> this </file_keyword> file with <to_contact_name> klimm </to_contact_name>
0	Show this file with gegg	file_share	files	show <file_keyword> this </file_keyword> file with <to_contact_name> gegg </to_contact_name>
0	Show this file with folatre	file_share	files	show <file_keyword> this </file_keyword> file with <to_contact_name> folatre </to_contact_name>
0	Show this file with habibifar	file_share	files	show <file_keyword> this </file_keyword> file with <to_contact_name> habibifar </to_contact_name>
0	Show this file with schloezer	file_share	files	show <file_keyword> this </file_keyword> file with <to_contact_name> schloezer </to_contact_name>
0	Show this file with kensing	file_share	files	show <file_keyword> this </file_keyword> file with <to_contact_name> kensing </to_contact_name>
0	Show this file with zanat	file_share	files	show <file_keyword> this </file_keyword> file with <to_contact_name> zanat </to_contact_name>
0	Show this file with eldrett	file_share	files	show <file_keyword> this </file_keyword> file with <to_contact_name> eldrett </to_contact_name>
0	Show this file with glazebrook	file_share	files	show <file_keyword> this </file_keyword> file with <to_contact_name> glazebrook </to_contact_name>
0	Show this file with djeneba	file_share	files	show <file_keyword> this </file_keyword> file with <to_contact_name> djeneba </to_contact_name>
0	Show this file with bisztrai	file_share	files	show <file_keyword> this </file_keyword> file with <to_contact_name> bisztrai </to_contact_name>
0	Show this file with jun-hong	file_share	files	show <file_keyword> this </file_keyword> file with <to_contact_name> jun-hong </to_contact_name>
0	Show this file with lemi?	file_share	files	show <file_keyword> this </file_keyword> file with <to_contact_name> lemi? </to_contact_name>
0	Show this file with villita	file_share	files	show <file_keyword> this </file_keyword> file with <to_contact_name> villita </to_contact_name>
0	Show this file with kantermo	file_share	files	show <file_keyword> this </file_keyword> file with <to_contact_name> kantermo </to_contact_name>
0	Show this file with almér	file_share	files	show <file_keyword> this </file_keyword> file with <to_contact_name> almér </to_contact_name>
0	Show this file with glaucio	file_share	files	show <file_keyword> this </file_keyword> file with <to_contact_name> glaucio </to_contact_name>
0	Show this file with hangl	file_share	files	show <file_keyword> this </file_keyword> file with <to_contact_name> hangl </to_contact_name>
0	Show this file with gegg	file_share	files	show <file_keyword> this </file_keyword> file with <to_contact_name> gegg </to_contact_name>
0	Show this file with bisztrai	file_share	files	show <file_keyword> this </file_keyword> file with <to_contact_name> bisztrai </to_contact_name>
0	Show this file with vidy	file_share	files	show <file_keyword> this </file_keyword> file with <to_contact_name> vidy </to_contact_name>
0	Show this file with castus	file_share	files	show <file_keyword> this </file_keyword> file with <to_contact_name> castus </to_contact_name>
0	Show this file with litzner	file_share	files	show <file_keyword> this </file_keyword> file with <to_contact_name> litzner </to_contact_name>
0	Show this file with babstock	file_share	files	show <file_keyword> this </file_keyword> file with <to_contact_name> babstock </to_contact_name>
0	Show this file with casasolar	file_share	files	show <file_keyword> this </file_keyword> file with <to_contact_name> casasolar </to_contact_name>
0	Show this file with begluk	file_share	files	show <file_keyword> this </file_keyword> file with <to_contact_name> begluk </to_contact_name>
0	Show this file with kalegi	file_share	files	show <file_keyword> this </file_keyword> file with <to_contact_name> kalegi </to_contact_name>
0	Show this file with folatre	file_share	files	show <file_keyword> this </file_keyword> file with <to_contact_name> folatre </to_contact_name>
0	Show this file with koksteinova	file_share	files	show <file_keyword> this </file_keyword> file with <to_contact_name> koksteinova </to_contact_name>
0	Show this file with chiappalone	file_share	files	show <file_keyword> this </file_keyword> file with <to_contact_name> chiappalone </to_contact_name>
0	Show this file with puyraimond	file_share	files	show <file_keyword> this </file_keyword> file with <to_contact_name> puyraimond </to_contact_name>
0	Show this file with antiveduto	file_share	files	show <file_keyword> this </file_keyword> file with <to_contact_name> antiveduto </to_contact_name>
0	Show this file with strijp	file_share	files	show <file_keyword> this </file_keyword> file with <to_contact_name> strijp </to_contact_name>
0	Show this file with sakhir	file_share	files	show <file_keyword> this </file_keyword> file with <to_contact_name> sakhir </to_contact_name>
0	Show this file with mathías	file_share	files	show <file_keyword> this </file_keyword> file with <to_contact_name> mathías </to_contact_name>
0	Show this file with ekoji	file_share	files	show <file_keyword> this </file_keyword> file with <to_contact_name> ekoji </to_contact_name>
0	Show this file with rare?	file_share	files	show <file_keyword> this </file_keyword> file with <to_contact_name> rare? </to_contact_name>
0	Show this file with devoge	file_share	files	show <file_keyword> this </file_keyword> file with <to_contact_name> devoge </to_contact_name>
0	Show this file with baerug	file_share	files	show <file_keyword> this </file_keyword> file with <to_contact_name> baerug </to_contact_name>
0	Show this file with wret	file_share	files	show <file_keyword> this </file_keyword> file with <to_contact_name> wret </to_contact_name>
0	Show this file with ologhlen	file_share	files	show <file_keyword> this </file_keyword> file with <to_contact_name> ologhlen </to_contact_name>
0	Show this file with pangnark	file_share	files	show <file_keyword> this </file_keyword> file with <to_contact_name> pangnark </to_contact_name>
0	Show this file with honinbo	file_share	files	show <file_keyword> this </file_keyword> file with <to_contact_name> honinbo </to_contact_name>
0	Show this file with supaksorn	file_share	files	show <file_keyword> this </file_keyword> file with <to_contact_name> supaksorn </to_contact_name>
0	Show this file with altgenug	file_share	files	show <file_keyword> this </file_keyword> file with <to_contact_name> altgenug </to_contact_name>
0	Show this file with yosomatsu	file_share	files	show <file_keyword> this </file_keyword> file with <to_contact_name> yosomatsu </to_contact_name>
0	Show this file with cardis	file_share	files	show <file_keyword> this </file_keyword> file with <to_contact_name> cardis </to_contact_name>
0	Show this file with kocúriková	file_share	files	show <file_keyword> this </file_keyword> file with <to_contact_name> kocúriková </to_contact_name>
0	Show this file with mikolaj	file_share	files	show <file_keyword> this </file_keyword> file with <to_contact_name> mikolaj </to_contact_name>
0	Show this file with chataigneau	file_share	files	show <file_keyword> this </file_keyword> file with <to_contact_name> chataigneau </to_contact_name>
0	Show this file with cashman	file_share	files	show <file_keyword> this </file_keyword> file with <to_contact_name> cashman </to_contact_name>
0	Show this file with klusackova	file_share	files	show <file_keyword> this </file_keyword> file with <to_contact_name> klusackova </to_contact_name>
0	Show this file with athaldo	file_share	files	show <file_keyword> this </file_keyword> file with <to_contact_name> athaldo </to_contact_name>
0	Show this file with bringuier	file_share	files	show <file_keyword> this </file_keyword> file with <to_contact_name> bringuier </to_contact_name>
0	Show this file with kang	file_share	files	show <file_keyword> this </file_keyword> file with <to_contact_name> kang </to_contact_name>
0	Show this file with jekenyi	file_share	files	show <file_keyword> this </file_keyword> file with <to_contact_name> jekenyi </to_contact_name>
0	Show this file with irinez	file_share	files	show <file_keyword> this </file_keyword> file with <to_contact_name> irinez </to_contact_name>
0	Show this file with baerug	file_share	files	show <file_keyword> this </file_keyword> file with <to_contact_name> baerug </to_contact_name>
0	Show this file with lais	file_share	files	show <file_keyword> this </file_keyword> file with <to_contact_name> lais </to_contact_name>
0	Show this file with chrysopolitanus	file_share	files	show <file_keyword> this </file_keyword> file with <to_contact_name> chrysopolitanus </to_contact_name>
0	Show this file with alecrim	file_share	files	show <file_keyword> this </file_keyword> file with <to_contact_name> alecrim </to_contact_name>
0	Show this file with udescu	file_share	files	show <file_keyword> this </file_keyword> file with <to_contact_name> udescu </to_contact_name>
0	Show this file with ekers	file_share	files	show <file_keyword> this </file_keyword> file with <to_contact_name> ekers </to_contact_name>
0	Show this file with pataki	file_share	files	show <file_keyword> this </file_keyword> file with <to_contact_name> pataki </to_contact_name>
0	Show this file with honinbo	file_share	files	show <file_keyword> this </file_keyword> file with <to_contact_name> honinbo </to_contact_name>
0	Show this file with naimee	file_share	files	show <file_keyword> this </file_keyword> file with <to_contact_name> naimee </to_contact_name>
0	Show this file with kulhanova	file_share	files	show <file_keyword> this </file_keyword> file with <to_contact_name> kulhanova </to_contact_name>
0	Show this file with yarrish	file_share	files	show <file_keyword> this </file_keyword> file with <to_contact_name> yarrish </to_contact_name>
0	Show this file with kantermo	file_share	files	show <file_keyword> this </file_keyword> file with <to_contact_name> kantermo </to_contact_name>
0	Show this file with baerug	file_share	files	show <file_keyword> this </file_keyword> file with <to_contact_name> baerug </to_contact_name>
0	Show this file with shillae	file_share	files	show <file_keyword> this </file_keyword> file with <to_contact_name> shillae </to_contact_name>
0	Show this file with haralds	file_share	files	show <file_keyword> this </file_keyword> file with <to_contact_name> haralds </to_contact_name>
0	Show this file with assenech	file_share	files	show <file_keyword> this </file_keyword> file with <to_contact_name> assenech </to_contact_name>
0	Show this file with morreel	file_share	files	show <file_keyword> this </file_keyword> file with <to_contact_name> morreel </to_contact_name>
0	Show this file with altiokaian	file_share	files	show <file_keyword> this </file_keyword> file with <to_contact_name> altiokaian </to_contact_name>
0	Show this file with nieksen	file_share	files	show <file_keyword> this </file_keyword> file with <to_contact_name> nieksen </to_contact_name>
0	Show this file with cardis	file_share	files	show <file_keyword> this </file_keyword> file with <to_contact_name> cardis </to_contact_name>
0	Show this file with lofts	file_share	files	show <file_keyword> this </file_keyword> file with <to_contact_name> lofts </to_contact_name>
0	Show this file with hangl	file_share	files	show <file_keyword> this </file_keyword> file with <to_contact_name> hangl </to_contact_name>
0	send belcev the band event file	file_share	files	send <to_contact_name> belcev </to_contact_name> the <file_keyword> band event </file_keyword> file
0	send chawa the i birthday file	file_share	files	send <to_contact_name> chawa </to_contact_name> the <file_keyword> i birthday </file_keyword> file
0	send lunnes the dinner with julie file	file_share	files	send <to_contact_name> lunnes </to_contact_name> the <file_keyword> dinner with julie </file_keyword> file
0	send lemartin the birthday dugdale dave file	file_share	files	send <to_contact_name> lemartin </to_contact_name> the <file_keyword> birthday dugdale dave </file_keyword> file
0	send shirotani the meeting joe file	file_share	files	send <to_contact_name> shirotani </to_contact_name> the <file_keyword> meeting joe </file_keyword> file
0	send ke-ik the david times file	file_share	files	send <to_contact_name> ke-ik </to_contact_name> the <file_keyword> david times </file_keyword> file
0	send mizior the phone call appointment file	file_share	files	send <to_contact_name> mizior </to_contact_name> the <file_keyword> phone call appointment </file_keyword> file
0	send parcak the meet engineer file	file_share	files	send <to_contact_name> parcak </to_contact_name> the <file_keyword> meet engineer </file_keyword> file
0	send papapantoleon the khaki curry file	file_share	files	send <to_contact_name> papapantoleon </to_contact_name> the <file_keyword> khaki curry </file_keyword> file
0	send fasianok the football match file	file_share	files	send <to_contact_name> fasianok </to_contact_name> the <file_keyword> football match </file_keyword> file
0	send macsorley the scheduling taxes file	file_share	files	send <to_contact_name> macsorley </to_contact_name> the <file_keyword> scheduling taxes </file_keyword> file
0	send taher the food drive file	file_share	files	send <to_contact_name> taher </to_contact_name> the <file_keyword> food drive </file_keyword> file
0	send adelugba the principals' meeting file	file_share	files	send <to_contact_name> adelugba </to_contact_name> the <file_keyword> principals' meeting </file_keyword> file
0	send maracinescu the teeth cleaned file	file_share	files	send <to_contact_name> maracinescu </to_contact_name> the <file_keyword> teeth cleaned </file_keyword> file
0	send albera the mom fly in file	file_share	files	send <to_contact_name> albera </to_contact_name> the <file_keyword> mom fly in </file_keyword> file
0	send keith-lee the stabbing file	file_share	files	send <to_contact_name> keith-lee </to_contact_name> the <file_keyword> stabbing </file_keyword> file
0	send sandstroem the trip to michigan file	file_share	files	send <to_contact_name> sandstroem </to_contact_name> the <file_keyword> trip to michigan </file_keyword> file
0	send satalic the school project file	file_share	files	send <to_contact_name> satalic </to_contact_name> the <file_keyword> school project </file_keyword> file
0	send gardner-gausten the mom fly in file	file_share	files	send <to_contact_name> gardner-gausten </to_contact_name> the <file_keyword> mom fly in </file_keyword> file
0	send hammerton the weekly coffee date file	file_share	files	send <to_contact_name> hammerton </to_contact_name> the <file_keyword> weekly coffee date </file_keyword> file
0	send leovic the mom's christmas shopping file	file_share	files	send <to_contact_name> leovic </to_contact_name> the <file_keyword> mom's christmas shopping </file_keyword> file
0	send duseautois the shower prep file	file_share	files	send <to_contact_name> duseautois </to_contact_name> the <file_keyword> shower prep </file_keyword> file
0	send siehndel the dance on the twelfth file	file_share	files	send <to_contact_name> siehndel </to_contact_name> the <file_keyword> dance on the twelfth </file_keyword> file
0	send youkui the reminder file	file_share	files	send <to_contact_name> youkui </to_contact_name> the <file_keyword> reminder </file_keyword> file
0	send ya-ming the veterinarian file	file_share	files	send <to_contact_name> ya-ming </to_contact_name> the <file_keyword> veterinarian </file_keyword> file
0	send dawoodi the appointment with the pet stylist file	file_share	files	send <to_contact_name> dawoodi </to_contact_name> the <file_keyword> appointment with the pet stylist </file_keyword> file
0	send votankova the mom's christmas shopping file	file_share	files	send <to_contact_name> votankova </to_contact_name> the <file_keyword> mom's christmas shopping </file_keyword> file
0	send bissen the band event file	file_share	files	send <to_contact_name> bissen </to_contact_name> the <file_keyword> band event </file_keyword> file
0	send essl the well baby appointment file	file_share	files	send <to_contact_name> essl </to_contact_name> the <file_keyword> well baby appointment </file_keyword> file
0	send me'groz the anton ' s graduation file	file_share	files	send <to_contact_name> me'groz </to_contact_name> the <file_keyword> anton ' s graduation </file_keyword> file
0	send lunnes the phone call appointment file	file_share	files	send <to_contact_name> lunnes </to_contact_name> the <file_keyword> phone call appointment </file_keyword> file
0	send dionciel the appointment for shopping file	file_share	files	send <to_contact_name> dionciel </to_contact_name> the <file_keyword> appointment for shopping </file_keyword> file
0	send deagan the marketing meet file	file_share	files	send <to_contact_name> deagan </to_contact_name> the <file_keyword> marketing meet </file_keyword> file
0	send arshari the business nationals file	file_share	files	send <to_contact_name> arshari </to_contact_name> the <file_keyword> business nationals </file_keyword> file
0	send sickinger the get my hair cut file	file_share	files	send <to_contact_name> sickinger </to_contact_name> the <file_keyword> get my hair cut </file_keyword> file
0	send polnišová the manh.txt file	file_share	files	send <to_contact_name> polnišová </to_contact_name> the <file_keyword> manh.txt </file_keyword> file
0	send bazeries the technician will fix my washer file	file_share	files	send <to_contact_name> bazeries </to_contact_name> the <file_keyword> technician will fix my washer </file_keyword> file
0	send kleeberg the christie ' s doctors appointment file	file_share	files	send <to_contact_name> kleeberg </to_contact_name> the <file_keyword> christie ' s doctors appointment </file_keyword> file
0	send nkumbi the khaki curry file	file_share	files	send <to_contact_name> nkumbi </to_contact_name> the <file_keyword> khaki curry </file_keyword> file
0	send kuhno the celebrations file	file_share	files	send <to_contact_name> kuhno </to_contact_name> the <file_keyword> celebrations </file_keyword> file
0	send lucílio the veterinarian file	file_share	files	send <to_contact_name> lucílio </to_contact_name> the <file_keyword> veterinarian </file_keyword> file
0	send taktra the at the park file	file_share	files	send <to_contact_name> taktra </to_contact_name> the <file_keyword> at the park </file_keyword> file
0	send ramut the at the park file	file_share	files	send <to_contact_name> ramut </to_contact_name> the <file_keyword> at the park </file_keyword> file
0	send bokanovich the gsc meeting file	file_share	files	send <to_contact_name> bokanovich </to_contact_name> the <file_keyword> gsc meeting </file_keyword> file
0	send ejdersand the study file	file_share	files	send <to_contact_name> ejdersand </to_contact_name> the <file_keyword> study </file_keyword> file
0	send chawa the appointment for shopping file	file_share	files	send <to_contact_name> chawa </to_contact_name> the <file_keyword> appointment for shopping </file_keyword> file
0	send chastaine the market meet file	file_share	files	send <to_contact_name> chastaine </to_contact_name> the <file_keyword> market meet </file_keyword> file
0	send nielsen the white file	file_share	files	send <to_contact_name> nielsen </to_contact_name> the <file_keyword> white </file_keyword> file
0	send nicomedia the town fire show file	file_share	files	send <to_contact_name> nicomedia </to_contact_name> the <file_keyword> town fire show </file_keyword> file
0	send viriato the endo's copy file	file_share	files	send <to_contact_name> viriato </to_contact_name> the <file_keyword> endo's copy </file_keyword> file
0	send hyunjo the tree service consultation file	file_share	files	send <to_contact_name> hyunjo </to_contact_name> the <file_keyword> tree service consultation </file_keyword> file
0	send sappington the oxford file	file_share	files	send <to_contact_name> sappington </to_contact_name> the <file_keyword> oxford </file_keyword> file
0	send hammerton the bin file	file_share	files	send <to_contact_name> hammerton </to_contact_name> the <file_keyword> bin </file_keyword> file
0	send kleeberg the football match file	file_share	files	send <to_contact_name> kleeberg </to_contact_name> the <file_keyword> football match </file_keyword> file
0	send parmiani the power users manual file	file_share	files	send <to_contact_name> parmiani </to_contact_name> the <file_keyword> power users manual </file_keyword> file
0	send fratita the print off jamaican paper file	file_share	files	send <to_contact_name> fratita </to_contact_name> the <file_keyword> print off jamaican paper </file_keyword> file
0	send ochiba the edgardo pizzolo cv file	file_share	files	send <to_contact_name> ochiba </to_contact_name> the <file_keyword> edgardo pizzolo cv </file_keyword> file
0	send aigrain the dye file	file_share	files	send <to_contact_name> aigrain </to_contact_name> the <file_keyword> dye </file_keyword> file
0	send blackhawk the sunday church service file	file_share	files	send <to_contact_name> blackhawk </to_contact_name> the <file_keyword> sunday church service </file_keyword> file
0	send kwouk the david times file	file_share	files	send <to_contact_name> kwouk </to_contact_name> the <file_keyword> david times </file_keyword> file
0	send lemartin the meet engineer file	file_share	files	send <to_contact_name> lemartin </to_contact_name> the <file_keyword> meet engineer </file_keyword> file
0	send rippingham the job search file	file_share	files	send <to_contact_name> rippingham </to_contact_name> the <file_keyword> job search </file_keyword> file
0	send zambruno the phone call appointment file	file_share	files	send <to_contact_name> zambruno </to_contact_name> the <file_keyword> phone call appointment </file_keyword> file
0	send zihlman the farnsworth file	file_share	files	send <to_contact_name> zihlman </to_contact_name> the <file_keyword> farnsworth </file_keyword> file
0	send lancza the business nationals file	file_share	files	send <to_contact_name> lancza </to_contact_name> the <file_keyword> business nationals </file_keyword> file
0	send kinonagusa the o chem final file	file_share	files	send <to_contact_name> kinonagusa </to_contact_name> the <file_keyword> o chem final </file_keyword> file
0	send ochiba the baking file	file_share	files	send <to_contact_name> ochiba </to_contact_name> the <file_keyword> baking </file_keyword> file
0	send sappington the reminder file	file_share	files	send <to_contact_name> sappington </to_contact_name> the <file_keyword> reminder </file_keyword> file
0	send parmiani the fire drill file	file_share	files	send <to_contact_name> parmiani </to_contact_name> the <file_keyword> fire drill </file_keyword> file
0	send adelugba the test this app file	file_share	files	send <to_contact_name> adelugba </to_contact_name> the <file_keyword> test this app </file_keyword> file
0	send cerabone the pay eighty dollars to cable file	file_share	files	send <to_contact_name> cerabone </to_contact_name> the <file_keyword> pay eighty dollars to cable </file_keyword> file
0	send makari the doctor lavani file	file_share	files	send <to_contact_name> makari </to_contact_name> the <file_keyword> doctor lavani </file_keyword> file
0	send nicomedia the caitlin ' s birthday file	file_share	files	send <to_contact_name> nicomedia </to_contact_name> the <file_keyword> caitlin ' s birthday </file_keyword> file
0	send jelesava the new appointment file	file_share	files	send <to_contact_name> jelesava </to_contact_name> the <file_keyword> new appointment </file_keyword> file
0	send bibhuti the holiday plan file	file_share	files	send <to_contact_name> bibhuti </to_contact_name> the <file_keyword> holiday plan </file_keyword> file
